id,title,overview,release_date,popularity,vote_count,vote_average,poster_path,backdrop_path,original_language,genres,runtime,budget,revenue,homepage,tagline,status,imdb_id,production_companies,production_countries,spoken_languages,last_updated
1399515,The Adventure,"Because of a meteor shower, 43-year-old Huang Yuqi (Jia Bing) and 18-year-old himself (Wang Hao) exchanged souls, and the man and the sophomore boy accidentally fell into a burst of dual-time laughter.",2025-08-08,1.3146,1,10,/edDMKFhgOLF73RosfRhwkTzUaNU.jpg,/9CvkkSqukN8QymWaudrpSArrwLL.jpg,zh,"[{""id"": 35, ""name"": ""Comedy""}]",0,0,0,"","",Released,,"[{""id"": 227864, ""name"": ""北京超乐无限文化传播有限公司"", ""logo_path"": null, ""origin_country"": """"}, {""id"": 96956, ""name"": ""Maoyan Entertainment"", ""logo_path"": null, ""origin_country"": ""CN""}, {""id"": 14714, ""name"": ""China Film Group Corporation"", ""logo_path"": ""/dSHaVKtBCpMU5VP9wMbTkqov62i.png"", ""origin_country"": ""CN""}, {""id"": 100127, ""name"": ""Fun Age Pictures"", ""logo_path"": ""/d65b4AlGT5tXW7zzNiSkqvXutQc.png"", ""origin_country"": ""CN""}, {""id"": 78952, ""name"": ""Wanda Pictures"", ""logo_path"": ""/zRBHUxapVA1FLR3dSa0xcLvzn1D.png"", ""origin_country"": ""CN""}]","[{""name"": ""China"", ""iso_3166_1"": ""CN""}]","[{""name"": ""普通话"", ""iso_639_1"": ""zh"", ""english_name"": ""Mandarin""}]",2025-11-28 04:21:21.690942
255709,Hope,"After 8-year-old So-won narrowly survives a brutal sexual assault, her family labors to help her heal while coping with their own rage and grief.",2013-10-02,3.2324,808,8.395,/x9yjkm9gIz5qI5fJMUTfBnWiB2o.jpg,/4Nx40jwpoTHPjCWNGoaZ6kaoGxa.jpg,ko,"[{""id"": 18, ""name"": ""Drama""}]",122,0,0,"",We won't let her shed tears again.,Released,tt3153634,"[{""id"": 7819, ""name"": ""Lotte Entertainment"", ""logo_path"": ""/ghFZAt4edln0M7BzDExyYMzUGX1.png"", ""origin_country"": ""KR""}, {""id"": 112850, ""name"": ""Film Momentum"", ""logo_path"": ""/r2AJGoS8KoP4AeozBEe5LTY5BsY.png"", ""origin_country"": ""KR""}, {""id"": 81594, ""name"": ""Michigan Venture Capital"", ""logo_path"": null, ""origin_country"": ""KR""}]","[{""name"": ""South Korea"", ""iso_3166_1"": ""KR""}]","[{""name"": ""한국어/조선말"", ""iso_639_1"": ""ko"", ""english_name"": ""Korean""}]",2025-11-28 04:21:21.690942
761053,Gabriel's Inferno: Part III,The final part of the film adaption of the erotic romance novel Gabriel's Inferno written by an anonymous Canadian author under the pen name Sylvain Reynard.,2020-11-19,4.2024,1070,8.361,/fYtHxTxlhzD4QWfEbrC1rypysSD.jpg,/fQq1FWp1rC89xDrRMuyFJdFUdMd.jpg,en,"[{""id"": 10749, ""name"": ""Romance""}, {""id"": 18, ""name"": ""Drama""}]",102,0,0,"","",Released,tt13535456,"[{""id"": 92153, ""name"": ""PassionFlix"", ""logo_path"": ""/psjvYkjjgAPtS8utnFYDM8t8yi7.png"", ""origin_country"": ""US""}]","[{""name"": ""United States of America"", ""iso_3166_1"": ""US""}]","[{""name"": ""English"", ""iso_639_1"": ""en"", ""english_name"": ""English""}]",2025-11-28 04:21:21.690942
1377505,Spithood,"When a dangerous patient escapes confinement in a mental asylum and goes on a rampant killing spree, the night shift staff face their worst nightmare, as they fight for survival.",2024-10-25,45.5744,13,5.038,/zV5djt7n4IZDR0ixq7hsafNTj91.jpg,/h4YdTMJ6h0Poyo5XHn8vk4wTczT.jpg,en,"[{""id"": 27, ""name"": ""Horror""}, {""id"": 53, ""name"": ""Thriller""}]",58,0,0,"","",Released,tt18259224,"[{""id"": 110060, ""name"": ""Firestick Films"", ""logo_path"": ""/vlQMY1NYel1rhmkD7bMHg0sdGLJ.png"", ""origin_country"": ""AU""}, {""id"": 235814, ""name"": ""Hidden Ridge Productions"", ""logo_path"": null, ""origin_country"": """"}]","[{""name"": ""Australia"", ""iso_3166_1"": ""AU""}]","[{""name"": ""English"", ""iso_639_1"": ""en"", ""english_name"": ""English""}]",2025-11-28 04:21:21.690942
1425122,A Very Jonas Christmas Movie,"Kevin, Nick, and Joe Jonas face a series of escalating obstacles as they struggle to make it from London to New York in time to spend Christmas with their families.",2025-11-10,31.0463,57,6.554,/kGLgaDrYWmTAdRFzGP5pBquRnhO.jpg,/ajYw16ISz3qsdYTg4zy5rob1iAQ.jpg,en,"[{""id"": 35, ""name"": ""Comedy""}, {""id"": 10402, ""name"": ""Music""}]",78,0,0,https://www.disneyplus.com/browse/entity-0a35b05e-b39a-4d17-8786-263962268cbe,Let it bro. Let it bro. Let it bro.,Released,tt35600079,"[{""id"": 236166, ""name"": ""20th Television"", ""logo_path"": ""/8rFlu5iytnjsciYXZDw90ktllCI.png"", ""origin_country"": ""US""}, {""id"": 274572, ""name"": ""Copper Cup Entertainment"", ""logo_path"": null, ""origin_country"": ""US""}, {""id"": 152686, ""name"": ""The Walk-Up Company"", ""logo_path"": ""/1tAOiOyXA2baRS3jq9X8I2alhcI.png"", ""origin_country"": ""US""}, {""id"": 12292, ""name"": ""Temple Hill Entertainment"", ""logo_path"": ""/5J93SHsuvIV32AE9oSbMi02pqw9.png"", ""origin_country"": ""US""}, {""id"": 208750, ""name"": ""Fishbach Productions"", ""logo_path"": null, ""origin_country"": ""US""}, {""id"": 280547, ""name"": ""Powered by Jonas"", ""logo_path"": null, ""origin_country"": ""US""}]","[{""name"": ""United States of America"", ""iso_3166_1"": ""US""}]","[{""name"": ""English"", ""iso_639_1"": ""en"", ""english_name"": ""English""}]",2025-11-28 04:21:21.690942
92060,Michael Jackson's Thriller,"A night at the movies turns terrifying when Michael and his date are attacked by zombies. Released at the height of Thriller’s success, the short film redefined the music video, broke racial barriers, and became the first inducted into the U.S. National Film Registry.",1983-11-14,5.272,726,8.2,/dYHGoPMkZMVuBA4EydmDQMo1EEv.jpg,/aVefEnQsfNPUrgsuMszTDt165P0.jpg,en,"[{""id"": 27, ""name"": ""Horror""}, {""id"": 53, ""name"": ""Thriller""}, {""id"": 10402, ""name"": ""Music""}]",14,500000,0,"","",Released,tt0088263,"[{""id"": 19222, ""name"": ""Optimum Productions"", ""logo_path"": null, ""origin_country"": ""US""}]","[{""name"": ""United States of America"", ""iso_3166_1"": ""US""}]","[{""name"": ""English"", ""iso_639_1"": ""en"", ""english_name"": ""English""}]",2025-11-28 04:21:21.690942
1186532,The Forge,"19 year old Isaiah Wright lives for basketball and video games. A year out of high school, he has no job, no plans, and no idea how to be a man. At odds with his single mother Cynthia, Isaiah is given an ultimatum – to step up or move out. Feeling the pull from his friends and the push from his mom, Isaiah is hired by Moore Fitness, unaware of how the owner will personally impact his life. With the prayers of his mother and unexpected guidance from his new mentor, Isaiah is forced to deal with his past, sacrifice his selfishness and discover how God might have a greater purpose for his life.",2024-08-22,3.0811,308,8.278,/oranxontIQRmhuyQlkoAwxpeBYz.jpg,/18X5mXS1SpQy5rygEcpbmzUdkVP.jpg,en,"[{""id"": 18, ""name"": ""Drama""}, {""id"": 10751, ""name"": ""Family""}]",123,5000000,40392664,https://www.theforgemovie.com/,Whoever wants the next generation the most will get them.,Released,tt26731216,"[{""id"": 10156, ""name"": ""Affirm Films"", ""logo_path"": ""/bWjWWQfiyZh9AkGYCkx1NcVdSvn.png"", ""origin_country"": ""US""}, {""id"": 69411, ""name"": ""Kendrick Brothers"", ""logo_path"": ""/jkkrsMgj9Gbb8g17NUnLqlfmnmv.png"", ""origin_country"": ""US""}, {""id"": 3291, ""name"": ""Provident Films"", ""logo_path"": null, ""origin_country"": ""US""}]","[{""name"": ""United States of America"", ""iso_3166_1"": ""US""}]","[{""name"": ""English"", ""iso_639_1"": ""en"", ""english_name"": ""English""}]",2025-11-28 04:21:21.690942
436969,The Suicide Squad,"Supervillains Harley Quinn, Bloodsport, Peacemaker and a collection of nutty cons at Belle Reve prison join the super-secret, super-shady Task Force X as they are dropped off at the remote, enemy-infused island of Corto Maltese.",2021-07-28,12.3957,9240,7.478,/q61qEyssk2ku3okWICKArlAdhBn.jpg,/jlGmlFOcfo8n5tURmhC7YVd4Iyy.jpg,en,"[{""id"": 28, ""name"": ""Action""}, {""id"": 35, ""name"": ""Comedy""}, {""id"": 12, ""name"": ""Adventure""}]",132,185000000,168717425,https://www.thesuicidesquad.net,They’re dying to save the world.,Released,tt6334354,"[{""id"": 128064, ""name"": ""DC Films"", ""logo_path"": ""/13F3Jf7EFAcREU0xzZqJnVnyGXu.png"", ""origin_country"": ""US""}, {""id"": 507, ""name"": ""Atlas Entertainment"", ""logo_path"": ""/aRmHe6GWxYMRCQljF75rn2B9Gv8.png"", ""origin_country"": ""US""}, {""id"": 11565, ""name"": ""The Safran Company"", ""logo_path"": ""/odU3l6csuBmXUrzFm6araUgEUHQ.png"", ""origin_country"": ""US""}, {""id"": 174, ""name"": ""Warner Bros. Pictures"", ""logo_path"": ""/ingPVoHnINIrFR7WHmYux1f5pES.png"", ""origin_country"": ""US""}]","[{""name"": ""United States of America"", ""iso_3166_1"": ""US""}]","[{""name"": ""English"", ""iso_639_1"": ""en"", ""english_name"": ""English""}, {""name"": ""Français"", ""iso_639_1"": ""fr"", ""english_name"": ""French""}, {""name"": ""Español"", ""iso_639_1"": ""es"", ""english_name"": ""Spanish""}]",2025-11-28 04:21:21.690942
1429738,Tee Yai: Born to Be Bad,"In 1980s Bangkok, a wily thief stages a series of daring heists, baffling the authorities and the public — until one cop sets out to take him down.",2025-11-12,66.4793,36,4.847,/ig00LBM2rv4fmCJOPATyRWOJnlL.jpg,/xmnqFHhGNYHf5JFy4GSfiIEG0ly.jpg,th,"[{""id"": 80, ""name"": ""Crime""}, {""id"": 28, ""name"": ""Action""}, {""id"": 18, ""name"": ""Drama""}]",117,0,0,https://www.netflix.com/title/81739747,"Meet the ""King of Thieves"", whose life is coming to an end.",Released,tt35669044,"[{""id"": 207401, ""name"": ""18 Tanwa"", ""logo_path"": null, ""origin_country"": ""TH""}]","[{""name"": ""Thailand"", ""iso_3166_1"": ""TH""}]","[{""name"": ""ภาษาไทย"", ""iso_639_1"": ""th"", ""english_name"": ""Thai""}]",2025-11-28 04:21:21.690942
474350,It Chapter Two,"27 years after overcoming the malevolent supernatural entity Pennywise, the former members of the Losers' Club, who have grown up and moved away from Derry, are brought back together by a devastating phone call.",2019-09-04,28.5035,9257,6.838,/zfE0R94v1E8cuKAerbskfD3VfUt.jpg,/8moTOzunF7p40oR5XhlDvJckOSW.jpg,en,"[{""id"": 27, ""name"": ""Horror""}, {""id"": 53, ""name"": ""Thriller""}]",169,79000000,473123154,http://www.it-movie.net/,You'll float again.,Released,tt7349950,"[{""id"": 12, ""name"": ""New Line Cinema"", ""logo_path"": ""/2ycs64eqV5rqKYHyQK0GVoKGvfX.png"", ""origin_country"": ""US""}, {""id"": 829, ""name"": ""Vertigo Entertainment"", ""logo_path"": ""/iJo9zP5QCKyBsmKSOcvXd6UDNih.png"", ""origin_country"": ""US""}, {""id"": 152809, ""name"": ""Double Dream"", ""logo_path"": ""/bdtAEMJpIaVW78c78POabARpotx.png"", ""origin_country"": ""US""}, {""id"": 118854, ""name"": ""Rideback"", ""logo_path"": ""/g9LPNlQFoDcHjfnvrEqFmeIaDrZ.png"", ""origin_country"": ""US""}]","[{""name"": ""United States of America"", ""iso_3166_1"": ""US""}]","[{""name"": ""English"", ""iso_639_1"": ""en"", ""english_name"": ""English""}]",2025-11-28 04:21:21.690942
238,The Godfather,"Spanning the years 1945 to 1955, a chronicle of the fictional Italian-American Corleone crime family. When organized crime family patriarch, Vito Corleone barely survives an attempt on his life, his youngest son, Michael steps in to take care of the would-be killers, launching a campaign of bloody revenge.",1972-03-14,23.9695,22095,8.684,/3bhkrj58Vtu7enYsRolD1fZdja1.jpg,/tmU7GeKVybMWFButWEGl2M4GeiP.jpg,en,"[{""id"": 18, ""name"": ""Drama""}, {""id"": 80, ""name"": ""Crime""}]",175,6000000,245066411,http://www.thegodfather.com/,An offer you can't refuse.,Released,tt0068646,"[{""id"": 4, ""name"": ""Paramount Pictures"", ""logo_path"": ""/jay6WcMgagAklUt7i9Euwj1pzTF.png"", ""origin_country"": ""US""}, {""id"": 10211, ""name"": ""Alfran Productions"", ""logo_path"": null, ""origin_country"": ""US""}]","[{""name"": ""United States of America"", ""iso_3166_1"": ""US""}]","[{""name"": ""English"", ""iso_639_1"": ""en"", ""english_name"": ""English""}, {""name"": ""Italiano"", ""iso_639_1"": ""it"", ""english_name"": ""Italian""}, {""name"": ""Latin"", ""iso_639_1"": ""la"", ""english_name"": ""Latin""}]",2025-11-28 04:21:21.690942
240,The Godfather Part II,"In the continuing saga of the Corleone crime family, a young Vito Corleone grows up in Sicily and in 1910s New York. In the 1950s, Michael Corleone attempts to expand the family business into Las Vegas, Hollywood and Cuba.",1974-12-20,16.0119,13357,8.57,/ecBRkXerAZqRRUfR8Lt3L3Dh6J5.jpg,/kGzFbGhp99zva6oZODW5atUtnqi.jpg,en,"[{""id"": 18, ""name"": ""Drama""}, {""id"": 80, ""name"": ""Crime""}]",202,13000000,102600000,"",The rise and fall of the Corleone empire.,Released,tt0071562,"[{""id"": 4, ""name"": ""Paramount Pictures"", ""logo_path"": ""/jay6WcMgagAklUt7i9Euwj1pzTF.png"", ""origin_country"": ""US""}, {""id"": 536, ""name"": ""The Coppola Company"", ""logo_path"": null, ""origin_country"": ""US""}]","[{""name"": ""United States of America"", ""iso_3166_1"": ""US""}]","[{""name"": ""English"", ""iso_639_1"": ""en"", ""english_name"": ""English""}, {""name"": ""Italiano"", ""iso_639_1"": ""it"", ""english_name"": ""Italian""}, {""name"": ""Latin"", ""iso_639_1"": ""la"", ""english_name"": ""Latin""}, {""name"": ""Español"", ""iso_639_1"": ""es"", ""english_name"": ""Spanish""}]",2025-11-28 04:21:21.690942
10483,Death Race,"Terminal Island, New York: 2020. Overcrowding in the US penal system has reached a breaking point. Prisons have been turned over to a monolithic Weyland Corporation, which sees jails full of thugs as an opportunity for televised sport. Adrenalized inmates, a global audience hungry for violence and a spectacular, enclosed arena come together to form the 'Death Race', the biggest, most brutal event.",2008-08-22,18.4139,3983,6.29,/5A79GeOb3uChQ0l0ZDjDyODKQp3.jpg,/bSqhsOTMnp0L6xGSHCAArXXURNy.jpg,en,"[{""id"": 28, ""name"": ""Action""}, {""id"": 53, ""name"": ""Thriller""}, {""id"": 878, ""name"": ""Science Fiction""}]",105,45000000,76000000,http://www.deathracemovie.net/,Get ready for a killer ride.,Released,tt0452608,"[{""id"": 248, ""name"": ""Impact Pictures"", ""logo_path"": null, ""origin_country"": ""GB""}, {""id"": 33, ""name"": ""Universal Pictures"", ""logo_path"": ""/8lvHyhjr8oUKOOy2dKXoALWKdp0.png"", ""origin_country"": ""US""}, {""id"": 7295, ""name"": ""Relativity Media"", ""logo_path"": ""/5MYE96QiE5a5oFhXxFb4y8ILSpw.png"", ""origin_country"": ""US""}, {""id"": 44, ""name"": ""Cruise/Wagner Productions"", ""logo_path"": ""/6Hs6K20Hz1W9W1Tiam5QN2Kpx8V.png"", ""origin_country"": ""US""}, {""id"": 28121, ""name"": ""H2S2 Filmproduktionsgesellschaft"", ""logo_path"": null, ""origin_country"": """"}, {""id"": 7419, ""name"": ""Scion Films"", ""logo_path"": ""/xePgQxppZtgSMICGgnKAWlVobt7.png"", ""origin_country"": ""GB""}]","[{""name"": ""United Kingdom"", ""iso_3166_1"": ""GB""}, {""name"": ""United States of America"", ""iso_3166_1"": ""US""}, {""name"": ""Germany"", ""iso_3166_1"": ""DE""}]","[{""name"": ""English"", ""iso_639_1"": ""en"", ""english_name"": ""English""}]",2025-11-28 04:21:21.690942
1033462,Bureau 749,A traumatized young man with physical abnormalities is forced to join a mysterious bureau to confront a disaster spreading across the earth caused by an unknown creature. He embarks on an adventure uncovering mysteries about his life.,2024-10-01,470.2154,35,5.6,/flykCMw22y6yv8vKnBjmsW3pneo.jpg,/lf8IZ86ajGpgbuyHCZrXUeAMmvy.jpg,zh,"[{""id"": 28, ""name"": ""Action""}, {""id"": 12, ""name"": ""Adventure""}, {""id"": 878, ""name"": ""Science Fiction""}]",123,0,51706251,"","",Released,tt10210064,"[{""id"": 139104, ""name"": ""华文映像影视传媒有限公司"", ""logo_path"": null, ""origin_country"": ""CN""}, {""id"": 3393, ""name"": ""Huayi Brothers Pictures"", ""logo_path"": ""/rv37YfhPg03ugK252E4oXMzgvks.png"", ""origin_country"": ""CN""}, {""id"": 148024, ""name"": ""Beijing Culture"", ""logo_path"": ""/hwoojywsskxB91jw2QwgLeTwMr.png"", ""origin_country"": ""CN""}, {""id"": 84946, ""name"": ""Tencent Penguin Pictures"", ""logo_path"": ""/8wrAXwrNZ5zHImKb0SyVLQbXkaM.png"", ""origin_country"": ""CN""}, {""id"": 239977, ""name"": ""北京强电传媒有限公司"", ""logo_path"": null, ""origin_country"": """"}]","[{""name"": ""China"", ""iso_3166_1"": ""CN""}]","[{""name"": ""普通话"", ""iso_639_1"": ""zh"", ""english_name"": ""Mandarin""}]",2025-11-28 04:21:21.690942
1327862,Regretting You,"Morgan Grant and her daughter Clara explore what's left behind after a devastating accident reveals a shocking betrayal and forces them to confront family secrets, redefine love, and rediscover each other.",2025-10-22,96.4388,97,7.077,/z4gVnxTaks3anTycwKjDmvQSuWt.jpg,/m3WlBJJRbFPaut1QS0PbOG8Wezy.jpg,en,"[{""id"": 10749, ""name"": ""Romance""}, {""id"": 18, ""name"": ""Drama""}]",116,30000000,83106420,https://www.regrettingyoumovie.com,Risk everything. Regret nothing.,Released,tt33088452,"[{""id"": 95966, ""name"": ""Harbinger Pictures"", ""logo_path"": null, ""origin_country"": ""US""}, {""id"": 140519, ""name"": ""Frayed Pages Media"", ""logo_path"": null, ""origin_country"": ""US""}, {""id"": 216687, ""name"": ""Domain Entertainment"", ""logo_path"": ""/kKVYqekveOvLK1IgqdJojLjQvtu.png"", ""origin_country"": ""US""}, {""id"": 47, ""name"": ""Constantin Film"", ""logo_path"": ""/i7Z9ot2o3N5Sa3HrF09kniFs2y8.png"", ""origin_country"": ""DE""}, {""id"": 220749, ""name"": ""north.five.six"", ""logo_path"": null, ""origin_country"": ""US""}]","[{""name"": ""United States of America"", ""iso_3166_1"": ""US""}, {""name"": ""Germany"", ""iso_3166_1"": ""DE""}]","[{""name"": ""English"", ""iso_639_1"": ""en"", ""english_name"": ""English""}]",2025-11-28 04:21:21.690942
62201,Shahenshah,"Inspector Srivastav is framed by a wily and cunning gangster, J.K., and unable to prove his innocence, hangs himself, leaving behind his wife, and son, Vijay. Years later, Vijay has grown up and has joined the police force as an Inspector. Unlike his dad, he is corrupt and does accept bribes to turn a nelson's eye to crime. The City Police are assigned the task of apprehending a customed man called ""Shahenshah"", who operates at night and targets, tries and kills gangsters in a ""Judge and Executioner ""style. No one knows the real identity of Shahenshah, as he is feared by the police department, and respected by the poor and middle-class.",1988-01-29,33.3726,23,6.2,/g8noCys7ElC73lcluN4kDeUzhYQ.jpg,/qDyFe7gMnom72qfUEYzWrgwB4ss.jpg,hi,"[{""id"": 28, ""name"": ""Action""}]",180,0,0,"","",Released,tt0093949,"[{""id"": 64777, ""name"": ""Vision Film"", ""logo_path"": null, ""origin_country"": """"}]","[{""name"": ""India"", ""iso_3166_1"": ""IN""}]","[{""name"": ""हिन्दी"", ""iso_639_1"": ""hi"", ""english_name"": ""Hindi""}]",2025-11-28 04:21:21.690942
324857,Spider-Man: Into the Spider-Verse,"Struggling to find his place in the world while juggling school and family, Brooklyn teenager Miles Morales is unexpectedly bitten by a radioactive spider and develops unfathomable powers just like the one and only Spider-Man. While wrestling with the implications of his new abilities, Miles discovers a super collider created by the madman Wilson ""Kingpin"" Fisk, causing others from across the Spider-Verse to be inadvertently transported to his dimension.",2018-12-06,12.3892,16620,8.395,/iiZZdoQBEYBv6id8su7ImL0oCbD.jpg,/8mnXR9rey5uQ08rZAvzojKWbDQS.jpg,en,"[{""id"": 16, ""name"": ""Animation""}, {""id"": 28, ""name"": ""Action""}, {""id"": 12, ""name"": ""Adventure""}, {""id"": 878, ""name"": ""Science Fiction""}]",117,90000000,393602435,https://www.sonypictures.com/movies/spidermanintothespiderverse,More than one wears the mask.,Released,tt4633694,"[{""id"": 5, ""name"": ""Columbia Pictures"", ""logo_path"": ""/71BqEFAF4V3qjjMPCpLuyJFB9A.png"", ""origin_country"": ""US""}, {""id"": 77973, ""name"": ""Lord Miller"", ""logo_path"": ""/eUZ0kfE4uyO0JYIrjgUSOqWPqjK.png"", ""origin_country"": ""US""}, {""id"": 84041, ""name"": ""Pascal Pictures"", ""logo_path"": ""/nw4kyc29QRpNtFbdsBHkRSFavvt.png"", ""origin_country"": ""US""}, {""id"": 2251, ""name"": ""Sony Pictures Animation"", ""logo_path"": ""/5ilV5mH3gxTEU7p5wjxptHvXkyr.png"", ""origin_country"": ""US""}, {""id"": 14439, ""name"": ""Arad Productions"", ""logo_path"": null, ""origin_country"": ""US""}, {""id"": 7505, ""name"": ""Marvel Entertainment"", ""logo_path"": ""/837VMM4wOkODc1idNxGT0KQJlej.png"", ""origin_country"": ""US""}]","[{""name"": ""United States of America"", ""iso_3166_1"": ""US""}]","[{""name"": ""English"", ""iso_639_1"": ""en"", ""english_name"": ""English""}, {""name"": ""日本語"", ""iso_639_1"": ""ja"", ""english_name"": ""Japanese""}, {""name"": ""Español"", ""iso_639_1"": ""es"", ""english_name"": ""Spanish""}]",2025-11-28 04:21:21.690942
572154,Rascal Does Not Dream of a Dreaming Girl,"In Fujisawa, Sakuta Azusagawa is in his second year of high school. Blissful days with his girlfriend and upperclassman, Mai Sakurajima, are interrupted by the appearance of his first crush, Shoko Makinohara.",2019-06-15,2.8346,567,8.2,/gsRpizQa3fw1um8v7EvFVXvxD6u.jpg,/5MgMCnslrxQfOfaq6T5ndkLlcCk.jpg,ja,"[{""id"": 16, ""name"": ""Animation""}, {""id"": 10749, ""name"": ""Romance""}, {""id"": 18, ""name"": ""Drama""}, {""id"": 14, ""name"": ""Fantasy""}]",90,0,0,https://rascaldoesnotdream.com/dreaming-girl,"",Released,tt9881586,"[{""id"": 121589, ""name"": ""CloverWorks"", ""logo_path"": ""/kZvTniBgpTzAThHCa0OZ1FJtRjy.png"", ""origin_country"": ""JP""}, {""id"": 2883, ""name"": ""Aniplex"", ""logo_path"": ""/rDYExnBV61jGQnkhVVrPN4Yl7O1.png"", ""origin_country"": ""JP""}, {""id"": 86839, ""name"": ""ABC Animation"", ""logo_path"": ""/cnOJAkVVmKZLIzmgw4fRRZ2dctT.png"", ""origin_country"": ""JP""}, {""id"": 2073, ""name"": ""KADOKAWA"", ""logo_path"": ""/tWxRSaKmRJNTcmtlXsmn5R4KOSU.png"", ""origin_country"": ""JP""}, {""id"": 157002, ""name"": ""Tokyo MX"", ""logo_path"": ""/hSdroyVthq3CynxTIIY7lnS8w1.png"", ""origin_country"": ""JP""}, {""id"": 81418, ""name"": ""Nagoya Broadcasting Network"", ""logo_path"": ""/kW9bMQqnMFtPHvdoyCDpRqh7Gxt.png"", ""origin_country"": ""JP""}, {""id"": 118502, ""name"": ""BS11"", ""logo_path"": ""/JQ5bx6n7Qmdmyqz6sqjo5Fz2iR.png"", ""origin_country"": ""JP""}, {""id"": 142186, ""name"": ""Hakuhodo DY Music & Pictures"", ""logo_path"": ""/bdXTOuU7PdsDtQngyM7vb47zePs.png"", ""origin_country"": ""JP""}]","[{""name"": ""Japan"", ""iso_3166_1"": ""JP""}]","[{""name"": ""日本語"", ""iso_639_1"": ""ja"", ""english_name"": ""Japanese""}]",2025-11-28 04:21:21.690942
10494,Perfect Blue,"Rising pop star Mima quits singing to pursue a career as an actress. After she takes up a role on a popular detective show, her handlers and collaborators begin turning up murdered. Harboring feelings of guilt and haunted by visions of her former self, Mima's reality and fantasy meld into a frenzied paranoia.",1998-02-28,6.6611,2983,8.299,/6WTiOCfDPP8XV4jqfloiVWf7KHq.jpg,/1YRtgjLb5xxUb2rsNRnr54Oc0B2.jpg,ja,"[{""id"": 16, ""name"": ""Animation""}, {""id"": 53, ""name"": ""Thriller""}]",82,3000000,683666,https://gkids.com/films/perfect-blue,"""excuse me... who are you?""",Released,tt0156887,"[{""id"": 3464, ""name"": ""Madhouse"", ""logo_path"": ""/9k0nr75nwnNeT2MHerf1OXJN0hj.png"", ""origin_country"": ""JP""}, {""id"": 185544, ""name"": ""Rex Entertainment"", ""logo_path"": null, ""origin_country"": ""JP""}, {""id"": 201821, ""name"": ""Kotobuki Seihan Printing"", ""logo_path"": null, ""origin_country"": ""JP""}, {""id"": 4868, ""name"": ""Asahi Broadcasting Corporation"", ""logo_path"": ""/3ExeT4zGXBFU7ei1crOvuzKnc1z.png"", ""origin_country"": ""JP""}, {""id"": 201822, ""name"": ""Fangs"", ""logo_path"": null, ""origin_country"": ""JP""}, {""id"": 30652, ""name"": ""ONIRO"", ""logo_path"": null, ""origin_country"": ""JP""}]","[{""name"": ""Japan"", ""iso_3166_1"": ""JP""}]","[{""name"": ""日本語"", ""iso_639_1"": ""ja"", ""english_name"": ""Japanese""}]",2025-11-28 04:21:21.690942
535809,A Shoe Addict's Christmas,"As Christmas approaches, a department store worker whose life lacks fulfillment meets her guardian angel, who offers her a chance to change her circumstances by magically transporting her to Christmases past whenever she tries on a new pair of shoes.",2018-11-25,27.6395,74,6.2,/xAMSWUBSG8rhXuU9JmQItWNmn4U.jpg,/rToVdkhRishbanfsw0QbTMAyA3T.jpg,en,"[{""id"": 10749, ""name"": ""Romance""}, {""id"": 18, ""name"": ""Drama""}, {""id"": 10770, ""name"": ""TV Movie""}, {""id"": 14, ""name"": ""Fantasy""}]",90,0,0,http://www.hallmarkchannel.com/a-shoe-addicts-christmas,"",Released,tt8634202,"[{""id"": 6438, ""name"": ""Muse Entertainment"", ""logo_path"": ""/hQVRii7CRnfG0rowSEc6ibt2Pke.png"", ""origin_country"": ""CA""}, {""id"": 48782, ""name"": ""Head First Productions"", ""logo_path"": null, ""origin_country"": ""US""}, {""id"": 184816, ""name"": ""iCandy Production"", ""logo_path"": ""/a0Dcjk6gPSzlcC2A2K8ynJwpSVl.png"", ""origin_country"": ""US""}]","[{""name"": ""Canada"", ""iso_3166_1"": ""CA""}]","[{""name"": ""English"", ""iso_639_1"": ""en"", ""english_name"": ""English""}]",2025-11-28 04:21:21.690942
