id,title,overview,release_date,popularity,vote_count,vote_average,poster_path,backdrop_path,original_language,genres,runtime,budget,revenue,homepage,tagline,status,imdb_id,production_companies,production_countries,spoken_languages,last_updated
1468417,First Moon,"A young waitress is abducted by a religious cult, who are hell-bent on curing her from a sexually transmitted werewolf virus - or killing her in the process. Will she escape before the first full moon?",2025-05-06,126.2876,43,4.116,/hcjYvv4k9qs0lDG1Q3GIglT30IW.jpg,/7h0qCqkuQzmG5vXN3lGBc06reLd.jpg,en,"[{""id"": 27, ""name"": ""Horror""}, {""id"": 53, ""name"": ""Thriller""}]",97,0,0,"",Fear the monster within,Released,tt26920256,[],[],"[{""name"": ""English"", ""iso_639_1"": ""en"", ""english_name"": ""English""}]",2025-11-23 04:33:05.022549
1382406,Striking Rescue,A veteran Muay Thai expert goes on a take-no-prisoners mission of revenge after his wife and daughter are brutally murdered by mysterious forces.,2024-12-05,21.5324,142,7.43,/nML8rOI4GOiiEsXgknuhZeUF8M7.jpg,/yth78N88nwokepnOe5atwPGfTL1.jpg,zh,"[{""id"": 28, ""name"": ""Action""}, {""id"": 80, ""name"": ""Crime""}, {""id"": 53, ""name"": ""Thriller""}]",106,0,0,"","",Released,tt34466483,"[{""id"": 48460, ""name"": ""Youku"", ""logo_path"": ""/7m3BMwdstKRqw7qg5vSYW2S0HrR.png"", ""origin_country"": ""CN""}, {""id"": 261808, ""name"": ""TMeng Pictures"", ""logo_path"": null, ""origin_country"": """"}]","[{""name"": ""China"", ""iso_3166_1"": ""CN""}]","[{""name"": ""普通话"", ""iso_639_1"": ""zh"", ""english_name"": ""Mandarin""}]",2025-11-23 04:33:05.022549
198663,The Maze Runner,"A teenager with no memory of his past finds himself among a group of boys living in a walled enclosure surrounded by a massive, ever-changing maze. As he struggles to adapt to their rules and society, he begins to uncover clues that may lead to escape and the truth behind their confinement.",2014-09-10,18.5854,17691,7.192,/ode14q7WtDugFDp78fo9lCsmay9.jpg,/eTlcNXGv32zkVI7ZDHhfeaKHXKQ.jpg,en,"[{""id"": 28, ""name"": ""Action""}, {""id"": 9648, ""name"": ""Mystery""}, {""id"": 878, ""name"": ""Science Fiction""}, {""id"": 53, ""name"": ""Thriller""}]",113,34000000,348319861,https://www.20thcenturystudios.com/movies/the-maze-runner,Get ready to run.,Released,tt1790864,"[{""id"": 290, ""name"": ""Ingenious Media"", ""logo_path"": ""/jrgCuaQsY9ouP5ILZf4Dq4ZOkIX.png"", ""origin_country"": ""GB""}, {""id"": 3672, ""name"": ""The Gotham Group"", ""logo_path"": ""/xpRwVe9NL5791oyUidzeRp8ezGj.png"", ""origin_country"": ""US""}, {""id"": 8569, ""name"": ""Dayday Films"", ""logo_path"": null, ""origin_country"": ""GB""}, {""id"": 12292, ""name"": ""Temple Hill Entertainment"", ""logo_path"": ""/5J93SHsuvIV32AE9oSbMi02pqw9.png"", ""origin_country"": ""US""}, {""id"": 22213, ""name"": ""TSG Entertainment"", ""logo_path"": ""/qx9K6bFWJupwde0xQDwOvXkOaL8.png"", ""origin_country"": ""US""}, {""id"": 25, ""name"": ""20th Century Fox"", ""logo_path"": ""/qZCc1lty5FzX30aOCVRBLzaVmcp.png"", ""origin_country"": ""US""}]","[{""name"": ""United States of America"", ""iso_3166_1"": ""US""}, {""name"": ""United Kingdom"", ""iso_3166_1"": ""GB""}]","[{""name"": ""English"", ""iso_639_1"": ""en"", ""english_name"": ""English""}]",2025-11-23 04:33:05.022549
663558,New Gods: Nezha Reborn,"While living as an ordinary deliveryman and motor racing fan, Nezha encounters old nemeses and must rediscover his powers to protect his loved ones.",2021-02-06,5.7887,486,8.08,/np4ScPY04HESKBbpexwstKsipKe.jpg,/4PKfa0zltSrp1BJoLl8zfvYXaac.jpg,zh,"[{""id"": 16, ""name"": ""Animation""}, {""id"": 14, ""name"": ""Fantasy""}, {""id"": 28, ""name"": ""Action""}]",117,0,70000000,https://cmc-pictures.com/nezha-reborn/,Rebirth of a hero,Released,tt13269670,"[{""id"": 123270, ""name"": ""bilibili"", ""logo_path"": ""/4KxfGr13VXMr44og11hzpdwfQDQ.png"", ""origin_country"": ""CN""}, {""id"": 69484, ""name"": ""Alibaba Pictures Group"", ""logo_path"": ""/2xtmvbEse87LM7OJXVksv7DToZx.png"", ""origin_country"": ""CN""}, {""id"": 67089, ""name"": ""Light Chaser Animation Studios"", ""logo_path"": ""/1wnxolUB5NHZARmeeZjVXKpGKaI.png"", ""origin_country"": ""CN""}]","[{""name"": ""China"", ""iso_3166_1"": ""CN""}]","[{""name"": ""普通话"", ""iso_639_1"": ""zh"", ""english_name"": ""Mandarin""}, {""name"": ""Português"", ""iso_639_1"": ""pt"", ""english_name"": ""Portuguese""}]",2025-11-23 04:33:05.022549
11,Star Wars,Princess Leia is captured and held hostage by the evil Imperial forces in their effort to take over the galactic Empire. Venturesome Luke Skywalker and dashing captain Han Solo team together with the loveable robot duo R2-D2 and C-3PO to rescue the beautiful princess and restore peace and justice in the Empire.,1977-05-25,15.0563,21663,8.204,/6FfCtAuVAW8XJjZ7eWeLibRLWTw.jpg,/2w4xG178RpB4MDAIfTkqAuSJzec.jpg,en,"[{""id"": 12, ""name"": ""Adventure""}, {""id"": 28, ""name"": ""Action""}, {""id"": 878, ""name"": ""Science Fiction""}]",121,11000000,775398007,http://www.starwars.com/films/star-wars-episode-iv-a-new-hope,"A long time ago in a galaxy far, far away...",Released,tt0076759,"[{""id"": 1, ""name"": ""Lucasfilm Ltd."", ""logo_path"": ""/tlVSws0RvvtPBwViUyOFAO0vcQS.png"", ""origin_country"": ""US""}, {""id"": 25, ""name"": ""20th Century Fox"", ""logo_path"": ""/qZCc1lty5FzX30aOCVRBLzaVmcp.png"", ""origin_country"": ""US""}]","[{""name"": ""United States of America"", ""iso_3166_1"": ""US""}]","[{""name"": ""English"", ""iso_639_1"": ""en"", ""english_name"": ""English""}]",2025-11-23 04:33:05.022549
13,Forrest Gump,"A man with a low IQ has accomplished great things in his life and been present during significant historic events—in each case, far exceeding what anyone imagined he could do. But despite all he has achieved, his one true love eludes him.",1994-06-23,16.7366,28866,8.463,/saHP97rTPS5eLmrLQEcANmKrsFl.jpg,/67HggiWaP9ZLv5sPYmyRV37yAJM.jpg,en,"[{""id"": 35, ""name"": ""Comedy""}, {""id"": 18, ""name"": ""Drama""}, {""id"": 10749, ""name"": ""Romance""}]",142,55000000,677387716,https://www.paramountmovies.com/movies/forrest-gump,The world will never be the same once you've seen it through the eyes of Forrest Gump.,Released,tt0109830,"[{""id"": 4, ""name"": ""Paramount Pictures"", ""logo_path"": ""/jay6WcMgagAklUt7i9Euwj1pzTF.png"", ""origin_country"": ""US""}, {""id"": 21920, ""name"": ""The Steve Tisch Company"", ""logo_path"": null, ""origin_country"": ""US""}, {""id"": 412, ""name"": ""Wendy Finerman Productions"", ""logo_path"": null, ""origin_country"": """"}]","[{""name"": ""United States of America"", ""iso_3166_1"": ""US""}]","[{""name"": ""English"", ""iso_639_1"": ""en"", ""english_name"": ""English""}]",2025-11-23 04:33:05.022549
14,American Beauty,"Lester Burnham, a depressed suburban father in a mid-life crisis, decides to turn his hectic life around after developing an infatuation with his daughter's attractive friend.",1999-09-15,6.4038,12645,8.003,/wby9315QzVKdW9BonAefg8jGTTb.jpg,/2ndw55F40IkALzWyjCCza3M6nqM.jpg,en,"[{""id"": 18, ""name"": ""Drama""}]",122,15000000,356296601,"",... look closer,Released,tt0169547,"[{""id"": 7, ""name"": ""DreamWorks Pictures"", ""logo_path"": ""/vru2SssLX3FPhnKZGtYw00pVIS9.png"", ""origin_country"": ""US""}, {""id"": 2721, ""name"": ""Jinks/Cohen Company"", ""logo_path"": null, ""origin_country"": ""US""}]","[{""name"": ""United States of America"", ""iso_3166_1"": ""US""}]","[{""name"": ""English"", ""iso_639_1"": ""en"", ""english_name"": ""English""}]",2025-11-23 04:33:05.022549
15,Citizen Kane,"Newspaper magnate Charles Foster Kane is taken from his mother as a boy and made the ward of a rich industrialist. As a result, every well-meaning, tyrannical or self-destructive move he makes for the rest of his life appears in some way to be a reaction to that deeply wounding event.",1941-04-17,3.9876,5813,7.999,/sav0jxhqiH0bPr2vZFU0Kjt2nZL.jpg,/ruF3Lmd4A8MHbnEBE6lxPMbsHGL.jpg,en,"[{""id"": 9648, ""name"": ""Mystery""}, {""id"": 18, ""name"": ""Drama""}]",119,839727,23218000,"",Some called him a hero...others called him a heel.,Released,tt0033467,"[{""id"": 11447, ""name"": ""Mercury Productions"", ""logo_path"": null, ""origin_country"": """"}, {""id"": 6, ""name"": ""RKO Radio Pictures"", ""logo_path"": ""/n53F7K9scQWFXYbrCablqLKqJdp.png"", ""origin_country"": ""US""}]","[{""name"": ""United States of America"", ""iso_3166_1"": ""US""}]","[{""name"": ""English"", ""iso_639_1"": ""en"", ""english_name"": ""English""}]",2025-11-23 04:33:05.022549
372754,Dou kyu sei – Classmates,"Rihito Sajo, an honor student with a perfect score on the entrance exam and Hikaru Kusakabe, in a band and popular among girls, would have never crossed paths. Until one day they started talking at the practice for their school’s upcoming chorus festival. After school, the two meet regularly, as Hikaru helps Rihito to improve his singing skills. While they listen to each other’s voice and harmonize, their hearts start to beat together.",2016-02-20,1.8387,419,8.303,/cIfRCA5wEvj9tApca4UDUagQEiM.jpg,/tLmyP7akYmxLwyfTEt2qyj2sOR3.jpg,ja,"[{""id"": 10749, ""name"": ""Romance""}, {""id"": 16, ""name"": ""Animation""}]",61,0,1397526,http://doukyuseimovie.com/,"Sincerely, Slowly, Falling in Love.",Released,tt5526028,"[{""id"": 13113, ""name"": ""A-1 Pictures"", ""logo_path"": ""/xV5tPYKZhP2Ko9dOh5A3FahuKsx.png"", ""origin_country"": ""JP""}, {""id"": 2883, ""name"": ""Aniplex"", ""logo_path"": ""/rDYExnBV61jGQnkhVVrPN4Yl7O1.png"", ""origin_country"": ""JP""}, {""id"": 249175, ""name"": ""HALF H･P STUDIO"", ""logo_path"": ""/kAsLr1tqACZk9o8A3Lj52851oVw.png"", ""origin_country"": ""JP""}]","[{""name"": ""Japan"", ""iso_3166_1"": ""JP""}]","[{""name"": ""日本語"", ""iso_639_1"": ""ja"", ""english_name"": ""Japanese""}]",2025-11-23 04:33:05.022549
19,Metropolis,"In a futuristic city sharply divided between the rich and the poor, the son of the city's mastermind meets a prophet who predicts the coming of a savior to mediate their differences.",1927-02-06,3.2784,2965,8.1,/vZIJxGnjcswPCAa52jhbl01FQkV.jpg,/eeMoFKxjjiCi6iep2GEZtSAMYIr.jpg,de,"[{""id"": 18, ""name"": ""Drama""}, {""id"": 878, ""name"": ""Science Fiction""}]",153,5300000,1350322,"",There can be no understanding between the hands and the brain unless the heart acts as mediator.,Released,tt0017136,"[{""id"": 12372, ""name"": ""UFA"", ""logo_path"": ""/lcQScIQXHQXuLMLFQt0loJl5gWJ.png"", ""origin_country"": ""DE""}]","[{""name"": ""Germany"", ""iso_3166_1"": ""DE""}]","[{""name"": ""No Language"", ""iso_639_1"": ""xx"", ""english_name"": ""No Language""}]",2025-11-23 04:33:05.022549
954388,Quicksand,A married couple on the brink of divorce becomes trapped in quicksand while hiking through a Colombian rainforest. It’s a struggle for survival as they battle the elements of the jungle and must work together in order to escape.,2023-08-31,20.9475,103,6.286,/cVLfO3CbVg8p5Qcaifq6AidOe2w.jpg,/nKOutYdpjpxdeftoXcDnSAaD2z8.jpg,en,"[{""id"": 53, ""name"": ""Thriller""}, {""id"": 27, ""name"": ""Horror""}, {""id"": 9648, ""name"": ""Mystery""}, {""id"": 18, ""name"": ""Drama""}]",86,0,0,https://www.andresbeltran.com/quicksand,Fear will drag you deeper.,Released,tt19056070,"[{""id"": 172265, ""name"": ""Sangre Films"", ""logo_path"": null, ""origin_country"": ""CO""}, {""id"": 172266, ""name"": ""222 Pictures"", ""logo_path"": null, ""origin_country"": """"}, {""id"": 92109, ""name"": ""Dawn's Light"", ""logo_path"": ""/1wOgBio7WGOskOAQ2aTvtCHAdm8.png"", ""origin_country"": ""US""}, {""id"": 172267, ""name"": ""Elemental Stories"", ""logo_path"": null, ""origin_country"": """"}]","[{""name"": ""Colombia"", ""iso_3166_1"": ""CO""}, {""name"": ""United States of America"", ""iso_3166_1"": ""US""}]","[{""name"": ""English"", ""iso_639_1"": ""en"", ""english_name"": ""English""}, {""name"": ""Português"", ""iso_639_1"": ""pt"", ""english_name"": ""Portuguese""}]",2025-11-23 04:33:05.022549
22,Pirates of the Caribbean: The Curse of the Black Pearl,"After Port Royal is attacked and pillaged by a mysterious pirate crew, capturing the governor's daughter Elizabeth Swann in the process, William Turner asks free-willing pirate Jack Sparrow to help him locate the crew's ship—The Black Pearl—so that he can rescue the woman he loves.",2003-07-09,22.0026,21608,7.815,/poHwCZeWzJCShH7tOjg8RIoyjcw.jpg,/uRNgkJSkNBFbbn9fPsEjDIy8Sh3.jpg,en,"[{""id"": 12, ""name"": ""Adventure""}, {""id"": 14, ""name"": ""Fantasy""}, {""id"": 28, ""name"": ""Action""}]",143,140000000,655011224,https://movies.disney.com/pirates-of-the-caribbean-the-curse-of-the-black-pearl,Prepare to be blown out of the water.,Released,tt0325980,"[{""id"": 2, ""name"": ""Walt Disney Pictures"", ""logo_path"": ""/wdrCwmRnLFJhEoH8GSfymY85KHT.png"", ""origin_country"": ""US""}, {""id"": 130, ""name"": ""Jerry Bruckheimer Films"", ""logo_path"": ""/c9dVHPOL3cqCr2593Ahk0nEKTEM.png"", ""origin_country"": ""US""}]","[{""name"": ""United States of America"", ""iso_3166_1"": ""US""}]","[{""name"": ""English"", ""iso_639_1"": ""en"", ""english_name"": ""English""}]",2025-11-23 04:33:05.022549
1284120,The Ugly Stepsister,"In a fairy-tale kingdom where beauty is a brutal business, Elvira battles to compete with her incredibly beautiful stepsister, and she will go to any length to catch the prince’s eye.",2025-03-07,38.9222,683,7.3,/rayAREIKtSinuov10GvrZHyXfXH.jpg,/ev9kxdoJ5IYVprt1OvH2SMWJdU1.jpg,no,"[{""id"": 27, ""name"": ""Horror""}, {""id"": 35, ""name"": ""Comedy""}, {""id"": 14, ""name"": ""Fantasy""}, {""id"": 18, ""name"": ""Drama""}]",109,4250000,5325096,https://www.uglystepsister.movie,If the shoe doesn't fit...,Released,tt29344903,"[{""id"": 21979, ""name"": ""Mer Film"", ""logo_path"": ""/pVdOYVNJracFdcEsDihqz3VSZ0U.png"", ""origin_country"": ""NO""}, {""id"": 51112, ""name"": ""Lava Films"", ""logo_path"": ""/kWLbDFg6koYqFMYjmjcifeBFB8F.png"", ""origin_country"": ""PL""}, {""id"": 162093, ""name"": ""MOTOR"", ""logo_path"": ""/f9KIm9oEcVXMROucR8s3XKjXOZk.png"", ""origin_country"": ""DK""}, {""id"": 171066, ""name"": ""Scanbox Production"", ""logo_path"": ""/tjNpvJOTCwvPL2faaj3r2RR3dTs.png"", ""origin_country"": ""DK""}, {""id"": 8288, ""name"": ""Zentropa International Sweden"", ""logo_path"": ""/5THcBZP0ad7hXPjtPTxld5sVJQp.png"", ""origin_country"": ""SE""}, {""id"": 218924, ""name"": ""Mediefondet Zefyr"", ""logo_path"": null, ""origin_country"": ""NO""}, {""id"": 2801, ""name"": ""Film i Väst"", ""logo_path"": ""/bswb1PLLsKDUXMLgy42bZtCtIde.png"", ""origin_country"": ""SE""}]","[{""name"": ""Denmark"", ""iso_3166_1"": ""DK""}, {""name"": ""Norway"", ""iso_3166_1"": ""NO""}, {""name"": ""Poland"", ""iso_3166_1"": ""PL""}, {""name"": ""Sweden"", ""iso_3166_1"": ""SE""}]","[{""name"": ""Norsk"", ""iso_639_1"": ""no"", ""english_name"": ""Norwegian""}, {""name"": ""Polski"", ""iso_639_1"": ""pl"", ""english_name"": ""Polish""}, {""name"": ""svenska"", ""iso_639_1"": ""sv"", ""english_name"": ""Swedish""}]",2025-11-23 04:33:05.022549
28,Apocalypse Now,"At the height of the Vietnam war, Captain Benjamin Willard is sent on a dangerous mission that, officially, ""does not exist, nor will it ever exist."" His goal is to locate - and eliminate - a mysterious Green Beret Colonel named Walter Kurtz, who has been leading his personal army on illegal guerrilla missions into enemy territory.",1979-05-19,6.7705,8735,8.271,/gQB8Y5RCMkv2zwzFHbUJX3kAhvA.jpg,/9Qs9oyn4iE8QtQjGZ0Hp2WyYNXT.jpg,en,"[{""id"": 18, ""name"": ""Drama""}, {""id"": 10752, ""name"": ""War""}]",147,31500000,150000000,http://www.apocalypsenow.com,This is the end...,Released,tt0078788,"[{""id"": 70, ""name"": ""American Zoetrope"", ""logo_path"": ""/ueaENQkPcy8rlr5fGZVBXKOhlBh.png"", ""origin_country"": ""US""}]","[{""name"": ""United States of America"", ""iso_3166_1"": ""US""}]","[{""name"": """", ""iso_639_1"": ""km"", ""english_name"": ""Khmer""}, {""name"": ""English"", ""iso_639_1"": ""en"", ""english_name"": ""English""}, {""name"": ""Français"", ""iso_639_1"": ""fr"", ""english_name"": ""French""}, {""name"": ""Tiếng Việt"", ""iso_639_1"": ""vi"", ""english_name"": ""Vietnamese""}]",2025-11-23 04:33:05.022549
38,Eternal Sunshine of the Spotless Mind,"Joel Barish, heartbroken that his girlfriend underwent a procedure to erase him from her memory, decides to do the same. However, as he watches his memories of her fade away, he realises that he still loves her, and may be too late to correct his mistake.",2004-03-19,8.2804,15814,8.092,/5MwkWH9tYHv3mV9OdYTMR5qreIz.jpg,/744ybMaYRry1IQKoDakMc4GEU4L.jpg,en,"[{""id"": 878, ""name"": ""Science Fiction""}, {""id"": 18, ""name"": ""Drama""}, {""id"": 10749, ""name"": ""Romance""}]",108,20000000,72258126,https://www.focusfeatures.com/eternal_sunshine_of_the_spotless_mind,You can erase someone from your mind. Getting them out of your heart is another story.,Released,tt0338013,"[{""id"": 10146, ""name"": ""Focus Features"", ""logo_path"": ""/xnFIOeq5cKw09kCWqV7foWDe4AA.png"", ""origin_country"": ""US""}, {""id"": 10039, ""name"": ""Anonymous Content"", ""logo_path"": ""/b8w4LldQolMKiLZw4FQJBcXSDGI.png"", ""origin_country"": ""US""}, {""id"": 10059, ""name"": ""This is that"", ""logo_path"": ""/3Z2MZzMW9gUyZAhHKhFIUqF1hwx.png"", ""origin_country"": ""US""}]","[{""name"": ""United States of America"", ""iso_3166_1"": ""US""}]","[{""name"": ""English"", ""iso_639_1"": ""en"", ""english_name"": ""English""}]",2025-11-23 04:33:05.022549
26674,Wild Side,"A bank accountant who moonlights as a high-priced call girl becomes embroiled in the lives of a money launderer, his seductive wife, and his bodyguard.",1996-06-22,21.8701,50,5.7,/pFRrKn9wqPECjN1QOrDdS3BVdL5.jpg,/oHBk9ac0j2wEVtUn9hUDY4uHKro.jpg,en,"[{""id"": 53, ""name"": ""Thriller""}, {""id"": 10749, ""name"": ""Romance""}]",96,3500000,0,"","It's Not About Sex, It's About Power.",Released,tt0114941,"[{""id"": 925, ""name"": ""Nu Image"", ""logo_path"": ""/dIb9hjXNOkgxu4kBWdIdK8nM4w.png"", ""origin_country"": ""US""}, {""id"": 5416, ""name"": ""Mondofin B.V."", ""logo_path"": null, ""origin_country"": """"}, {""id"": 6705, ""name"": ""Film4 Productions"", ""logo_path"": ""/iNB1FCwT4XjO6wkN3PnpPnwr9GX.png"", ""origin_country"": ""GB""}]","[{""name"": ""United Kingdom"", ""iso_3166_1"": ""GB""}, {""name"": ""United States of America"", ""iso_3166_1"": ""US""}, {""name"": ""Netherlands"", ""iso_3166_1"": ""NL""}]","[{""name"": ""English"", ""iso_639_1"": ""en"", ""english_name"": ""English""}]",2025-11-23 04:33:05.022549
20530,Late Spring,"Noriko is perfectly happy living at home with her widowed father, Shukichi, and has no plans to marry -- that is, until her aunt Masa convinces Shukichi that unless he marries off his 27-year-old daughter soon, she will likely remain alone for the rest of her life. When Noriko resists Masa's matchmaking, Shukichi is forced to deceive his daughter and sacrifice his own happiness to do what he believes is right.",1949-09-13,2.0127,448,8,/iNtRSY2AGjW1VDXDR79bKsNUdus.jpg,/sKEncrsqPxibvlWbsXYsPhXGBjw.jpg,ja,"[{""id"": 18, ""name"": ""Drama""}]",108,0,0,"","",Released,tt0041154,"[{""id"": 192, ""name"": ""Shochiku"", ""logo_path"": ""/93eAKlnQecDdMtucfOprzcjMw9V.png"", ""origin_country"": ""JP""}]","[{""name"": ""Japan"", ""iso_3166_1"": ""JP""}]","[{""name"": ""日本語"", ""iso_639_1"": ""ja"", ""english_name"": ""Japanese""}]",2025-11-23 04:33:05.022549
20532,Sansho the Bailiff,"In medieval Japan, a woman and her children journey to find the family's patriarch, who was exiled years earlier.",1954-03-31,2.0387,407,8.077,/cOBsWxFtEoqXIPx4JZP5E7g1WEo.jpg,/7m8b1YwEeK8NeMkiSbPY8CMJx6a.jpg,ja,"[{""id"": 18, ""name"": ""Drama""}]",124,0,0,"","Without mercy, man is like a beast.",Released,tt0047445,"[{""id"": 880, ""name"": ""Daiei Film"", ""logo_path"": ""/vwhPRAZ4lhUtSuaifk4Au2MIm92.png"", ""origin_country"": ""JP""}]","[{""name"": ""Japan"", ""iso_3166_1"": ""JP""}]","[{""name"": ""日本語"", ""iso_639_1"": ""ja"", ""english_name"": ""Japanese""}]",2025-11-23 04:33:05.022549
696374,Gabriel's Inferno,"An intriguing and sinful exploration of seduction, forbidden love, and redemption, Gabriel's Inferno is a captivating and wildly passionate tale of one man's escape from his own personal hell as he tries to earn the impossible--forgiveness and love.",2020-05-29,2.0538,2437,8.403,/oyG9TL7FcRP4EZ9Vid6uKzwdndz.jpg,/nIkcTtuhmkl1GZO2LfZi7SwFz7F.jpg,en,"[{""id"": 10749, ""name"": ""Romance""}, {""id"": 18, ""name"": ""Drama""}]",122,0,0,https://watch.passionflix.com/watch/fc15dc25-cf48-4d4f-aa8e-9afb032233cc,"",Released,tt11316854,"[{""id"": 92153, ""name"": ""PassionFlix"", ""logo_path"": ""/psjvYkjjgAPtS8utnFYDM8t8yi7.png"", ""origin_country"": ""US""}]","[{""name"": ""United States of America"", ""iso_3166_1"": ""US""}]","[{""name"": ""English"", ""iso_639_1"": ""en"", ""english_name"": ""English""}]",2025-11-23 04:33:05.022549
1038392,The Conjuring: Last Rites,Paranormal investigators Ed and Lorraine Warren take on one last terrifying case involving mysterious entities they must confront.,2025-09-03,80.1947,1325,6.987,/7JzOmJ1fIU43I3gLHYsY8UzNzjG.jpg,/tcBX2dtkNozZ0uDLVaxXrE6rqyN.jpg,en,"[{""id"": 27, ""name"": ""Horror""}]",136,55000000,494410454,http://www.theconjuringmovie.com,The case that ended it all.,Released,tt22898462,"[{""id"": 12, ""name"": ""New Line Cinema"", ""logo_path"": ""/2ycs64eqV5rqKYHyQK0GVoKGvfX.png"", ""origin_country"": ""US""}, {""id"": 76907, ""name"": ""Atomic Monster"", ""logo_path"": ""/ygMQtjsKX7BZkCQhQZY82lgnCUO.png"", ""origin_country"": ""US""}, {""id"": 11565, ""name"": ""The Safran Company"", ""logo_path"": ""/odU3l6csuBmXUrzFm6araUgEUHQ.png"", ""origin_country"": ""US""}, {""id"": 216687, ""name"": ""Domain Entertainment"", ""logo_path"": ""/kKVYqekveOvLK1IgqdJojLjQvtu.png"", ""origin_country"": ""US""}]","[{""name"": ""United States of America"", ""iso_3166_1"": ""US""}]","[{""name"": ""English"", ""iso_639_1"": ""en"", ""english_name"": ""English""}]",2025-11-23 04:33:05.022549
2105,American Pie,"At a high-school party, four friends find that losing their collective virginity isn't as easy as they had thought. But they still believe that they need to do so before college. To motivate themselves, they enter a pact to all ""score"" by their senior prom.",1999-07-09,30.0637,8029,6.599,/5P68by2Thn8wHAziyWGEw2O7hco.jpg,/cvH1gNIMRITdLzoWv1HNAbRyH3n.jpg,en,"[{""id"": 35, ""name"": ""Comedy""}, {""id"": 10749, ""name"": ""Romance""}]",95,11000000,235483004,"",There's nothing like your first piece.,Released,tt0163651,"[{""id"": 33, ""name"": ""Universal Pictures"", ""logo_path"": ""/8lvHyhjr8oUKOOy2dKXoALWKdp0.png"", ""origin_country"": ""US""}, {""id"": 3169, ""name"": ""Zide-Perry Productions"", ""logo_path"": null, ""origin_country"": ""US""}]","[{""name"": ""United States of America"", ""iso_3166_1"": ""US""}]","[{""name"": ""English"", ""iso_639_1"": ""en"", ""english_name"": ""English""}]",2025-11-23 04:33:05.022549
58,Pirates of the Caribbean: Dead Man's Chest,"Captain Jack Sparrow races to recover the heart of Davy Jones to avoid enslaving his soul to Jones' service, as other friends and foes seek the heart for their own agenda as well.",2006-07-06,17.5806,16709,7.372,/lAhcKRt0ggTFkeFL95jrGQYaRXs.jpg,/vr6n6ZFUZvedvIlhfYcbCWcaKyW.jpg,en,"[{""id"": 12, ""name"": ""Adventure""}, {""id"": 14, ""name"": ""Fantasy""}, {""id"": 28, ""name"": ""Action""}]",151,200000000,1066179747,https://movies.disney.com/pirates-of-the-caribbean-dead-mans-chest,Captain Jack is back!,Released,tt0383574,"[{""id"": 2, ""name"": ""Walt Disney Pictures"", ""logo_path"": ""/wdrCwmRnLFJhEoH8GSfymY85KHT.png"", ""origin_country"": ""US""}, {""id"": 130, ""name"": ""Jerry Bruckheimer Films"", ""logo_path"": ""/c9dVHPOL3cqCr2593Ahk0nEKTEM.png"", ""origin_country"": ""US""}, {""id"": 19936, ""name"": ""Second Mate Productions"", ""logo_path"": null, ""origin_country"": ""US""}]","[{""name"": ""United States of America"", ""iso_3166_1"": ""US""}]","[{""name"": ""English"", ""iso_639_1"": ""en"", ""english_name"": ""English""}, {""name"": ""Türkçe"", ""iso_639_1"": ""tr"", ""english_name"": ""Turkish""}, {""name"": ""ελληνικά"", ""iso_639_1"": ""el"", ""english_name"": ""Greek""}, {""name"": ""普通话"", ""iso_639_1"": ""zh"", ""english_name"": ""Mandarin""}]",2025-11-23 04:33:05.022549
