id,title,overview,release_date,popularity,vote_count,vote_average,poster_path,backdrop_path,original_language,genres,runtime,budget,revenue,homepage,tagline,status,imdb_id,production_companies,production_countries,spoken_languages,last_updated
424,Schindler's List,The true story of how businessman Oskar Schindler saved over a thousand Jewish lives from the Nazis while they worked as slaves in his factory during World War II.,1993-12-15,10.2148,16866,8.566,/sF1U4EUQS8YHUYjNl3pMGNIQyr0.jpg,/zb6fM1CX41D9rF9hdgclu0peUmy.jpg,en,"[{""id"": 18, ""name"": ""Drama""}, {""id"": 36, ""name"": ""History""}, {""id"": 10752, ""name"": ""War""}]",195,22000000,321365567,http://www.schindlerslist.com/,"Whoever saves one life, saves the world entire.",Released,tt0108052,"[{""id"": 56, ""name"": ""Amblin Entertainment"", ""logo_path"": ""/cEaxANEisCqeEoRvODv2dO1I0iI.png"", ""origin_country"": ""US""}]","[{""name"": ""United States of America"", ""iso_3166_1"": ""US""}]","[{""name"": ""Deutsch"", ""iso_639_1"": ""de"", ""english_name"": ""German""}, {""name"": ""Polski"", ""iso_639_1"": ""pl"", ""english_name"": ""Polish""}, {""name"": ""עִבְרִית"", ""iso_639_1"": ""he"", ""english_name"": ""Hebrew""}, {""name"": ""English"", ""iso_639_1"": ""en"", ""english_name"": ""English""}]",2025-11-23 04:33:05.022549
329724,In Harmony,"After a serious accident on a film shoot, Marc, an equestrian, loses all hope to mount back on. His insurance company instructs Florence to handle his case. This film is the story of their meeting.",2015-04-15,22.5716,86,5.913,/1okqCxhKMTObNCIeUKx7cCQPzTP.jpg,/kQHIVaqHB2fyTGMmDzwwSOdVcNd.jpg,fr,"[{""id"": 18, ""name"": ""Drama""}]",88,0,0,"","",Released,tt4228816,"[{""id"": 31229, ""name"": ""Cinéfrance 1888"", ""logo_path"": null, ""origin_country"": ""FR""}, {""id"": 12096, ""name"": ""Mandarin Film"", ""logo_path"": null, ""origin_country"": ""CN""}]","[{""name"": ""France"", ""iso_3166_1"": ""FR""}]","[{""name"": ""Français"", ""iso_639_1"": ""fr"", ""english_name"": ""French""}]",2025-11-23 04:33:05.022549
422,8½,"Guido Anselmi, a film director, finds himself creatively barren at the peak of his career. Urged by his doctors to rest, Anselmi heads for a luxurious resort, but a sorry group gathers—his producer, staff, actors, wife, mistress, and relatives—each one begging him to get on with the show. In retreat from their dependency, he fantasizes about past women and dreams of his childhood.",1963-02-14,3.0114,2439,8.1,/d7wXtJ173oHtoCwxbe7Z5uXZ4Gv.jpg,/y2FNZLHynsevBnVTocGW6c3pQpr.jpg,it,"[{""id"": 18, ""name"": ""Drama""}]",139,0,0,https://www.janusfilms.com/films/1012,A picture that goes beyond what men think about - because no man ever thought about it in quite this way!,Released,tt0056801,"[{""id"": 9387, ""name"": ""Cineriz"", ""logo_path"": null, ""origin_country"": ""IT""}, {""id"": 10882, ""name"": ""Francinex"", ""logo_path"": null, ""origin_country"": ""FR""}]","[{""name"": ""Italy"", ""iso_3166_1"": ""IT""}, {""name"": ""France"", ""iso_3166_1"": ""FR""}]","[{""name"": ""Deutsch"", ""iso_639_1"": ""de"", ""english_name"": ""German""}, {""name"": ""English"", ""iso_639_1"": ""en"", ""english_name"": ""English""}, {""name"": ""Français"", ""iso_639_1"": ""fr"", ""english_name"": ""French""}, {""name"": ""Italiano"", ""iso_639_1"": ""it"", ""english_name"": ""Italian""}]",2025-11-23 04:33:05.022549
426,Vertigo,"A retired San Francisco detective suffering from acrophobia investigates the strange activities of an old friend's wife, all the while becoming dangerously obsessed with her.",1958-05-28,5.4443,6096,8.155,/15uOEfqBNTVtDUT7hGBVCka0rZz.jpg,/77aHwg1SCy89rfvQtiruPU58qEV.jpg,en,"[{""id"": 9648, ""name"": ""Mystery""}, {""id"": 10749, ""name"": ""Romance""}, {""id"": 53, ""name"": ""Thriller""}]",128,2479000,7808900,"",Alfred Hitchcock engulfs you in a whirlpool of terror and tension!,Released,tt0052357,"[{""id"": 4, ""name"": ""Paramount Pictures"", ""logo_path"": ""/jay6WcMgagAklUt7i9Euwj1pzTF.png"", ""origin_country"": ""US""}, {""id"": 10715, ""name"": ""Alfred J. Hitchcock Productions"", ""logo_path"": null, ""origin_country"": ""US""}]","[{""name"": ""United States of America"", ""iso_3166_1"": ""US""}]","[{""name"": ""English"", ""iso_639_1"": ""en"", ""english_name"": ""English""}]",2025-11-23 04:33:05.022549
541099,DeadTectives,"A team of reality TV paranormal investigators go to Mexico's most haunted house in the pursuit of better ratings. However, when the true dark secrets of the mansion begin to reveal themselves, the hapless team quickly discover that this house is no hoax. With zero genuine ghost-hunting experience, they have to figure out how to stop the ghosts and escape the house with their lives.",2019-09-13,18.5472,84,5.929,/o3Fo0GFHYzNVK5b1KjhyGYE05vy.jpg,/aA0fyft9c8MsmFfH9HhTxemewGx.jpg,en,"[{""id"": 35, ""name"": ""Comedy""}, {""id"": 27, ""name"": ""Horror""}]",92,0,0,"",Fake hunters. Real ghosts. Complete dicks.,Released,tt3503068,"[{""id"": 124977, ""name"": ""Bad Idea"", ""logo_path"": null, ""origin_country"": """"}, {""id"": 75357, ""name"": ""BondIt"", ""logo_path"": ""/zXT1JFP82YL245wlLpauAJDZA25.png"", ""origin_country"": ""US""}, {""id"": 41045, ""name"": ""Dark Factory Entertainment"", ""logo_path"": null, ""origin_country"": """"}, {""id"": 66217, ""name"": ""Exit Strategy Productions"", ""logo_path"": null, ""origin_country"": """"}, {""id"": 124978, ""name"": ""Little Maniac Entertainment"", ""logo_path"": null, ""origin_country"": """"}, {""id"": 119056, ""name"": ""Particular Crowd"", ""logo_path"": ""/vbhwOf0TQ4z12GIytYGWmhPJAOz.png"", ""origin_country"": ""US""}]","[{""name"": ""United States of America"", ""iso_3166_1"": ""US""}]","[{""name"": ""English"", ""iso_639_1"": ""en"", ""english_name"": ""English""}]",2025-11-23 04:33:05.022549
429,"The Good, the Bad and the Ugly","While the Civil War rages on between the Union and the Confederacy, three men – a quiet loner, a ruthless hitman, and a Mexican bandit – comb the American Southwest in search of a strongbox containing $200,000 in stolen gold.",1966-12-22,9.312,9259,8.463,/bX2xnavhMYjWDoZp1VM6VnU1xwe.jpg,/Adrip2Jqzw56KeuV2nAxucKMNXA.jpg,it,"[{""id"": 37, ""name"": ""Western""}]",161,1200000,38900000,"http://www.mgm.com/#/our-titles/766/The-Good,-the-Bad-and-the-Ugly",For three men the Civil War wasn't hell. It was practice.,Released,tt0060196,"[{""id"": 60, ""name"": ""United Artists"", ""logo_path"": ""/4YldLvCWQL9VIAHQ2Fu3Ffkh9Si.png"", ""origin_country"": ""US""}, {""id"": 7508, ""name"": ""PEA"", ""logo_path"": null, ""origin_country"": ""IT""}, {""id"": 42498, ""name"": ""Arturo González PC"", ""logo_path"": null, ""origin_country"": ""ES""}, {""id"": 47, ""name"": ""Constantin Film"", ""logo_path"": ""/i7Z9ot2o3N5Sa3HrF09kniFs2y8.png"", ""origin_country"": ""DE""}]","[{""name"": ""United States of America"", ""iso_3166_1"": ""US""}, {""name"": ""Italy"", ""iso_3166_1"": ""IT""}, {""name"": ""Spain"", ""iso_3166_1"": ""ES""}, {""name"": ""Germany"", ""iso_3166_1"": ""DE""}]","[{""name"": ""Italiano"", ""iso_639_1"": ""it"", ""english_name"": ""Italian""}]",2025-11-23 04:33:05.022549
20914,My Friends,Four inseparable friends try to face their midlife crisis with daytrips and pranks at the expense of their families and the people around them.,1975-10-24,4.4546,725,8.131,/8Pm8SLjq2UHCwisd56ipHtzvZI1.jpg,/3q6XHCXII7qRZOx5EqU5NfYkVx8.jpg,it,"[{""id"": 35, ""name"": ""Comedy""}]",140,0,0,"","They played together, they drank together, they whorekistand together and when the semiwattle was in crispation, they had a boobchik of a time!",Released,tt0072637,"[{""id"": 44165, ""name"": ""RPA Cinematografica"", ""logo_path"": null, ""origin_country"": ""IT""}, {""id"": 1131, ""name"": ""Rizzoli Film"", ""logo_path"": null, ""origin_country"": ""IT""}]","[{""name"": ""Italy"", ""iso_3166_1"": ""IT""}]","[{""name"": ""Italiano"", ""iso_639_1"": ""it"", ""english_name"": ""Italian""}]",2025-11-23 04:33:05.022549
439,La Dolce Vita,"Episodic journey of journalist Marcello who struggles to find his place in the world, torn between the allure of Rome's elite social scene and the stifling domesticity offered by his girlfriend, all the while searching for a way to become a serious writer.",1960-02-05,5.7171,1972,8.056,/2KU52apQyvyZuPsqEGMcWb4BKu2.jpg,/uaEfEkb2tjl4hN1oaSyzcxt4cEg.jpg,it,"[{""id"": 35, ""name"": ""Comedy""}, {""id"": 18, ""name"": ""Drama""}]",176,0,19647000,"",The world’s most talked about movie today!,Released,tt0053779,"[{""id"": 1042, ""name"": ""Cinecittà Studios"", ""logo_path"": ""/cv8uj3G9fhe7vifZB6yjTzqI45V.png"", ""origin_country"": ""IT""}, {""id"": 220, ""name"": ""Pathé Consortium Cinéma"", ""logo_path"": null, ""origin_country"": ""FR""}, {""id"": 161843, ""name"": ""Riama Film"", ""logo_path"": null, ""origin_country"": ""IT""}]","[{""name"": ""France"", ""iso_3166_1"": ""FR""}, {""name"": ""Italy"", ""iso_3166_1"": ""IT""}]","[{""name"": ""Deutsch"", ""iso_639_1"": ""de"", ""english_name"": ""German""}, {""name"": ""English"", ""iso_639_1"": ""en"", ""english_name"": ""English""}, {""name"": ""Français"", ""iso_639_1"": ""fr"", ""english_name"": ""French""}, {""name"": ""Italiano"", ""iso_639_1"": ""it"", ""english_name"": ""Italian""}]",2025-11-23 04:33:05.022549
10681,WALL·E,"What if mankind had to leave Earth and somebody forgot to turn the last robot off? After hundreds of years doing what he was built for, WALL•E discovers a new purpose in life when he meets a sleek search robot named EVE. EVE comes to realize that WALL•E has inadvertently stumbled upon the key to the planet's future, and races back to space to report to the humans. Meanwhile, WALL•E chases EVE across the galaxy and sets into motion one of the most imaginative adventures ever brought to the big screen.",2008-06-22,11.5333,19661,8.103,/hbhFnRzzg6ZDmm8YAmxBnQpQIPh.jpg,/ai2FicMUxLCurVkjtYdSvVDWRmS.jpg,en,"[{""id"": 16, ""name"": ""Animation""}, {""id"": 10751, ""name"": ""Family""}, {""id"": 878, ""name"": ""Science Fiction""}]",98,180000000,521311860,https://www.pixar.com/feature-films/walle/,"After 700 years of doing what he was built for, he'll discover what he was meant for.",Released,tt0910970,"[{""id"": 3, ""name"": ""Pixar"", ""logo_path"": ""/1TjvGVDMYsj6JBxOAkUHpPEwLf7.png"", ""origin_country"": ""US""}]","[{""name"": ""United States of America"", ""iso_3166_1"": ""US""}]","[{""name"": ""English"", ""iso_639_1"": ""en"", ""english_name"": ""English""}]",2025-11-23 04:33:05.022549
504253,I Want to Eat Your Pancreas,"After his classmate and crush is diagnosed with a pancreatic disease, an average high schooler sets out to make the most of her final days.",2018-09-01,4.2804,1681,8.241,/qDWA7fB4cZ4sBP6YgwlxvraDHi7.jpg,/YLyORLsYIjC0d1TFBSpJKk7piP.jpg,ja,"[{""id"": 16, ""name"": ""Animation""}, {""id"": 18, ""name"": ""Drama""}, {""id"": 10749, ""name"": ""Romance""}]",108,0,33748006,https://kimisui-anime.com/,This is a story about an unforgettable spring...,Released,tt7236034,"[{""id"": 86839, ""name"": ""ABC Animation"", ""logo_path"": ""/cnOJAkVVmKZLIzmgw4fRRZ2dctT.png"", ""origin_country"": ""JP""}, {""id"": 2883, ""name"": ""Aniplex"", ""logo_path"": ""/rDYExnBV61jGQnkhVVrPN4Yl7O1.png"", ""origin_country"": ""JP""}, {""id"": 8157, ""name"": ""jeki"", ""logo_path"": ""/pEqcMX1aG3JvtDgfh2wNZJLCcb4.png"", ""origin_country"": ""JP""}, {""id"": 62866, ""name"": ""Futabasha"", ""logo_path"": ""/uYawQ0Lb8smRXNNCoq8gTHG92Pz.png"", ""origin_country"": ""JP""}, {""id"": 56933, ""name"": ""Studio VOLN"", ""logo_path"": ""/ogbbk2xvszgQwkf4msNbH5lhsM9.png"", ""origin_country"": ""JP""}, {""id"": 145105, ""name"": ""Tohan"", ""logo_path"": ""/oFUDvCLCRmAXlGqjmwO8CN33ygl.png"", ""origin_country"": ""JP""}, {""id"": 3031, ""name"": ""The Asahi Shimbun"", ""logo_path"": ""/2JcgVKZ1gEY5RsLJU1CGj1MaKFj.png"", ""origin_country"": ""JP""}]","[{""name"": ""Japan"", ""iso_3166_1"": ""JP""}]","[{""name"": ""日本語"", ""iso_639_1"": ""ja"", ""english_name"": ""Japanese""}]",2025-11-23 04:33:05.022549
1280450,Stolen Girl,"In 1993, Maureen’s six-year-old daughter Amina is snuck out of the country by her ex-husband, Karim. After years of unsuccessful attempts to find her, Maureen intersects with a professional retriever of internationally abducted children who promises to help her find Amina in exchange for her collaboration.",2025-09-04,44.2957,82,6.537,/fZlNXEHZsBp7unqw009MeBbMv87.jpg,/qcDDn7WeKBenM4nLlOPXAeJ4hpg.jpg,en,"[{""id"": 53, ""name"": ""Thriller""}, {""id"": 28, ""name"": ""Action""}, {""id"": 12, ""name"": ""Adventure""}]",110,26000000,92691,"",She'll cross every line just to hear her daughter's voice again.,Released,tt4682810,"[{""id"": 6626, ""name"": ""Voltage Pictures"", ""logo_path"": ""/y1PsXJOr4fSUk948lftHFUw67hs.png"", ""origin_country"": ""US""}, {""id"": 241823, ""name"": ""Vigorous Pictures"", ""logo_path"": null, ""origin_country"": """"}, {""id"": 241824, ""name"": ""Hangtime International Pictures"", ""logo_path"": null, ""origin_country"": """"}, {""id"": 241825, ""name"": ""Anjulia Productions"", ""logo_path"": null, ""origin_country"": """"}, {""id"": 21622, ""name"": ""Braven Films"", ""logo_path"": ""/2aRykuGbavtyeB4UecrHFQPX5gv.png"", ""origin_country"": ""US""}]","[{""name"": ""United Kingdom"", ""iso_3166_1"": ""GB""}, {""name"": ""United States of America"", ""iso_3166_1"": ""US""}]","[{""name"": ""English"", ""iso_639_1"": ""en"", ""english_name"": ""English""}, {""name"": ""Deutsch"", ""iso_639_1"": ""de"", ""english_name"": ""German""}]",2025-11-23 04:33:05.022549
264644,Room,"Held captive for 7 years in an enclosed space, a woman and her young son finally gain their freedom, allowing the boy to experience the outside world for the first time.",2015-10-16,3.3564,9480,7.998,/2hHDMeYyZjbGWn0BeNH1cTMxuM7.jpg,/cGV6R2vzT4TYIabf3JgmrOISQ0y.jpg,en,"[{""id"": 18, ""name"": ""Drama""}, {""id"": 53, ""name"": ""Thriller""}]",118,13000000,35401758,https://a24films.com/films/room,Love knows no boundaries,Released,tt3170832,"[{""id"": 806, ""name"": ""Téléfilm Canada"", ""logo_path"": ""/kcNh09qqR2Pkw1JAzRW4CommrW4.png"", ""origin_country"": ""CA""}, {""id"": 3353, ""name"": ""Element Pictures"", ""logo_path"": ""/hUw1iTY3hdjyb2zXT9KxupHbL4M.png"", ""origin_country"": ""IE""}, {""id"": 7493, ""name"": ""FilmNation Entertainment"", ""logo_path"": ""/fHitYiGUCkRafgt6VPYQlXWLkdp.png"", ""origin_country"": ""US""}, {""id"": 35846, ""name"": ""No Trace Camping"", ""logo_path"": ""/tOJlsgZNRdMurnJgSiuRFIUz0te.png"", ""origin_country"": ""US""}, {""id"": 6705, ""name"": ""Film4 Productions"", ""logo_path"": ""/iNB1FCwT4XjO6wkN3PnpPnwr9GX.png"", ""origin_country"": ""GB""}, {""id"": 1898, ""name"": ""Fís Éireann/Screen Ireland"", ""logo_path"": ""/8ix6SGlJiyuUDxLBtY8E0PY2G7w.png"", ""origin_country"": ""IE""}]","[{""name"": ""Canada"", ""iso_3166_1"": ""CA""}, {""name"": ""Ireland"", ""iso_3166_1"": ""IE""}, {""name"": ""United Kingdom"", ""iso_3166_1"": ""GB""}, {""name"": ""United States of America"", ""iso_3166_1"": ""US""}]","[{""name"": ""English"", ""iso_639_1"": ""en"", ""english_name"": ""English""}]",2025-11-23 04:33:05.022549
823754,Bo Burnham: Inside,"Stuck in COVID-19 lockdown, US comedian and musician Bo Burnham attempts to stay sane and happy by writing, shooting and performing a one-man comedy special.",2021-07-22,3.5661,563,8.004,/ku1UvTWYvhFQbSesOD6zteY7bXT.jpg,/9sfVyE3sP2dkCwDyV7UlYP5TAAR.jpg,en,"[{""id"": 35, ""name"": ""Comedy""}, {""id"": 18, ""name"": ""Drama""}]",88,0,0,https://www.netflix.com/title/81289483,Look Who’s Inside Again,Released,tt14544192,"[{""id"": 133569, ""name"": ""Attic Bedroom"", ""logo_path"": null, ""origin_country"": ""US""}]","[{""name"": ""United States of America"", ""iso_3166_1"": ""US""}]","[{""name"": ""English"", ""iso_639_1"": ""en"", ""english_name"": ""English""}]",2025-11-23 04:33:05.022549
1108427,Moana,"In Ancient Polynesia, when a terrible curse incurred by Maui reaches the island of an impetuous Chieftain, his willful daughter answers the Ocean's call to seek out the demigod to set things right.",2026-07-08,18.9192,0,0,/2B2XvBZFSOrGt7nptyNoBSFPhfb.jpg,/ogv0eTxwCVcrfKYsl2GKH4hNHJL.jpg,en,"[{""id"": 10751, ""name"": ""Family""}, {""id"": 14, ""name"": ""Fantasy""}, {""id"": 35, ""name"": ""Comedy""}, {""id"": 12, ""name"": ""Adventure""}]",0,0,0,https://movies.disney.com/moana-2026,魔海奇缘,Post Production,tt27419466,"[{""id"": 2, ""name"": ""Walt Disney Pictures"", ""logo_path"": ""/wdrCwmRnLFJhEoH8GSfymY85KHT.png"", ""origin_country"": ""US""}, {""id"": 73669, ""name"": ""Seven Bucks Productions"", ""logo_path"": ""/pZ1sOLrUxvCvW1jODdCFgU6RxUA.png"", ""origin_country"": ""US""}, {""id"": 34081, ""name"": ""Flynn Picture Company"", ""logo_path"": null, ""origin_country"": ""US""}]","[{""name"": ""United States of America"", ""iso_3166_1"": ""US""}]","[{""name"": ""English"", ""iso_639_1"": ""en"", ""english_name"": ""English""}]",2025-11-23 04:33:05.022549
20941,Innocent Voices,"A young boy, attempting to have a normal childhood in 1980s El Salvador, is caught up in a dramatic fight for his life when he desperately tries to avoid the war that is raging all around him.",2005-01-28,4.1102,508,8.2,/hvwB4LdMCLzqXsk5ZjR77vzPkGk.jpg,/oaUWMPGxpb4OsVCrppmlhQA2bwb.jpg,es,"[{""id"": 18, ""name"": ""Drama""}, {""id"": 10752, ""name"": ""War""}]",120,0,837000,"","",Released,tt0387914,"[{""id"": 84497, ""name"": ""Santo Domingo Films"", ""logo_path"": null, ""origin_country"": """"}, {""id"": 5084, ""name"": ""Altavista Films"", ""logo_path"": null, ""origin_country"": ""MX""}, {""id"": 28334, ""name"": ""MUVI Films"", ""logo_path"": null, ""origin_country"": """"}, {""id"": 2253, ""name"": ""Lawrence Bender Productions"", ""logo_path"": null, ""origin_country"": ""US""}, {""id"": 84498, ""name"": ""Organización Santo Domingo"", ""logo_path"": null, ""origin_country"": """"}, {""id"": 59, ""name"": ""A Band Apart"", ""logo_path"": ""/b1tj5EWcFQLYaQrw1D9V4s8kUgN.png"", ""origin_country"": ""US""}, {""id"": 35, ""name"": ""Lions Gate Films"", ""logo_path"": ""/wxrHa3nZ1K4zo65p56991INkGo6.png"", ""origin_country"": ""US""}]","[{""name"": ""Mexico"", ""iso_3166_1"": ""MX""}, {""name"": ""Puerto Rico"", ""iso_3166_1"": ""PR""}, {""name"": ""United States of America"", ""iso_3166_1"": ""US""}]","[{""name"": ""Español"", ""iso_639_1"": ""es"", ""english_name"": ""Spanish""}]",2025-11-23 04:33:05.022549
1323475,Champagne Problems,A driven American exec heads to Paris determined to acquire a champagne brand by Christmas — and accidentally falls for the heir to the bubbly empire.,2025-11-18,54.872,37,6.554,/a66w2eVNFHMgevJlw0d6f4TTrrD.jpg,/4FzoxZAJnhpoeYHexQCHorsWLxB.jpg,en,"[{""id"": 10749, ""name"": ""Romance""}, {""id"": 35, ""name"": ""Comedy""}]",99,0,0,https://www.netflix.com/title/81628146,Christmas in France is always a good idea.,Released,tt33053440,"[{""id"": 123789, ""name"": ""Off Camera Entertainment"", ""logo_path"": ""/kSfI86pw0LxtWhflXxmX0V9fHNQ.png"", ""origin_country"": ""US""}, {""id"": 180075, ""name"": ""Grumpy Entertainment"", ""logo_path"": null, ""origin_country"": """"}, {""id"": 50500, ""name"": ""FullDawa Films"", ""logo_path"": ""/bzsYDghl8K32AypHbMUriXoyrF.png"", ""origin_country"": ""FR""}]","[{""name"": ""United States of America"", ""iso_3166_1"": ""US""}, {""name"": ""France"", ""iso_3166_1"": ""FR""}]","[{""name"": ""English"", ""iso_639_1"": ""en"", ""english_name"": ""English""}, {""name"": ""Français"", ""iso_639_1"": ""fr"", ""english_name"": ""French""}]",2025-11-23 04:33:05.022549
1214931,Nuremberg,"In postwar Germany, an American psychiatrist must determine whether Nazi prisoners are fit to go on trial for war crimes, and finds himself in a complex battle of intellect and ethics with Hermann Göring, Hitler's right-hand man.",2025-11-06,19.9667,20,7.475,/gOPHBaJJNpNDEnTHmDixg5JS8yp.jpg,/xsO1Qgru8sETLTcVla8MrqxOVr0.jpg,en,"[{""id"": 36, ""name"": ""History""}, {""id"": 18, ""name"": ""Drama""}, {""id"": 53, ""name"": ""Thriller""}, {""id"": 10752, ""name"": ""War""}]",148,11800000,10962391,https://www.sonyclassics.com/film/nuremberg,Judgment is coming.,Released,tt29567915,"[{""id"": 86382, ""name"": ""Bluestone Entertainment"", ""logo_path"": ""/yzQivYdNoLd95XtP5ccspiVMDeM.png"", ""origin_country"": ""US""}, {""id"": 10221, ""name"": ""Walden Media"", ""logo_path"": ""/99VfWRgKasZoyK9UVB39gnYvFrZ.png"", ""origin_country"": ""US""}, {""id"": 166380, ""name"": ""Filmsquad"", ""logo_path"": ""/w7jeLWAWm7lPzfIWDjYVIupbHNt.png"", ""origin_country"": ""HU""}, {""id"": 6712, ""name"": ""Titan Media"", ""logo_path"": ""/9vdfii5jwt5EVU5fMghWeME31J1.png"", ""origin_country"": ""US""}, {""id"": 34982, ""name"": ""Mythology Entertainment"", ""logo_path"": ""/uvTmiRZzNfG88dVXi9hQ7eFNirq.png"", ""origin_country"": ""US""}]","[{""name"": ""United States of America"", ""iso_3166_1"": ""US""}, {""name"": ""Hungary"", ""iso_3166_1"": ""HU""}]","[{""name"": ""English"", ""iso_639_1"": ""en"", ""english_name"": ""English""}, {""name"": ""Deutsch"", ""iso_639_1"": ""de"", ""english_name"": ""German""}]",2025-11-23 04:33:05.022549
1446358,Groom & Two Brides,"Adam is allergic to love, but somehow ends up engaged to both his boss's daughter and his first love. Now he must try to keep his double life a secret.",2025-11-06,18.9015,13,6.462,/5ixetxYF75iikkNZ3gImKEjVJNH.jpg,/vWMt9uu77fJP5PU6MfYXANSH4Cs.jpg,ar,"[{""id"": 10749, ""name"": ""Romance""}, {""id"": 35, ""name"": ""Comedy""}]",0,0,0,https://www.netflix.com/title/81749780,"",Released,tt35713227,"[{""id"": 151785, ""name"": ""Eagle Films"", ""logo_path"": ""/fE0vFSOccnwH8jBLh7d0uLxciUO.png"", ""origin_country"": ""AE""}]","[{""name"": ""United Arab Emirates"", ""iso_3166_1"": ""AE""}]","[{""name"": ""العربية"", ""iso_639_1"": ""ar"", ""english_name"": ""Arabic""}]",2025-11-23 04:33:05.022549
1374686,Light of the World,"It's 30 AD and everyone is expectantly awaiting the coming Messiah. While Jesus isn't exactly what they imagined, there is something special about this man. Soon, John, James, Andrew, Peter, and others begin to follow Jesus on an unexpected adventure. This beautifully animated story of Jesus is told through the eyes of his beloved young friend, the Apostle John.",2025-09-04,16.9367,5,9,/3vUqo90FCIHXPiXnQJEeqzg5EDV.jpg,/xeIkV4e4joAmlRJhqJu2N8jR6zC.jpg,en,"[{""id"": 16, ""name"": ""Animation""}, {""id"": 14, ""name"": ""Fantasy""}, {""id"": 18, ""name"": ""Drama""}, {""id"": 10402, ""name"": ""Music""}]",84,20000000,2595702,https://www.lightoftheworld.com/,"An ordinary boy, an extraordinary faith.",Released,tt33235979,"[{""id"": 256605, ""name"": ""Salvation Poem Project"", ""logo_path"": ""/1PysNyvSb2vHlibdfHPuCFex7ok.png"", ""origin_country"": ""US""}, {""id"": 272677, ""name"": ""Epipheo"", ""logo_path"": ""/dFi27ZAsPJzvmus5bzDHK91ZFIQ.png"", ""origin_country"": ""US""}, {""id"": 166365, ""name"": ""Lighthouse Studios"", ""logo_path"": ""/c5EqBauA1cdUKPDIRkFTfNAHZsX.png"", ""origin_country"": ""IE""}]","[{""name"": ""United States of America"", ""iso_3166_1"": ""US""}, {""name"": ""Ireland"", ""iso_3166_1"": ""IE""}]","[{""name"": ""English"", ""iso_639_1"": ""en"", ""english_name"": ""English""}]",2025-11-23 04:33:05.022549
489,Good Will Hunting,"Headstrong yet aimless, Will Hunting has a genius-level IQ but chooses to work as a janitor at MIT. When he secretly solves highly difficult graduate-level math problems, his talents are discovered by Professor Gerald Lambeau, who decides to help the misguided youth reach his potential. When Will is arrested for attacking a police officer, Professor Lambeau makes a deal to get leniency for him if he gets court-ordered therapy. Eventually, therapist Dr. Sean Maguire helps Will confront the demons that are holding him back.",1997-12-05,12.212,13260,8.157,/z2FnLKpFi1HPO7BEJxdkv6hpJSU.jpg,/bpV8wn48s82au37QyUJ51S7X2Vf.jpg,en,"[{""id"": 18, ""name"": ""Drama""}]",127,10000000,225900000,http://www.miramax.com/movie/good-will-hunting,"Some people can never believe in themselves, until someone believes in them.",Released,tt0119217,"[{""id"": 2253, ""name"": ""Lawrence Bender Productions"", ""logo_path"": null, ""origin_country"": ""US""}, {""id"": 23201, ""name"": ""Be Gentlemen Limited Partnership"", ""logo_path"": null, ""origin_country"": """"}, {""id"": 14, ""name"": ""Miramax"", ""logo_path"": ""/m6AHu84oZQxvq7n1rsvMNJIAsMu.png"", ""origin_country"": ""US""}]","[{""name"": ""United States of America"", ""iso_3166_1"": ""US""}]","[{""name"": ""English"", ""iso_639_1"": ""en"", ""english_name"": ""English""}]",2025-11-23 04:33:05.022549
