id,title,overview,release_date,popularity,vote_count,vote_average,poster_path,backdrop_path,original_language,genres,runtime,budget,revenue,homepage,tagline,status,imdb_id,production_companies,production_countries,spoken_languages,last_updated
632632,Given,"Haruki secretly had feelings for Akihiko for years, but Akihiko was still in a relationship with his roommate, the violinist Ugetsu Murata. Haruki, Akihiko, and Ugetsu's love clashes and starts to move forward.",2020-08-22,1.8887,409,8.3,/pegCub2zdYD5As43AOmGsIctuKc.jpg,/9Xz0bzUFTVgDZd4WZz1cJDQjLkB.jpg,ja,"[{""id"": 16, ""name"": ""Animation""}, {""id"": 18, ""name"": ""Drama""}, {""id"": 10402, ""name"": ""Music""}, {""id"": 10749, ""name"": ""Romance""}]",60,0,930363,https://movie2020.given-anime.com,A story of a certain summer.,Released,tt11802992,"[{""id"": 42811, ""name"": ""Lerche"", ""logo_path"": ""/2ZPUk3aYOtKbZk1W4Kp6mfeays8.png"", ""origin_country"": ""JP""}, {""id"": 2883, ""name"": ""Aniplex"", ""logo_path"": ""/rDYExnBV61jGQnkhVVrPN4Yl7O1.png"", ""origin_country"": ""JP""}, {""id"": 1778, ""name"": ""dentsu"", ""logo_path"": ""/b5rT6VbYza3LyfltCmz1OcqzWJM.png"", ""origin_country"": ""JP""}, {""id"": 3341, ""name"": ""Fuji Television Network"", ""logo_path"": ""/dTG5dXE1kU2mpmL9BNnraffckLU.png"", ""origin_country"": ""JP""}, {""id"": 3466, ""name"": ""movic"", ""logo_path"": ""/lmCg0zarmM52wrmsZRUY0QlPKLh.png"", ""origin_country"": ""JP""}, {""id"": 233952, ""name"": ""Shinshokan"", ""logo_path"": null, ""origin_country"": ""JP""}]","[{""name"": ""Japan"", ""iso_3166_1"": ""JP""}]","[{""name"": ""日本語"", ""iso_639_1"": ""ja"", ""english_name"": ""Japanese""}]",2025-11-28 04:21:21.690942
1548092,The Follies,"The human experience, portraying a single intense day. Examines how individuals are pushed to their limits as they defy constraints, whether from self-imposed restrictions, familial expectations, or societal pressures.",2025-11-13,29.3377,11,4.8,/gVGV5fXrG1NSZvhzhPCxxRk9ap9.jpg,/nI0AZlFksZ5oIRhSohUag45Fp6H.jpg,es,"[{""id"": 18, ""name"": ""Drama""}]",121,0,0,"","",Released,tt31226985,"[{""id"": 94327, ""name"": ""Panorama Global"", ""logo_path"": ""/vMaFsZNAshD2mJJHRXuoJ6uLqE4.png"", ""origin_country"": ""MX""}]","[{""name"": ""Mexico"", ""iso_3166_1"": ""MX""}]","[{""name"": ""Español"", ""iso_639_1"": ""es"", ""english_name"": ""Spanish""}]",2025-11-28 04:21:21.690942
995133,"The Boy, the Mole, the Fox and the Horse","The unlikely friendship of a boy, a mole, a fox and a horse traveling together in the boy's search for home.",2022-12-25,3.2753,671,8.214,/wAKBWRhMmBtrCCuqmFwPm2RGTph.jpg,/wO0MIGcA7w7tBI9Ey80Q4Z7qnPm.jpg,en,"[{""id"": 16, ""name"": ""Animation""}, {""id"": 10751, ""name"": ""Family""}, {""id"": 12, ""name"": ""Adventure""}, {""id"": 14, ""name"": ""Fantasy""}]",35,0,0,https://www.bbc.co.uk/programmes/m001gn7t,"A journey, in search of home.",Released,tt22667880,"[{""id"": 183947, ""name"": ""NoneMore Productions"", ""logo_path"": null, ""origin_country"": ""GB""}, {""id"": 11461, ""name"": ""Bad Robot"", ""logo_path"": ""/p9FoEt5shEKRWRKVIlvFaEmRnun.png"", ""origin_country"": ""US""}, {""id"": 3324, ""name"": ""BBC"", ""logo_path"": ""/dqT3yOTlfJRmtvk52Ccd1O6dZ0A.png"", ""origin_country"": ""GB""}]","[{""name"": ""United Kingdom"", ""iso_3166_1"": ""GB""}, {""name"": ""United States of America"", ""iso_3166_1"": ""US""}]","[{""name"": ""English"", ""iso_639_1"": ""en"", ""english_name"": ""English""}]",2025-11-28 04:21:21.690942
1084222,Operation Blood Hunt,"Prolific expert of the occult and whiskey, Reverend Conte, accompanies a ragtag group of military rejects to a remote South Pacific Island to investigate the disappearance of Marines units  stationed there in 1944, said to be at the hands of the Japanese Imperial Army. Upon speaking  with the island’s inhabitants, they soon discover the Marines had actually been massacred by a group of Lycanthropes, known to most as WEREWOLVES.",2024-12-12,90.7743,47,6.734,/wYf4Eq3c4iOa856tEwh3GHruHZW.jpg,/sUoPlzchsCECqpm3ZmDPeL8QKDK.jpg,en,"[{""id"": 28, ""name"": ""Action""}, {""id"": 12, ""name"": ""Adventure""}, {""id"": 27, ""name"": ""Horror""}]",94,0,0,"","",Released,tt23553640,"[{""id"": 64948, ""name"": ""Hillin Entertainment"", ""logo_path"": null, ""origin_country"": ""US""}, {""id"": 176331, ""name"": ""BGG Capital"", ""logo_path"": null, ""origin_country"": ""US""}, {""id"": 6854, ""name"": ""Benetone Films"", ""logo_path"": null, ""origin_country"": ""TH""}]","[{""name"": ""Thailand"", ""iso_3166_1"": ""TH""}, {""name"": ""United States of America"", ""iso_3166_1"": ""US""}]","[{""name"": ""English"", ""iso_639_1"": ""en"", ""english_name"": ""English""}, {""name"": ""日本語"", ""iso_639_1"": ""ja"", ""english_name"": ""Japanese""}]",2025-11-28 04:21:21.690942
1022789,Inside Out 2,"Teenager Riley's mind headquarters is undergoing a sudden demolition to make room for something entirely unexpected: new Emotions! Joy, Sadness, Anger, Fear and Disgust, who’ve long been running a successful operation by all accounts, aren’t sure how to feel when Anxiety shows up. And it looks like she’s not alone.",2024-06-11,29.1878,6262,7.549,/vpnVM9B6NMmQpWeZvzLvDESb2QY.jpg,/p5ozvmdgsmbWe0H8Xk7Rc8SCwAB.jpg,en,"[{""id"": 16, ""name"": ""Animation""}, {""id"": 12, ""name"": ""Adventure""}, {""id"": 35, ""name"": ""Comedy""}, {""id"": 10751, ""name"": ""Family""}]",97,200000000,1698863816,https://movies.disney.com/inside-out-2,Make room for new emotions.,Released,tt22022452,"[{""id"": 3, ""name"": ""Pixar"", ""logo_path"": ""/1TjvGVDMYsj6JBxOAkUHpPEwLf7.png"", ""origin_country"": ""US""}]","[{""name"": ""United States of America"", ""iso_3166_1"": ""US""}]","[{""name"": ""English"", ""iso_639_1"": ""en"", ""english_name"": ""English""}]",2025-11-28 04:21:21.690942
4935,Howl's Moving Castle,"Sophie, a young milliner, is turned into an elderly woman by a witch who enters her shop and curses her. She encounters a wizard named Howl and gets caught up in his resistance to fighting for the king.",2004-09-09,13.5669,10629,8.392,/13kOl2v0nD2OLbVSHnHk8GUFEhO.jpg,/nv5wwZou159v5OC61i4ElR7OqyY.jpg,ja,"[{""id"": 14, ""name"": ""Fantasy""}, {""id"": 16, ""name"": ""Animation""}, {""id"": 12, ""name"": ""Adventure""}]",119,24000000,236049757,"",The two lived there.,Released,tt0347149,"[{""id"": 10342, ""name"": ""Studio Ghibli"", ""logo_path"": ""/uFuxPEZRUcBTEiYIxjHJq62Vr77.png"", ""origin_country"": ""JP""}, {""id"": 1779, ""name"": ""Tokuma Shoten"", ""logo_path"": ""/41nGzTdCnORYZIZzaGZtfsBwQCl.png"", ""origin_country"": ""JP""}, {""id"": 6755, ""name"": ""Nippon Television Network Corporation"", ""logo_path"": ""/bWiM2iY82B32NGmPCOFatgfekIR.png"", ""origin_country"": ""JP""}, {""id"": 1778, ""name"": ""dentsu"", ""logo_path"": ""/b5rT6VbYza3LyfltCmz1OcqzWJM.png"", ""origin_country"": ""JP""}, {""id"": 272654, ""name"": ""Walt Disney Japan"", ""logo_path"": null, ""origin_country"": ""JP""}, {""id"": 12518, ""name"": ""d-rights"", ""logo_path"": ""/qJZAVb8vx6qFLQJ6cunRkVUJVdB.png"", ""origin_country"": ""JP""}, {""id"": 882, ""name"": ""TOHO"", ""logo_path"": ""/fRSWWjquvzcHjACbtF53utZFIll.png"", ""origin_country"": ""JP""}]","[{""name"": ""Japan"", ""iso_3166_1"": ""JP""}]","[{""name"": ""日本語"", ""iso_639_1"": ""ja"", ""english_name"": ""Japanese""}]",2025-11-28 04:21:21.690942
1078605,Weapons,"When all but one child from the same class mysteriously vanish on the same night at exactly the same time, a community is left questioning who or what is behind their disappearance.",2025-08-04,25.5627,2411,7.3,/cpf7vsRZ0MYRQcnLWteD5jK9ymT.jpg,/yKWZIDo4ixcDUeelk2QGVA1EVmC.jpg,en,"[{""id"": 27, ""name"": ""Horror""}, {""id"": 9648, ""name"": ""Mystery""}]",129,38000000,265894217,https://www.warnerbros.com/movies/weapons,"Last night at 2:17 AM, every child from Mrs. Gandy's class woke up, got out of bed, went downstairs, opened the front door, walked into the dark ...and they never came back.",Released,tt26581740,"[{""id"": 12, ""name"": ""New Line Cinema"", ""logo_path"": ""/2ycs64eqV5rqKYHyQK0GVoKGvfX.png"", ""origin_country"": ""US""}, {""id"": 240675, ""name"": ""Subconscious"", ""logo_path"": null, ""origin_country"": ""US""}, {""id"": 829, ""name"": ""Vertigo Entertainment"", ""logo_path"": ""/iJo9zP5QCKyBsmKSOcvXd6UDNih.png"", ""origin_country"": ""US""}, {""id"": 18609, ""name"": ""BoulderLight Pictures"", ""logo_path"": ""/pxtYCfl1DWzvizqZcYwE4NefOOF.png"", ""origin_country"": ""US""}, {""id"": 216687, ""name"": ""Domain Entertainment"", ""logo_path"": ""/kKVYqekveOvLK1IgqdJojLjQvtu.png"", ""origin_country"": ""US""}]","[{""name"": ""United States of America"", ""iso_3166_1"": ""US""}]","[{""name"": ""English"", ""iso_639_1"": ""en"", ""english_name"": ""English""}]",2025-11-28 04:21:21.690942
335,Once Upon a Time in the West,"As the railroad builders advance unstoppably through the Arizona desert on their way to the sea, Jill arrives in the small town of Flagstone with the intention of starting a new life.",1968-12-21,7.5353,4682,8.28,/qbYgqOczabWNn2XKwgMtVrntD6P.jpg,/aKZ9hDmLJTaGSxWdhxqMTcvXmk4.jpg,it,"[{""id"": 18, ""name"": ""Drama""}, {""id"": 37, ""name"": ""Western""}]",166,5000000,5380118,"",There were three men in her life. One to take her… one to love her —and one to kill her.,Released,tt0064116,"[{""id"": 4, ""name"": ""Paramount Pictures"", ""logo_path"": ""/jay6WcMgagAklUt7i9Euwj1pzTF.png"", ""origin_country"": ""US""}, {""id"": 218, ""name"": ""Rafran Cinematografica"", ""logo_path"": null, ""origin_country"": ""IT""}, {""id"": 25287, ""name"": ""San Marco"", ""logo_path"": null, ""origin_country"": ""IT""}]","[{""name"": ""Italy"", ""iso_3166_1"": ""IT""}, {""name"": ""United States of America"", ""iso_3166_1"": ""US""}]","[{""name"": ""English"", ""iso_639_1"": ""en"", ""english_name"": ""English""}]",2025-11-28 04:21:21.690942
1084242,Zootopia 2,"After cracking the biggest case in Zootopia's history, rookie cops Judy Hopps and Nick Wilde find themselves on the twisting trail of a great mystery when Gary De’Snake arrives and turns the animal metropolis upside down. To crack the case, Judy and Nick must go undercover to unexpected new parts of town, where their growing partnership is tested like never before.",2025-11-26,372.412,67,7.5,/oJ7g2CifqpStmoYQyaLQgEU32qO.jpg,/5h2EsPKNDdB3MAtOk9MB9Ycg9Rz.jpg,en,"[{""id"": 16, ""name"": ""Animation""}, {""id"": 10751, ""name"": ""Family""}, {""id"": 35, ""name"": ""Comedy""}, {""id"": 12, ""name"": ""Adventure""}, {""id"": 9648, ""name"": ""Mystery""}]",107,180000000,81100000,https://movies.disney.com/zootopia-2,Zootopia will be changed furrrever...,Released,tt26443597,"[{""id"": 6125, ""name"": ""Walt Disney Animation Studios"", ""logo_path"": ""/tzsMJBJZINu7GHzrpYzpReWhh66.png"", ""origin_country"": ""US""}]","[{""name"": ""United States of America"", ""iso_3166_1"": ""US""}]","[{""name"": ""English"", ""iso_639_1"": ""en"", ""english_name"": ""English""}]",2025-11-28 04:21:21.690942
26451,Investigation of a Citizen Above Suspicion,"Rome, Italy. After committing a heinous crime, a senior police officer exposes evidence incriminating him because his moral commitment prevents him from circumventing the law and the social order it protects.",1970-10-16,1.393,845,8.2,/vPTZwlq1IC4o1DCsEZEl2uGljzm.jpg,/7SUT9mYb7SD88Gz7rFeLbjC2YeG.jpg,it,"[{""id"": 18, ""name"": ""Drama""}, {""id"": 53, ""name"": ""Thriller""}]",111,0,0,"","",Released,tt0065889,"[{""id"": 16968, ""name"": ""Vera Film"", ""logo_path"": null, ""origin_country"": ""IT""}]","[{""name"": ""Italy"", ""iso_3166_1"": ""IT""}]","[{""name"": ""Italiano"", ""iso_639_1"": ""it"", ""english_name"": ""Italian""}]",2025-11-28 04:21:21.690942
1309012,Altered,"In an alternate present, genetically enhanced humans dominate society. Outcasts Leon and Chloe fight for justice against corrupt politicians exploiting genetic disparity, risking everything to challenge the oppressive system.",2025-09-18,336.331,35,6.571,/6QlAcGRaUrgHcZ4WTBh5lsPnzKx.jpg,/zEsHEpCGZwGg3M2b0oSZuaPLwBh.jpg,en,"[{""id"": 878, ""name"": ""Science Fiction""}, {""id"": 28, ""name"": ""Action""}]",85,15000000,0,https://wellgousa.com/films/altered,Fight the system. Change the world.,Released,tt32123395,"[{""id"": 232200, ""name"": ""Studio Atlantic"", ""logo_path"": null, ""origin_country"": ""IE""}, {""id"": 232201, ""name"": ""Art Galaxy"", ""logo_path"": null, ""origin_country"": ""CA""}, {""id"": 273958, ""name"": ""Splendid Entertainment"", ""logo_path"": null, ""origin_country"": ""DE""}, {""id"": 92394, ""name"": ""Well Go USA Entertainment"", ""logo_path"": ""/xnsTWHinFaR4oQuHFdxe6JNhfrI.png"", ""origin_country"": ""US""}]","[{""name"": ""Canada"", ""iso_3166_1"": ""CA""}, {""name"": ""Ireland"", ""iso_3166_1"": ""IE""}, {""name"": ""Germany"", ""iso_3166_1"": ""DE""}, {""name"": ""United States of America"", ""iso_3166_1"": ""US""}]","[{""name"": ""English"", ""iso_639_1"": ""en"", ""english_name"": ""English""}, {""name"": ""Deutsch"", ""iso_639_1"": ""de"", ""english_name"": ""German""}]",2025-11-28 04:21:21.690942
1142101,ClearMind,A grieving woman uses her virtual reality therapy to exact revenge on her former friends.,2024-02-03,33.3955,27,5.167,/7GqEmx1pUQE8pLJR7OR0urXfBuu.jpg,/mMm9EvMfBYvHlszI95932Pwy9NL.jpg,en,"[{""id"": 878, ""name"": ""Science Fiction""}, {""id"": 35, ""name"": ""Comedy""}, {""id"": 53, ""name"": ""Thriller""}]",85,0,0,"",Revenge is not a multiplayer game.,Released,tt15320066,[],"[{""name"": ""United States of America"", ""iso_3166_1"": ""US""}]","[{""name"": ""English"", ""iso_639_1"": ""en"", ""english_name"": ""English""}]",2025-11-28 04:21:21.690942
110420,Wolf Children,"After her werewolf lover unexpectedly dies in an accident, a woman must find a way to raise the son and daughter that she had with him. However, their inheritance of their father's traits prove to be a challenge for her.",2012-07-21,4.5068,2396,8.216,/3Nllh6JgcrFdtOn6iFOWHudNInd.jpg,/oMqgJMCaNIqeJtilc71D4nRqdmt.jpg,ja,"[{""id"": 16, ""name"": ""Animation""}, {""id"": 10751, ""name"": ""Family""}, {""id"": 18, ""name"": ""Drama""}, {""id"": 14, ""name"": ""Fantasy""}]",117,0,55262158,https://gkids.com/films/wolf-children,Love wildly.,Released,tt2140203,"[{""id"": 15662, ""name"": ""Studio Chizu"", ""logo_path"": ""/onTO8FymA6J6puYznAjZDsXvHYf.png"", ""origin_country"": ""JP""}, {""id"": 3464, ""name"": ""Madhouse"", ""logo_path"": ""/9k0nr75nwnNeT2MHerf1OXJN0hj.png"", ""origin_country"": ""JP""}, {""id"": 6755, ""name"": ""Nippon Television Network Corporation"", ""logo_path"": ""/bWiM2iY82B32NGmPCOFatgfekIR.png"", ""origin_country"": ""JP""}, {""id"": 1194, ""name"": ""KADOKAWA Shoten"", ""logo_path"": ""/dwkHaFLgtA7CUNbgKK0wB6bospu.png"", ""origin_country"": ""JP""}, {""id"": 11725, ""name"": ""VAP"", ""logo_path"": ""/3OZxd70DZ1LbVelmZK8mR5FIXxO.png"", ""origin_country"": ""JP""}, {""id"": 14789, ""name"": ""D.N. Dream Partners"", ""logo_path"": ""/dThbJAnUAeQCANrj3kV7RGnLM7R.png"", ""origin_country"": ""JP""}, {""id"": 11727, ""name"": ""Yomiuri Telecasting Corporation"", ""logo_path"": ""/cIMyE9cw1W4kMFGxmC17HKTnVz9.png"", ""origin_country"": ""JP""}, {""id"": 882, ""name"": ""TOHO"", ""logo_path"": ""/fRSWWjquvzcHjACbtF53utZFIll.png"", ""origin_country"": ""JP""}]","[{""name"": ""Japan"", ""iso_3166_1"": ""JP""}]","[{""name"": ""日本語"", ""iso_639_1"": ""ja"", ""english_name"": ""Japanese""}]",2025-11-28 04:21:21.690942
1403735,Laila,"Sonu Model, a renowned beautician from the old city, is forced to disguise himself as Laila, leading to a series of comedic, romantic, and action-packed events. Chaos ensues in this hilarious laugh riot",2025-02-14,36.3659,6,5.2,/aFogllaRGlAhk1nqvVGFpZpl4qU.jpg,/vNUwK5P42m81uG57kKI1WxSZwIQ.jpg,te,"[{""id"": 35, ""name"": ""Comedy""}, {""id"": 10749, ""name"": ""Romance""}]",134,0,0,"","",Released,tt32831759,"[{""id"": 100071, ""name"": ""Shine Screens"", ""logo_path"": null, ""origin_country"": ""IN""}]","[{""name"": ""India"", ""iso_3166_1"": ""IN""}]","[{""name"": ""తెలుగు"", ""iso_639_1"": ""te"", ""english_name"": ""Telugu""}]",2025-11-28 04:21:21.690942
857,Saving Private Ryan,"As U.S. troops storm the beaches of Normandy, three brothers lie dead on the battlefield, with a fourth trapped behind enemy lines. Ranger captain John Miller and seven men are tasked with penetrating German-held territory and bringing the boy home.",1998-07-24,13.7716,16664,8.221,/uqx37cS8cpHg8U35f9U5IBlrCV3.jpg,/rW2xRFlJRbTnBJlQTSjQmjevIwb.jpg,en,"[{""id"": 10752, ""name"": ""War""}, {""id"": 18, ""name"": ""Drama""}, {""id"": 36, ""name"": ""History""}]",169,70000000,481840909,"",The mission is a man.,Released,tt0120815,"[{""id"": 7, ""name"": ""DreamWorks Pictures"", ""logo_path"": ""/vru2SssLX3FPhnKZGtYw00pVIS9.png"", ""origin_country"": ""US""}, {""id"": 4, ""name"": ""Paramount Pictures"", ""logo_path"": ""/jay6WcMgagAklUt7i9Euwj1pzTF.png"", ""origin_country"": ""US""}, {""id"": 56, ""name"": ""Amblin Entertainment"", ""logo_path"": ""/cEaxANEisCqeEoRvODv2dO1I0iI.png"", ""origin_country"": ""US""}, {""id"": 762, ""name"": ""Mutual Film Company"", ""logo_path"": ""/3T7EpKcS13viHu3WzRtQGvi9sTY.png"", ""origin_country"": ""US""}]","[{""name"": ""United States of America"", ""iso_3166_1"": ""US""}]","[{""name"": ""Český"", ""iso_639_1"": ""cs"", ""english_name"": ""Czech""}, {""name"": ""Deutsch"", ""iso_639_1"": ""de"", ""english_name"": ""German""}, {""name"": ""English"", ""iso_639_1"": ""en"", ""english_name"": ""English""}, {""name"": ""Français"", ""iso_639_1"": ""fr"", ""english_name"": ""French""}]",2025-11-28 04:21:21.690942
372058,Your Name.,"High schoolers Mitsuha and Taki are complete strangers living separate lives. But one night, they suddenly switch places. Mitsuha wakes up in Taki’s body, and he in hers. This bizarre occurrence continues to happen randomly, and the two must adjust their lives around each other.",2016-08-26,33.8287,12119,8.479,/q719jXXEzOoYaps6babgKnONONX.jpg,/8x9iKH8kWA0zdkgNdpAew7OstYe.jpg,ja,"[{""id"": 16, ""name"": ""Animation""}, {""id"": 10749, ""name"": ""Romance""}, {""id"": 18, ""name"": ""Drama""}]",106,0,358000000,https://www.funimationfilms.com/movie/yourname/,"Separated by distance, connected by fate.",Released,tt5311514,"[{""id"": 3756, ""name"": ""CoMix Wave Films"", ""logo_path"": ""/t38uPdbKmyBB8brKKeTFWIwojRz.png"", ""origin_country"": ""JP""}, {""id"": 882, ""name"": ""TOHO"", ""logo_path"": ""/fRSWWjquvzcHjACbtF53utZFIll.png"", ""origin_country"": ""JP""}, {""id"": 2073, ""name"": ""KADOKAWA"", ""logo_path"": ""/tWxRSaKmRJNTcmtlXsmn5R4KOSU.png"", ""origin_country"": ""JP""}, {""id"": 8157, ""name"": ""jeki"", ""logo_path"": ""/pEqcMX1aG3JvtDgfh2wNZJLCcb4.png"", ""origin_country"": ""JP""}, {""id"": 14602, ""name"": ""AMUSE"", ""logo_path"": ""/t9eqx5QCHtu8LxxgYzivqrJAosp.png"", ""origin_country"": ""JP""}, {""id"": 128617, ""name"": ""voque ting"", ""logo_path"": null, ""origin_country"": ""JP""}, {""id"": 104184, ""name"": ""Lawson Entertainment"", ""logo_path"": ""/reEBh8dBl2y1DbXe2EdgxtMtaim.png"", ""origin_country"": ""JP""}]","[{""name"": ""Japan"", ""iso_3166_1"": ""JP""}]","[{""name"": ""日本語"", ""iso_639_1"": ""ja"", ""english_name"": ""Japanese""}]",2025-11-28 04:21:21.690942
348,Alien,"During its return to the earth, commercial spaceship Nostromo intercepts a distress signal from a distant planet. When a three-member team of the crew discovers a chamber containing thousands of eggs on the planet, a creature inside one of the eggs attacks an explorer. The entire crew is unaware of the impending nightmare set to descend upon them when the alien parasite planted inside its unfortunate host is birthed.",1979-05-25,14.2311,15763,8.167,/vfrQk5IPloGg1v9Rzbh2Eg3VGyM.jpg,/cEobq5QrnOJjO6giDs8q4RxmMKh.jpg,en,"[{""id"": 27, ""name"": ""Horror""}, {""id"": 878, ""name"": ""Science Fiction""}]",117,11000000,104931801,https://www.20thcenturystudios.com/movies/alien,In space no one can hear you scream.,Released,tt0078748,"[{""id"": 401, ""name"": ""Brandywine Productions"", ""logo_path"": ""/t7mM3DvQ9MwDT3YzMCBrkWpWiiz.png"", ""origin_country"": ""US""}, {""id"": 276266, ""name"": ""Twentieth Century-Fox Productions"", ""logo_path"": null, ""origin_country"": ""GB""}, {""id"": 276267, ""name"": ""Ronald Shusett Productions"", ""logo_path"": null, ""origin_country"": ""US""}]","[{""name"": ""United States of America"", ""iso_3166_1"": ""US""}, {""name"": ""United Kingdom"", ""iso_3166_1"": ""GB""}]","[{""name"": ""English"", ""iso_639_1"": ""en"", ""english_name"": ""English""}, {""name"": ""Español"", ""iso_639_1"": ""es"", ""english_name"": ""Spanish""}]",2025-11-28 04:21:21.690942
203101,High School of the Dead: Drifters of the Dead,"In their efforts to find a safe haven from the zombie apocalypse, the gang find themselves on a deserted island. Now, they take advantage of the momentary respite to enjoy some surf, sand and bathing suits!",2011-04-25,112.3367,471,7.444,/jlRGVYItWkDIJg4OZp9S2g5lKuc.jpg,/1t7BMQiYCXI9YLvuMiGwJpO93Kz.jpg,ja,"[{""id"": 35, ""name"": ""Comedy""}, {""id"": 16, ""name"": ""Animation""}, {""id"": 12, ""name"": ""Adventure""}, {""id"": 27, ""name"": ""Horror""}]",18,0,0,http://www.kadokawa.co.jp/shop/sp/shop_sp_154.html,"",Released,tt5799076,"[{""id"": 17981, ""name"": ""AT-X"", ""logo_path"": ""/8UABNMysukRi4udTHYxcNUMbPR1.png"", ""origin_country"": ""JP""}, {""id"": 3464, ""name"": ""Madhouse"", ""logo_path"": ""/9k0nr75nwnNeT2MHerf1OXJN0hj.png"", ""origin_country"": ""JP""}]","[{""name"": ""Japan"", ""iso_3166_1"": ""JP""}]","[{""name"": ""Italiano"", ""iso_639_1"": ""it"", ""english_name"": ""Italian""}, {""name"": ""日本語"", ""iso_639_1"": ""ja"", ""english_name"": ""Japanese""}]",2025-11-28 04:21:21.690942
269149,Zootopia,"Determined to prove herself, Officer Judy Hopps, the first bunny on Zootopia's police force, jumps at the chance to crack her first case - even if it means partnering with scam-artist fox Nick Wilde to solve the mystery.",2016-02-11,70.4083,17114,7.753,/hlK0e0wAQ3VLuJcsfIYPvb4JVud.jpg,/9tOkjBEiiGcaClgJFtwocStZvIT.jpg,en,"[{""id"": 16, ""name"": ""Animation""}, {""id"": 12, ""name"": ""Adventure""}, {""id"": 10751, ""name"": ""Family""}, {""id"": 35, ""name"": ""Comedy""}]",109,150000000,1025521689,http://movies.disney.com/zootopia,Welcome to the urban jungle.,Released,tt2948356,"[{""id"": 6125, ""name"": ""Walt Disney Animation Studios"", ""logo_path"": ""/tzsMJBJZINu7GHzrpYzpReWhh66.png"", ""origin_country"": ""US""}]","[{""name"": ""United States of America"", ""iso_3166_1"": ""US""}]","[{""name"": ""English"", ""iso_639_1"": ""en"", ""english_name"": ""English""}]",2025-11-28 04:21:21.690942
50014,The Help,"Aibileen Clark is a middle-aged African-American maid who has spent her life raising white children and has recently lost her only son; Minny Jackson is an African-American maid who has often offended her employers despite her family's struggles with money and her desperate need for jobs; and Eugenia ""Skeeter"" Phelan is a young white woman who has recently moved back home after graduating college to find out her childhood maid has mysteriously disappeared. These three stories intertwine to explain how life in Jackson, Mississippi revolves around ""the help""; yet they are always kept at a certain distance because of racial lines.",2011-08-09,9.5965,8753,8.204,/3kmfoWWEc9Vtyuaf9v5VipRgdjx.jpg,/k2ZdjMXmqnw4RJeh8cwxCvcznJZ.jpg,en,"[{""id"": 18, ""name"": ""Drama""}]",146,25000000,216600000,"",Change begins with a whisper.,Released,tt1454029,"[{""id"": 436, ""name"": ""1492 Pictures"", ""logo_path"": ""/A7WCkG3F0NFvjGCwUnclpGdIu9E.png"", ""origin_country"": ""US""}, {""id"": 95966, ""name"": ""Harbinger Pictures"", ""logo_path"": null, ""origin_country"": ""US""}]","[{""name"": ""United States of America"", ""iso_3166_1"": ""US""}]","[{""name"": ""English"", ""iso_639_1"": ""en"", ""english_name"": ""English""}]",2025-11-28 04:21:21.690942
1246049,Dracula,"When a 15th-century prince denounces God after the devastating loss of his wife, he inherits an eternal curse: he becomes Dracula. Condemned to wander the centuries, he defies fate and death itself, guided by a single hope — to be reunited with his lost love.",2025-07-30,54.1044,445,7.06,/AuL6rqhQPSXqBCK1CYNRs0JhY1b.jpg,/nt0HRxlzOXRpPJtl2FmeBCO6MeR.jpg,fr,"[{""id"": 27, ""name"": ""Horror""}, {""id"": 14, ""name"": ""Fantasy""}, {""id"": 10749, ""name"": ""Romance""}]",129,52000000,25788866,https://signature-entertainment.co.uk/distribution/titles/dracula,"He renounced his faith to become immortal. Passion, anger, vengeance, and hatred will be unleashed into the modern world.",Released,tt31434030,"[{""id"": 6896, ""name"": ""EuropaCorp"", ""logo_path"": ""/2Q89KvzxTKB5BAv9RqFIPI1qb7E.png"", ""origin_country"": ""FR""}, {""id"": 221450, ""name"": ""Luc Besson Production"", ""logo_path"": null, ""origin_country"": ""FR""}, {""id"": 356, ""name"": ""TF1 Films Production"", ""logo_path"": ""/9tW5wZEGotn1Ei5pErA88m47XiD.png"", ""origin_country"": ""FR""}, {""id"": 2902, ""name"": ""SND"", ""logo_path"": ""/vFmmYSgFp8eE6C34JVCXy9bJFmc.png"", ""origin_country"": ""FR""}, {""id"": 18626, ""name"": ""Kinology"", ""logo_path"": ""/gb0xmYIKvNy2LnUOfLVglww7U0g.png"", ""origin_country"": ""FR""}, {""id"": 255253, ""name"": ""Actarus Productions"", ""logo_path"": null, ""origin_country"": ""FR""}]","[{""name"": ""France"", ""iso_3166_1"": ""FR""}]","[{""name"": ""English"", ""iso_639_1"": ""en"", ""english_name"": ""English""}, {""name"": ""Română"", ""iso_639_1"": ""ro"", ""english_name"": ""Romanian""}]",2025-11-28 04:21:21.690942
