id,title,overview,release_date,popularity,vote_count,vote_average,poster_path,backdrop_path,original_language,genres,runtime,budget,revenue,homepage,tagline,status,imdb_id,production_companies,production_countries,spoken_languages,last_updated
1468417,First Moon,"A young waitress is abducted by a religious cult, who are hell-bent on curing her from a sexually transmitted werewolf virus - or killing her in the process. Will she escape before the first full moon?",2025-05-06,74.4937,47,4.021,/hcjYvv4k9qs0lDG1Q3GIglT30IW.jpg,/7h0qCqkuQzmG5vXN3lGBc06reLd.jpg,en,"[{""id"": 27, ""name"": ""Horror""}, {""id"": 53, ""name"": ""Thriller""}]",97,0,0,"",Fear the monster within,Released,tt26920256,[],[],"[{""name"": ""English"", ""iso_639_1"": ""en"", ""english_name"": ""English""}]",2025-11-28 04:21:21.690942
1280518,Laberinto de sombras,"",2024-05-10,89.0386,2,4.5,/565kBAr0hvgLbJKyAd3dUKk2xn0.jpg,,es,"[{""id"": 27, ""name"": ""Horror""}]",0,0,0,"","",Released,,[],[],"[{""name"": ""Español"", ""iso_639_1"": ""es"", ""english_name"": ""Spanish""}]",2025-11-28 04:21:21.690942
533514,Violet Evergarden: The Movie,"As the world moves on from the war and technological advances bring changes to her life, Violet still hopes to see her lost commanding officer again.",2020-09-18,4.5135,465,8.3,/4b7uAGVtgA85Yd911yOJqIsHigx.jpg,/wGwSWDG3LIQxchg2M8HV7bDqYKU.jpg,ja,"[{""id"": 16, ""name"": ""Animation""}, {""id"": 14, ""name"": ""Fantasy""}, {""id"": 10749, ""name"": ""Romance""}, {""id"": 18, ""name"": ""Drama""}]",140,0,20339624,https://www.netflix.com/title/81193214,"",Released,tt8652818,"[{""id"": 5438, ""name"": ""Kyoto Animation"", ""logo_path"": ""/leZ8GPCL0GneHHayPVnXtB3p0We.png"", ""origin_country"": ""JP""}, {""id"": 86839, ""name"": ""ABC Animation"", ""logo_path"": ""/cnOJAkVVmKZLIzmgw4fRRZ2dctT.png"", ""origin_country"": ""JP""}, {""id"": 9148, ""name"": ""Pony Canyon"", ""logo_path"": ""/rtW3NadfF4kR5mTW00ahiFxw6k7.png"", ""origin_country"": ""JP""}, {""id"": 136217, ""name"": ""Bandai Namco Arts"", ""logo_path"": ""/dBYuplhBgeOsGPQOI0LukWNbFWE.png"", ""origin_country"": ""JP""}, {""id"": 244119, ""name"": ""Rakuonsha"", ""logo_path"": null, ""origin_country"": ""JP""}]","[{""name"": ""Japan"", ""iso_3166_1"": ""JP""}]","[{""name"": ""日本語"", ""iso_639_1"": ""ja"", ""english_name"": ""Japanese""}]",2025-11-28 04:21:21.690942
574475,Final Destination Bloodlines,"Plagued by a violent recurring nightmare, college student Stefanie heads home to track down the one person who might be able to break the cycle and save her family from the grisly demise that inevitably awaits them all.",2025-05-14,26.9714,2403,7.103,/6WxhEvFsauuACfv8HyoVX6mZKFj.jpg,/uIpJPDNFoeX0TVml9smPrs9KUVx.jpg,en,"[{""id"": 27, ""name"": ""Horror""}, {""id"": 9648, ""name"": ""Mystery""}]",110,50000000,315630814,https://www.finaldestinationmovie.com,Death runs in the family.,Released,tt9619824,"[{""id"": 12, ""name"": ""New Line Cinema"", ""logo_path"": ""/2ycs64eqV5rqKYHyQK0GVoKGvfX.png"", ""origin_country"": ""US""}, {""id"": 48788, ""name"": ""Practical Pictures"", ""logo_path"": null, ""origin_country"": ""US""}, {""id"": 252366, ""name"": ""Freshman Year"", ""logo_path"": ""/DwpaN189I3OYb0u2HKZUDe7xox.png"", ""origin_country"": ""US""}, {""id"": 252367, ""name"": ""Fireside Films"", ""logo_path"": null, ""origin_country"": ""US""}, {""id"": 216687, ""name"": ""Domain Entertainment"", ""logo_path"": ""/kKVYqekveOvLK1IgqdJojLjQvtu.png"", ""origin_country"": ""US""}]","[{""name"": ""United States of America"", ""iso_3166_1"": ""US""}]","[{""name"": ""English"", ""iso_639_1"": ""en"", ""english_name"": ""English""}]",2025-11-28 04:21:21.690942
3082,Modern Times,"A bumbling tramp desires to build a home with a young woman, yet is thwarted time and time again by his lack of experience and habit of being in the wrong place at the wrong time..",1936-02-05,2.1857,3924,8.282,/7uoiKOEjxBBW0AgDGQWrlfGQ90w.jpg,/kSlO1pHpwQfPQdgVPr7dJiJNtJ8.jpg,en,"[{""id"": 35, ""name"": ""Comedy""}, {""id"": 18, ""name"": ""Drama""}, {""id"": 10749, ""name"": ""Romance""}]",87,1500000,1800000,"","He stands alone as the greatest entertainer of modern times! No one on earth can make you laugh as heartily or touch your heart as deeply...the whole world laughs, cries and thrills to his priceless genius!",Released,tt0027977,"[{""id"": 1315, ""name"": ""Charles Chaplin Productions"", ""logo_path"": null, ""origin_country"": ""US""}]","[{""name"": ""United States of America"", ""iso_3166_1"": ""US""}]","[{""name"": ""English"", ""iso_639_1"": ""en"", ""english_name"": ""English""}]",2025-11-28 04:21:21.690942
13,Forrest Gump,"A man with a low IQ has accomplished great things in his life and been present during significant historic events—in each case, far exceeding what anyone imagined he could do. But despite all he has achieved, his one true love eludes him.",1994-06-23,19.4926,28885,8.463,/saHP97rTPS5eLmrLQEcANmKrsFl.jpg,/67HggiWaP9ZLv5sPYmyRV37yAJM.jpg,en,"[{""id"": 35, ""name"": ""Comedy""}, {""id"": 18, ""name"": ""Drama""}, {""id"": 10749, ""name"": ""Romance""}]",142,55000000,677387716,https://www.paramountmovies.com/movies/forrest-gump,The world will never be the same once you've seen it through the eyes of Forrest Gump.,Released,tt0109830,"[{""id"": 4, ""name"": ""Paramount Pictures"", ""logo_path"": ""/jay6WcMgagAklUt7i9Euwj1pzTF.png"", ""origin_country"": ""US""}, {""id"": 21920, ""name"": ""The Steve Tisch Company"", ""logo_path"": null, ""origin_country"": ""US""}, {""id"": 412, ""name"": ""Wendy Finerman Productions"", ""logo_path"": null, ""origin_country"": """"}]","[{""name"": ""United States of America"", ""iso_3166_1"": ""US""}]","[{""name"": ""English"", ""iso_639_1"": ""en"", ""english_name"": ""English""}]",2025-11-28 04:21:21.690942
299534,Avengers: Endgame,"After the devastating events of Avengers: Infinity War, the universe is in ruins due to the efforts of the Mad Titan, Thanos. With the help of remaining allies, the Avengers must assemble once more in order to undo Thanos' actions and restore order to the universe once and for all, no matter what consequences may be in store.",2019-04-24,13.3126,26950,8.237,/bR8ISy1O9XQxqiy0fQFw2BX72RQ.jpg,/9wXPKruA6bWYk2co5ix6fH59Qr8.jpg,en,"[{""id"": 12, ""name"": ""Adventure""}, {""id"": 878, ""name"": ""Science Fiction""}, {""id"": 28, ""name"": ""Action""}]",181,356000000,2799439100,https://www.marvel.com/movies/avengers-endgame,Avenge the fallen.,Released,tt4154796,"[{""id"": 420, ""name"": ""Marvel Studios"", ""logo_path"": ""/hUzeosd33nzE5MCNsZxCGEKTXaQ.png"", ""origin_country"": ""US""}]","[{""name"": ""United States of America"", ""iso_3166_1"": ""US""}]","[{""name"": ""English"", ""iso_639_1"": ""en"", ""english_name"": ""English""}, {""name"": ""日本語"", ""iso_639_1"": ""ja"", ""english_name"": ""Japanese""}, {""name"": """", ""iso_639_1"": ""xh"", ""english_name"": ""Xhosa""}]",2025-11-28 04:21:21.690942
599,Sunset Boulevard,A hack screenwriter writes a screenplay for a former silent film star who has faded into Hollywood obscurity.,1950-08-10,2.8259,2794,8.3,/oOZIN0sbRNLKQC4RRCQnmAx1PlV.jpg,/p47ihFj4A7EpBjmPHdTj4ipyq1S.jpg,en,"[{""id"": 18, ""name"": ""Drama""}]",110,1752000,5000000,"",A Hollywood Story.,Released,tt0043014,"[{""id"": 4, ""name"": ""Paramount Pictures"", ""logo_path"": ""/jay6WcMgagAklUt7i9Euwj1pzTF.png"", ""origin_country"": ""US""}]","[{""name"": ""United States of America"", ""iso_3166_1"": ""US""}]","[{""name"": ""English"", ""iso_639_1"": ""en"", ""english_name"": ""English""}]",2025-11-28 04:21:21.690942
568332,Taylor Swift: Reputation Stadium Tour,"Taylor Swift takes the stage in Dallas for the Reputation Stadium Tour and celebrates a monumental night of music, memories and visual magic.",2018-12-31,2.9815,416,8.228,/u6oXUTtOuJRPdUgUuPAVVJPSKCo.jpg,/4uMrZS7XEHRNKwHr5wSOxROanPF.jpg,en,"[{""id"": 10402, ""name"": ""Music""}]",125,0,0,https://www.netflix.com/title/81026251,"And in the death of her reputation, she felt truly alive.",Released,tt9426852,"[{""id"": 91410, ""name"": ""Den of Thieves"", ""logo_path"": ""/klnZXdGFzDn6fBqHgJs91PYLSUZ.png"", ""origin_country"": ""US""}, {""id"": 69922, ""name"": ""Taylor Swift Productions"", ""logo_path"": ""/afnIZUPqGAmPh9rFncRGA2vEVwx.png"", ""origin_country"": ""US""}]","[{""name"": ""United States of America"", ""iso_3166_1"": ""US""}]","[{""name"": ""English"", ""iso_639_1"": ""en"", ""english_name"": ""English""}]",2025-11-28 04:21:21.690942
299536,Avengers: Infinity War,"As the Avengers and their allies have continued to protect the world from threats too large for any one hero to handle, a new danger has emerged from the cosmic shadows: Thanos. A despot of intergalactic infamy, his goal is to collect all six Infinity Stones, artifacts of unimaginable power, and use them to inflict his twisted will on all of reality. Everything the Avengers have fought for has led up to this moment - the fate of Earth and existence itself has never been more uncertain.",2018-04-25,21.5437,31164,8.235,/7WsyChQLEftFiDOVTGkv3hFpyyt.jpg,/mDfJG3LC3Dqb67AZ52x3Z0jU0uB.jpg,en,"[{""id"": 12, ""name"": ""Adventure""}, {""id"": 28, ""name"": ""Action""}, {""id"": 878, ""name"": ""Science Fiction""}]",149,300000000,2052415039,https://www.marvel.com/movies/avengers-infinity-war,Destiny arrives all the same.,Released,tt4154756,"[{""id"": 420, ""name"": ""Marvel Studios"", ""logo_path"": ""/hUzeosd33nzE5MCNsZxCGEKTXaQ.png"", ""origin_country"": ""US""}]","[{""name"": ""United States of America"", ""iso_3166_1"": ""US""}]","[{""name"": ""English"", ""iso_639_1"": ""en"", ""english_name"": ""English""}, {""name"": """", ""iso_639_1"": ""xh"", ""english_name"": ""Xhosa""}]",2025-11-28 04:21:21.690942
11,Star Wars,Princess Leia is captured and held hostage by the evil Imperial forces in their effort to take over the galactic Empire. Venturesome Luke Skywalker and dashing captain Han Solo team together with the loveable robot duo R2-D2 and C-3PO to rescue the beautiful princess and restore peace and justice in the Empire.,1977-05-25,16.095,21677,8.204,/6FfCtAuVAW8XJjZ7eWeLibRLWTw.jpg,/2w4xG178RpB4MDAIfTkqAuSJzec.jpg,en,"[{""id"": 12, ""name"": ""Adventure""}, {""id"": 28, ""name"": ""Action""}, {""id"": 878, ""name"": ""Science Fiction""}]",121,11000000,775398007,http://www.starwars.com/films/star-wars-episode-iv-a-new-hope,"A long time ago in a galaxy far, far away...",Released,tt0076759,"[{""id"": 1, ""name"": ""Lucasfilm Ltd."", ""logo_path"": ""/tlVSws0RvvtPBwViUyOFAO0vcQS.png"", ""origin_country"": ""US""}, {""id"": 25, ""name"": ""20th Century Fox"", ""logo_path"": ""/qZCc1lty5FzX30aOCVRBLzaVmcp.png"", ""origin_country"": ""US""}]","[{""name"": ""United States of America"", ""iso_3166_1"": ""US""}]","[{""name"": ""English"", ""iso_639_1"": ""en"", ""english_name"": ""English""}]",2025-11-28 04:21:21.690942
372754,Dou kyu sei – Classmates,"Rihito Sajo, an honor student with a perfect score on the entrance exam and Hikaru Kusakabe, in a band and popular among girls, would have never crossed paths. Until one day they started talking at the practice for their school’s upcoming chorus festival. After school, the two meet regularly, as Hikaru helps Rihito to improve his singing skills. While they listen to each other’s voice and harmonize, their hearts start to beat together.",2016-02-20,2.8949,420,8.3,/cIfRCA5wEvj9tApca4UDUagQEiM.jpg,/tLmyP7akYmxLwyfTEt2qyj2sOR3.jpg,ja,"[{""id"": 10749, ""name"": ""Romance""}, {""id"": 16, ""name"": ""Animation""}]",61,0,1397526,http://doukyuseimovie.com/,"Sincerely, Slowly, Falling in Love.",Released,tt5526028,"[{""id"": 13113, ""name"": ""A-1 Pictures"", ""logo_path"": ""/xV5tPYKZhP2Ko9dOh5A3FahuKsx.png"", ""origin_country"": ""JP""}, {""id"": 2883, ""name"": ""Aniplex"", ""logo_path"": ""/rDYExnBV61jGQnkhVVrPN4Yl7O1.png"", ""origin_country"": ""JP""}, {""id"": 249175, ""name"": ""HALF H･P STUDIO"", ""logo_path"": ""/kAsLr1tqACZk9o8A3Lj52851oVw.png"", ""origin_country"": ""JP""}]","[{""name"": ""Japan"", ""iso_3166_1"": ""JP""}]","[{""name"": ""日本語"", ""iso_639_1"": ""ja"", ""english_name"": ""Japanese""}]",2025-11-28 04:21:21.690942
1429520,Sidelined 2: Intercepted,"Freshman star quarterback Drayton struggles with the weight of expectations after a devastating setback, while dancer Dallas begins to question the future she thought she wanted. As their high school relationship begins to unravel under the pressures of distance and self-discovery, they’ll learn that the bravest versions of themselves emerge when they let life redirect them.",2025-11-27,6.7784,0,0,/rdBS9IHET7X2dD2y3eS2D3o5g7b.jpg,/iMxWTPRqWJJKVW7KYBlmirSeazw.jpg,en,"[{""id"": 10749, ""name"": ""Romance""}, {""id"": 35, ""name"": ""Comedy""}]",100,0,0,"","When it's all on the line, hold on tight.",Released,tt35672930,"[{""id"": 182897, ""name"": ""Wattpad WEBTOON Studios"", ""logo_path"": ""/5jZX93pvheCYowROn9LAz499FC5.png"", ""origin_country"": ""US""}, {""id"": 94607, ""name"": ""Marshall Arts"", ""logo_path"": null, ""origin_country"": ""CA""}, {""id"": 81242, ""name"": ""Great Pacific Media"", ""logo_path"": ""/qDqp143aZVXkykSiqivXfkSmX0b.png"", ""origin_country"": ""CA""}]","[{""name"": ""United States of America"", ""iso_3166_1"": ""US""}]","[{""name"": ""English"", ""iso_639_1"": ""en"", ""english_name"": ""English""}]",2025-11-28 04:21:21.690942
1426968,The Gentleman,"Aging ex-soldier Theo meets weekly with prostitute Olga to reminisce. After Olga's murder, Theo seeks bloody revenge, attracting attention of alcoholic cop Iborra and hitman Herodes.",2025-09-26,170.7684,11,6.1,/iIIZ3qIh7A3B8Y1VVo5laFyusVV.jpg,/zmfaCjc4MNUWgEztT3pOOyMSMBw.jpg,es,"[{""id"": 28, ""name"": ""Action""}, {""id"": 80, ""name"": ""Crime""}, {""id"": 53, ""name"": ""Thriller""}]",89,0,0,"","",Released,tt32140922,"[{""id"": 125381, ""name"": ""SDB Films"", ""logo_path"": ""/fqyj3ATL45iYVHSIprJP1cUy4sG.png"", ""origin_country"": ""MX""}, {""id"": 85066, ""name"": ""Film Factory"", ""logo_path"": ""/5FhRorfPgloqzv7zlEAMi0dsiCa.png"", ""origin_country"": ""ES""}, {""id"": 149886, ""name"": ""Esto También Pasará"", ""logo_path"": ""/oDG7mNqzGZGRI8Q4qIAPOS0wdh4.png"", ""origin_country"": ""ES""}, {""id"": 80408, ""name"": ""Glow"", ""logo_path"": ""/e2LblDStah74O4c9E6o1U0qv0Oa.png"", ""origin_country"": ""ES""}, {""id"": 268306, ""name"": ""Ya no quedan junglas"", ""logo_path"": null, ""origin_country"": ""ES""}]","[{""name"": ""Spain"", ""iso_3166_1"": ""ES""}, {""name"": ""Mexico"", ""iso_3166_1"": ""MX""}]","[{""name"": ""English"", ""iso_639_1"": ""en"", ""english_name"": ""English""}, {""name"": ""Español"", ""iso_639_1"": ""es"", ""english_name"": ""Spanish""}]",2025-11-28 04:21:21.690942
1284120,The Ugly Stepsister,"In a fairy-tale kingdom where beauty is a brutal business, Elvira battles to compete with her incredibly beautiful stepsister, and she will go to any length to catch the prince’s eye.",2025-03-07,36.4883,701,7.335,/rayAREIKtSinuov10GvrZHyXfXH.jpg,/ev9kxdoJ5IYVprt1OvH2SMWJdU1.jpg,no,"[{""id"": 27, ""name"": ""Horror""}, {""id"": 35, ""name"": ""Comedy""}, {""id"": 14, ""name"": ""Fantasy""}, {""id"": 18, ""name"": ""Drama""}]",109,4250000,5325096,https://www.uglystepsister.movie,If the shoe doesn't fit...,Released,tt29344903,"[{""id"": 21979, ""name"": ""Mer Film"", ""logo_path"": ""/pVdOYVNJracFdcEsDihqz3VSZ0U.png"", ""origin_country"": ""NO""}, {""id"": 51112, ""name"": ""Lava Films"", ""logo_path"": ""/kWLbDFg6koYqFMYjmjcifeBFB8F.png"", ""origin_country"": ""PL""}, {""id"": 162093, ""name"": ""MOTOR"", ""logo_path"": ""/f9KIm9oEcVXMROucR8s3XKjXOZk.png"", ""origin_country"": ""DK""}, {""id"": 171066, ""name"": ""Scanbox Production"", ""logo_path"": ""/tjNpvJOTCwvPL2faaj3r2RR3dTs.png"", ""origin_country"": ""DK""}, {""id"": 8288, ""name"": ""Zentropa International Sweden"", ""logo_path"": ""/5THcBZP0ad7hXPjtPTxld5sVJQp.png"", ""origin_country"": ""SE""}, {""id"": 218924, ""name"": ""Mediefondet Zefyr"", ""logo_path"": null, ""origin_country"": ""NO""}, {""id"": 2801, ""name"": ""Film i Väst"", ""logo_path"": ""/bswb1PLLsKDUXMLgy42bZtCtIde.png"", ""origin_country"": ""SE""}]","[{""name"": ""Denmark"", ""iso_3166_1"": ""DK""}, {""name"": ""Norway"", ""iso_3166_1"": ""NO""}, {""name"": ""Poland"", ""iso_3166_1"": ""PL""}, {""name"": ""Sweden"", ""iso_3166_1"": ""SE""}]","[{""name"": ""Norsk"", ""iso_639_1"": ""no"", ""english_name"": ""Norwegian""}, {""name"": ""Polski"", ""iso_639_1"": ""pl"", ""english_name"": ""Polish""}, {""name"": ""svenska"", ""iso_639_1"": ""sv"", ""english_name"": ""Swedish""}]",2025-11-28 04:21:21.690942
338969,The Toxic Avenger Unrated,"When a downtrodden janitor, Winston Gooze, is exposed to a catastrophic toxic accident, he’s transformed into a new kind of hero: The Toxic Avenger. Now, Toxie must rise from outcast to savior, taking on ruthless corporate overlords and corrupt forces who threaten his son, his friends, and his community.",2025-08-28,33.1977,205,6.2,/cCWojb6N9UcTzNVtS4bOM3vQ30x.jpg,/hFNdzos50yMPgGYJAWNrfWrLns4.jpg,en,"[{""id"": 28, ""name"": ""Action""}, {""id"": 35, ""name"": ""Comedy""}, {""id"": 878, ""name"": ""Science Fiction""}]",102,0,3328938,https://toxicavenger.com/,The hero we need now.,Released,tt1633359,"[{""id"": 923, ""name"": ""Legendary Pictures"", ""logo_path"": ""/5UQsZrfbfG2dYJbx8DxfoTr2Bvu.png"", ""origin_country"": ""US""}, {""id"": 3052, ""name"": ""Troma Entertainment"", ""logo_path"": ""/kqP7DC8cUCzDSI5SXiJKJKmQg1K.png"", ""origin_country"": ""US""}]","[{""name"": ""United States of America"", ""iso_3166_1"": ""US""}]","[{""name"": ""English"", ""iso_639_1"": ""en"", ""english_name"": ""English""}]",2025-11-28 04:21:21.690942
539,Psycho,"When larcenous real estate clerk Marion Crane goes on the lam with a wad of cash and hopes of starting a new life, she ends up at the notorious Bates Motel, where manager Norman Bates cares for his housebound mother.",1960-06-22,8.9147,10638,8.421,/yz4QVqPx3h1hD1DfqqQkCq3rmxW.jpg,/mufF1aYvwdpKerhq5R1YrVcbJLY.jpg,en,"[{""id"": 27, ""name"": ""Horror""}, {""id"": 53, ""name"": ""Thriller""}, {""id"": 9648, ""name"": ""Mystery""}]",109,806947,50048065,"",A new and altogether different screen excitement!,Released,tt0054215,"[{""id"": 10717, ""name"": ""Shamley Productions"", ""logo_path"": null, ""origin_country"": ""US""}]","[{""name"": ""United States of America"", ""iso_3166_1"": ""US""}]","[{""name"": ""English"", ""iso_639_1"": ""en"", ""english_name"": ""English""}]",2025-11-28 04:21:21.690942
77338,The Intouchables,A true story of two men who should never have met – a quadriplegic aristocrat who was injured in a paragliding accident and a young man from the projects.,2011-11-02,15.1815,17975,8.271,/i97FM40bOMKvKIo3hjQviETE5yf.jpg,/q6OGlZ1KMEb14AC8KbPCxyNOal6.jpg,fr,"[{""id"": 18, ""name"": ""Drama""}, {""id"": 35, ""name"": ""Comedy""}]",113,13000000,426590315,"",Sometimes you have to reach into someone else's world to find out what's missing in your own.,Released,tt1675434,"[{""id"": 9, ""name"": ""Gaumont"", ""logo_path"": ""/nda3dTUYdDrJ6rZqBpYvY865aDv.png"", ""origin_country"": ""FR""}, {""id"": 7038, ""name"": ""Quad Productions"", ""logo_path"": ""/9YDo78sKAy6xxqBwVBT2Vi9FSZl.png"", ""origin_country"": ""FR""}, {""id"": 7766, ""name"": ""Chaocorp"", ""logo_path"": ""/rwBbDJAlUC0mAVnO02APsy0O80T.png"", ""origin_country"": ""FR""}, {""id"": 8018, ""name"": ""Ten Films"", ""logo_path"": null, ""origin_country"": ""FR""}, {""id"": 356, ""name"": ""TF1 Films Production"", ""logo_path"": ""/9tW5wZEGotn1Ei5pErA88m47XiD.png"", ""origin_country"": ""FR""}]","[{""name"": ""France"", ""iso_3166_1"": ""FR""}]","[{""name"": ""English"", ""iso_639_1"": ""en"", ""english_name"": ""English""}, {""name"": ""Français"", ""iso_639_1"": ""fr"", ""english_name"": ""French""}]",2025-11-28 04:21:21.690942
1196573,She Rides Shotgun,"Newly released from prison and marked for death by unrelenting enemies, Nate must now protect his estranged 11-year-old daughter, Polly, at all costs. With scant resources and no one to trust, Nate and Polly forge a bond under fire as he shows her how to fight and survive—and she teaches him the true meaning of unconditional love.",2025-07-31,131.8899,66,7,/nvqW8mOm818QDio3GKKmPLK8kXj.jpg,/ytCi1wg6YHpYcFRWCO2jpzN31Kf.jpg,en,"[{""id"": 28, ""name"": ""Action""}, {""id"": 53, ""name"": ""Thriller""}, {""id"": 80, ""name"": ""Crime""}]",120,0,23443,"",All a father needs is a fighting chance.,Released,tt27986457,"[{""id"": 181874, ""name"": ""Fifth Season"", ""logo_path"": ""/crrgXvLhDO9c57HYrbO4H58Vxmb.png"", ""origin_country"": ""US""}, {""id"": 106839, ""name"": ""Makeready"", ""logo_path"": ""/uUIoRabgmUH5VYSXs02bgjO92no.png"", ""origin_country"": ""US""}, {""id"": 133908, ""name"": ""Super Frog"", ""logo_path"": ""/6kofNnLeex4wLR5oW3Cgf74hgu6.png"", ""origin_country"": ""US""}, {""id"": 22842, ""name"": ""Waypoint Entertainment"", ""logo_path"": ""/buyfiDYTfPVTHxvYZ4yHu69zFPs.png"", ""origin_country"": ""US""}, {""id"": 22146, ""name"": ""Black Bear Pictures"", ""logo_path"": ""/v37N1mFeXNQfvPankg3feBhVvM7.png"", ""origin_country"": ""US""}]","[{""name"": ""United States of America"", ""iso_3166_1"": ""US""}]","[{""name"": ""English"", ""iso_639_1"": ""en"", ""english_name"": ""English""}, {""name"": ""Gaeilge"", ""iso_639_1"": ""ga"", ""english_name"": ""Irish""}]",2025-11-28 04:21:21.690942
533533,TRON: Ares,"A highly sophisticated Program called Ares is sent from the digital world into the real world on a dangerous mission, marking humankind's first encounter with A.I. beings.",2025-10-08,32.849,415,6.337,/chpWmskl3aKm1aTZqUHRCtviwPy.jpg,/jUplF2dluebAYdHa901mhPVOZYU.jpg,en,"[{""id"": 878, ""name"": ""Science Fiction""}, {""id"": 12, ""name"": ""Adventure""}, {""id"": 28, ""name"": ""Action""}]",119,180000000,142073994,https://movies.disney.com/tron-ares,No going back.,Released,tt6604188,"[{""id"": 2, ""name"": ""Walt Disney Pictures"", ""logo_path"": ""/wdrCwmRnLFJhEoH8GSfymY85KHT.png"", ""origin_country"": ""US""}, {""id"": 23791, ""name"": ""Sean Bailey Productions"", ""logo_path"": null, ""origin_country"": ""US""}]","[{""name"": ""United States of America"", ""iso_3166_1"": ""US""}]","[{""name"": ""English"", ""iso_639_1"": ""en"", ""english_name"": ""English""}]",2025-11-28 04:21:21.690942
533535,Deadpool & Wolverine,"A listless Wade Wilson toils away in civilian life with his days as the morally flexible mercenary, Deadpool, behind him. But when his homeworld faces an existential threat, Wade must reluctantly suit-up again with an even more reluctant Wolverine.",2024-07-24,26.1484,7961,7.568,/8cdWjvZQUExUUTzyp4t6EDMubfO.jpg,/ufpeVEM64uZHPpzzeiDNIAdaeOD.jpg,en,"[{""id"": 28, ""name"": ""Action""}, {""id"": 35, ""name"": ""Comedy""}, {""id"": 878, ""name"": ""Science Fiction""}]",128,200000000,1338073645,https://www.marvel.com/movies/deadpool-and-wolverine,Come together.,Released,tt6263850,"[{""id"": 420, ""name"": ""Marvel Studios"", ""logo_path"": ""/hUzeosd33nzE5MCNsZxCGEKTXaQ.png"", ""origin_country"": ""US""}, {""id"": 104228, ""name"": ""Maximum Effort"", ""logo_path"": ""/hx0C1XcSxGgat8N62GpxoJGTkCk.png"", ""origin_country"": ""US""}, {""id"": 2575, ""name"": ""21 Laps Entertainment"", ""logo_path"": ""/9YJrHYlcfHtwtulkFMAies3aFEl.png"", ""origin_country"": ""US""}, {""id"": 127928, ""name"": ""20th Century Studios"", ""logo_path"": ""/h0rjX5vjW5r8yEnUBStFarjcLT4.png"", ""origin_country"": ""US""}, {""id"": 176762, ""name"": ""Kevin Feige Productions"", ""logo_path"": null, ""origin_country"": ""US""}, {""id"": 22213, ""name"": ""TSG Entertainment"", ""logo_path"": ""/qx9K6bFWJupwde0xQDwOvXkOaL8.png"", ""origin_country"": ""US""}]","[{""name"": ""United States of America"", ""iso_3166_1"": ""US""}]","[{""name"": ""English"", ""iso_639_1"": ""en"", ""english_name"": ""English""}]",2025-11-28 04:21:21.690942
1539104,JUJUTSU KAISEN: Execution -Shibuya Incident x The Culling Game Begins-,"A veil abruptly descends over the busy Shibuya area amid the bustling Halloween crowds, trapping countless civilians inside. Satoru Gojo, the strongest jujutsu sorcerer, steps into the chaos. But lying in wait are curse users and spirits scheming to seal him away. Yuji Itadori, accompanied by his classmates and other top-tier jujutsu sorcerers, enters the fray in an unprecedented clash of curses — the Shibuya Incident. In the aftermath, ten colonies across Japan are transformed into dens of curses in a plan orchestrated by Noritoshi Kamo. As the deadly Culling Game starts, Special Grade sorcerer Yuta Okkotsu is assigned to carry out Yuji's execution for his perceived crimes. A compilation movie of Shibuya Incident including the first two episodes of the Culling Games arc.",2025-11-07,159.6593,37,4.378,/tc7RrVW5FGvyO2tsgW6LIN1esHI.jpg,/eMBYlgFTHfZaTz96eJxlkeMsKo9.jpg,ja,"[{""id"": 16, ""name"": ""Animation""}, {""id"": 28, ""name"": ""Action""}]",88,0,0,https://gkids.com/films/jujutsu-kaisen-execution,"",Released,tt38121182,"[{""id"": 21444, ""name"": ""MAPPA"", ""logo_path"": ""/wSejGn3lAZdQ5muByxvzigwyDY6.png"", ""origin_country"": ""JP""}, {""id"": 882, ""name"": ""TOHO"", ""logo_path"": ""/fRSWWjquvzcHjACbtF53utZFIll.png"", ""origin_country"": ""JP""}, {""id"": 3363, ""name"": ""MBS"", ""logo_path"": ""/sj3vD7n63bTCih7bcf6GnWvRf1Q.png"", ""origin_country"": ""JP""}, {""id"": 2918, ""name"": ""Shueisha"", ""logo_path"": ""/gyEWUBWwqrm3H5T2hkERD9LxpOq.png"", ""origin_country"": ""JP""}, {""id"": 158200, ""name"": ""Sumzap"", ""logo_path"": ""/rf4ZArxPuqx5hdeU7rPIU8IQlYx.png"", ""origin_country"": ""JP""}]","[{""name"": ""Japan"", ""iso_3166_1"": ""JP""}]","[{""name"": ""日本語"", ""iso_639_1"": ""ja"", ""english_name"": ""Japanese""}]",2025-11-28 04:21:21.690942
