id,title,overview,release_date,popularity,vote_count,vote_average,poster_path,backdrop_path,original_language,genres,runtime,budget,revenue,homepage,tagline,status,imdb_id,production_companies,production_countries,spoken_languages,last_updated
568160,Weathering with You,"The summer of his high school freshman year, Hodaka runs away from his remote island home to Tokyo, and quickly finds himself pushed to his financial and personal limits. The weather is unusually gloomy and rainy every day, as if taking its cue from his life. After many days of solitude, he finally finds work as a freelance writer for a mysterious occult magazine. Then, one day, Hodaka meets Hina on a busy street corner. This bright and strong-willed girl possesses a strange and wonderful ability: the power to stop the rain and clear the sky.",2019-07-19,6.1072,2499,7.99,/qgrk7r1fV4IjuoeiGS5HOhXNdLJ.jpg,/ize3ZieqSy0TCWljmVoEiy8fSFS.jpg,ja,"[{""id"": 16, ""name"": ""Animation""}, {""id"": 18, ""name"": ""Drama""}, {""id"": 14, ""name"": ""Fantasy""}, {""id"": 10749, ""name"": ""Romance""}]",112,0,186965409,https://gkidstickets.com/us/weathering-with-you/,A story about the secret of this world that only I and she know.,Released,tt9426210,"[{""id"": 3756, ""name"": ""CoMix Wave Films"", ""logo_path"": ""/t38uPdbKmyBB8brKKeTFWIwojRz.png"", ""origin_country"": ""JP""}, {""id"": 128616, ""name"": ""Story"", ""logo_path"": ""/cjmwexOzetWZa8QKy447NMrM6MG.png"", ""origin_country"": ""JP""}, {""id"": 882, ""name"": ""TOHO"", ""logo_path"": ""/fRSWWjquvzcHjACbtF53utZFIll.png"", ""origin_country"": ""JP""}, {""id"": 2073, ""name"": ""KADOKAWA"", ""logo_path"": ""/tWxRSaKmRJNTcmtlXsmn5R4KOSU.png"", ""origin_country"": ""JP""}, {""id"": 8157, ""name"": ""jeki"", ""logo_path"": ""/pEqcMX1aG3JvtDgfh2wNZJLCcb4.png"", ""origin_country"": ""JP""}, {""id"": 104184, ""name"": ""Lawson Entertainment"", ""logo_path"": ""/reEBh8dBl2y1DbXe2EdgxtMtaim.png"", ""origin_country"": ""JP""}, {""id"": 145448, ""name"": ""\""Weathering With You\"" Film Partners"", ""logo_path"": null, ""origin_country"": ""JP""}]","[{""name"": ""Japan"", ""iso_3166_1"": ""JP""}]","[{""name"": ""日本語"", ""iso_639_1"": ""ja"", ""english_name"": ""Japanese""}]",2025-11-23 04:33:05.022549
1246049,Dracula,"When a 15th-century prince denounces God after the devastating loss of his wife, he inherits an eternal curse: he becomes Dracula. Condemned to wander the centuries, he defies fate and death itself, guided by a single hope — to be reunited with his lost love.",2025-07-30,42.9772,426,7.056,/Ap4kyIiMGsCAI6IKrJejp6AAiTL.jpg,/nt0HRxlzOXRpPJtl2FmeBCO6MeR.jpg,fr,"[{""id"": 27, ""name"": ""Horror""}, {""id"": 14, ""name"": ""Fantasy""}, {""id"": 10749, ""name"": ""Romance""}]",129,52000000,21897132,https://signature-entertainment.co.uk/distribution/titles/dracula,"He renounced his faith to become immortal. Passion, anger, vengeance, and hatred will be unleashed into the modern world.",Released,tt31434030,"[{""id"": 6896, ""name"": ""EuropaCorp"", ""logo_path"": ""/2Q89KvzxTKB5BAv9RqFIPI1qb7E.png"", ""origin_country"": ""FR""}, {""id"": 221450, ""name"": ""Luc Besson Production"", ""logo_path"": null, ""origin_country"": ""FR""}, {""id"": 356, ""name"": ""TF1 Films Production"", ""logo_path"": ""/9tW5wZEGotn1Ei5pErA88m47XiD.png"", ""origin_country"": ""FR""}, {""id"": 2902, ""name"": ""SND"", ""logo_path"": ""/vFmmYSgFp8eE6C34JVCXy9bJFmc.png"", ""origin_country"": ""FR""}, {""id"": 18626, ""name"": ""Kinology"", ""logo_path"": ""/gb0xmYIKvNy2LnUOfLVglww7U0g.png"", ""origin_country"": ""FR""}, {""id"": 255253, ""name"": ""Actarus Productions"", ""logo_path"": null, ""origin_country"": ""FR""}]","[{""name"": ""France"", ""iso_3166_1"": ""FR""}]","[{""name"": ""English"", ""iso_639_1"": ""en"", ""english_name"": ""English""}, {""name"": ""Română"", ""iso_639_1"": ""ro"", ""english_name"": ""Romanian""}]",2025-11-23 04:33:05.022549
559969,El Camino: A Breaking Bad Movie,"In the wake of his dramatic escape from captivity, Jesse Pinkman must come to terms with his past in order to forge some kind of future.",2019-10-11,32.7972,5391,7.046,/ePXuKdXZuJx8hHMNr2yM4jY2L7Z.jpg,/uLXK1LQM28XovWHPao3ViTeggXA.jpg,en,"[{""id"": 80, ""name"": ""Crime""}, {""id"": 18, ""name"": ""Drama""}, {""id"": 53, ""name"": ""Thriller""}]",123,0,0,https://www.netflix.com/title/81078819,"",Released,tt9243946,"[{""id"": 11073, ""name"": ""Sony Pictures Television"", ""logo_path"": ""/wHs44fktdoj6c378ZbSWfzKsM2Z.png"", ""origin_country"": ""US""}, {""id"": 2605, ""name"": ""Gran Via Productions"", ""logo_path"": null, ""origin_country"": ""US""}, {""id"": 33742, ""name"": ""High Bridge Productions"", ""logo_path"": ""/2jdh2sEa0R6y6uT0F7g0IgA2WO8.png"", ""origin_country"": ""US""}]","[{""name"": ""United States of America"", ""iso_3166_1"": ""US""}]","[{""name"": ""English"", ""iso_639_1"": ""en"", ""english_name"": ""English""}]",2025-11-23 04:33:05.022549
901,City Lights,A tramp falls in love with a beautiful blind flower girl. His on-and-off friendship with a wealthy man allows him to be the girl's benefactor and suitor.,1931-02-06,1.8316,2350,8.3,/ugmakEL5y294I5bXgiBqApuZpwc.jpg,/Ma7mQsldFCaQpsZbm8zolgLfmV.jpg,en,"[{""id"": 35, ""name"": ""Comedy""}, {""id"": 18, ""name"": ""Drama""}, {""id"": 10749, ""name"": ""Romance""}]",87,1500000,4250000,https://www.charliechaplin.com/en/films/5-City-Lights,True Blind Love,Released,tt0021749,"[{""id"": 1315, ""name"": ""Charles Chaplin Productions"", ""logo_path"": null, ""origin_country"": ""US""}]","[{""name"": ""United States of America"", ""iso_3166_1"": ""US""}]","[{""name"": ""No Language"", ""iso_639_1"": ""xx"", ""english_name"": ""No Language""}]",2025-11-23 04:33:05.022549
820067,The Quintessential Quintuplets Movie,"When five lovely young girls who hate studying hire part-time tutor Futaro, he guides not only their education but also their hearts. Time spent has brought them all closer, with feelings growing within the girls and Futaro. As they finish their third year of high school and their last school festival approaches, they set their sights on what’s next. Is there a future with one of them and Futaro?",2022-05-20,2.3698,424,8.3,/sg7klpt1xwK1IJirBI9EHaqQwJ5.jpg,/gcgKSyE2iqwfKWMDZ8TJPxeIu0P.jpg,ja,"[{""id"": 16, ""name"": ""Animation""}, {""id"": 35, ""name"": ""Comedy""}, {""id"": 10749, ""name"": ""Romance""}]",136,0,17288993,https://www.thequintessentialquintuplets-movie.com,"",Released,tt15721650,"[{""id"": 9148, ""name"": ""Pony Canyon"", ""logo_path"": ""/rtW3NadfF4kR5mTW00ahiFxw6k7.png"", ""origin_country"": ""JP""}, {""id"": 157471, ""name"": ""Nichion"", ""logo_path"": ""/sWoNzrlMtRH8p3zKayLfOaTNmiG.png"", ""origin_country"": ""JP""}, {""id"": 118286, ""name"": ""Bibury Animation Studios"", ""logo_path"": ""/uANGoTEOifjrGSQd4IxoV89PJjl.png"", ""origin_country"": ""JP""}, {""id"": 118502, ""name"": ""BS11"", ""logo_path"": ""/JQ5bx6n7Qmdmyqz6sqjo5Fz2iR.png"", ""origin_country"": ""JP""}, {""id"": 41861, ""name"": ""GYAO"", ""logo_path"": ""/iQ9Av0fDGKDUInp4I5czxhz5fVj.png"", ""origin_country"": ""JP""}, {""id"": 59118, ""name"": ""Kodansha"", ""logo_path"": ""/9nTCEBgGaaI5swkv8gy2vny0Mb5.png"", ""origin_country"": ""JP""}, {""id"": 187769, ""name"": ""Good Smile Film"", ""logo_path"": ""/hBhVw60TAa5qAT1pNELq1HjpZQ9.png"", ""origin_country"": ""JP""}, {""id"": 42196, ""name"": ""Bushiroad"", ""logo_path"": ""/nQNmHvcmaT0zk1Rf0TYtLYO5MpI.png"", ""origin_country"": ""JP""}, {""id"": 187770, ""name"": ""MAGNET"", ""logo_path"": ""/wrBqL7qMHPOBheZRTlA0Jpz0POF.png"", ""origin_country"": ""JP""}, {""id"": 1393, ""name"": ""TBS"", ""logo_path"": ""/lUACMATs6jcscXIrzNCQzbvNVN5.png"", ""origin_country"": ""JP""}]","[{""name"": ""Japan"", ""iso_3166_1"": ""JP""}]","[{""name"": ""日本語"", ""iso_639_1"": ""ja"", ""english_name"": ""Japanese""}]",2025-11-23 04:33:05.022549
1012582,Bury Me When I'm Dead,"After failing to fulfill his wife's dying wish, a series of unexplainable, horrific events leads a man to believe she's returned to get revenge on him and his pregnant mistress.",2025-07-14,31.0545,7,5.357,/2nUK1Jovq346cZvgJbF4l5uQKOL.jpg,/oOlG5axHMt0xhXhy77Ixe3xoDtr.jpg,en,"[{""id"": 9648, ""name"": ""Mystery""}, {""id"": 53, ""name"": ""Thriller""}, {""id"": 27, ""name"": ""Horror""}]",90,0,0,"","",Released,tt8834606,"[{""id"": 180508, ""name"": ""Plenty Good"", ""logo_path"": ""/nRAwhVIUVWdrX3V3uTtwVYUKUnq.png"", ""origin_country"": ""US""}, {""id"": 196124, ""name"": ""Slow Peach"", ""logo_path"": null, ""origin_country"": ""US""}, {""id"": 266213, ""name"": ""80/90"", ""logo_path"": null, ""origin_country"": """"}]","[{""name"": ""United States of America"", ""iso_3166_1"": ""US""}]","[{""name"": ""English"", ""iso_639_1"": ""en"", ""english_name"": ""English""}]",2025-11-23 04:33:05.022549
822119,Captain America: Brave New World,"After meeting with newly elected U.S. President Thaddeus Ross, Sam finds himself in the middle of an international incident. He must discover the reason behind a nefarious global plot before the true mastermind has the entire world seeing red.",2025-02-12,17.2313,2757,6,/pzIddUEMWhWzfvLI3TwxUG2wGoi.jpg,/jhL4eTpccoZSVehhcR8DKLSBHZy.jpg,en,"[{""id"": 28, ""name"": ""Action""}, {""id"": 53, ""name"": ""Thriller""}, {""id"": 878, ""name"": ""Science Fiction""}]",119,180000000,415101577,https://www.marvel.com/movies/captain-america-brave-new-world,The future favors the brave.,Released,tt14513804,"[{""id"": 420, ""name"": ""Marvel Studios"", ""logo_path"": ""/hUzeosd33nzE5MCNsZxCGEKTXaQ.png"", ""origin_country"": ""US""}, {""id"": 176762, ""name"": ""Kevin Feige Productions"", ""logo_path"": null, ""origin_country"": ""US""}]","[{""name"": ""United States of America"", ""iso_3166_1"": ""US""}]","[{""name"": ""English"", ""iso_639_1"": ""en"", ""english_name"": ""English""}, {""name"": ""日本語"", ""iso_639_1"": ""ja"", ""english_name"": ""Japanese""}, {""name"": ""Español"", ""iso_639_1"": ""es"", ""english_name"": ""Spanish""}]",2025-11-23 04:33:05.022549
872,Singin' in the Rain,"In 1927 Hollywood, a silent film star falls for a chorus girl just as he and his paranoid screen partner struggle to make the difficult transition to talking pictures.",1952-04-10,5.7608,3354,8.141,/w03EiJVHP8Un77boQeE7hg9DVdU.jpg,/6qOyw4yfzbzTp5YsCX26C28Do0S.jpg,en,"[{""id"": 35, ""name"": ""Comedy""}, {""id"": 10749, ""name"": ""Romance""}]",103,2540800,7200000,"",What a Glorious Feeling!,Released,tt0045152,"[{""id"": 21, ""name"": ""Metro-Goldwyn-Mayer"", ""logo_path"": ""/usUnaYV6hQnlVAXP6r4HwrlLFPG.png"", ""origin_country"": ""US""}]","[{""name"": ""United States of America"", ""iso_3166_1"": ""US""}]","[{""name"": ""English"", ""iso_639_1"": ""en"", ""english_name"": ""English""}]",2025-11-23 04:33:05.022549
1096563,End of Loyalty,"When the head of a notorious crime family is murdered, his son Grant is hell bent on payback and the only person that can stop him from tearing the city apart and destroying himself in the process is his best friend and federal agent, Ray Rose.",2023-03-07,55.2219,7,5.429,/c4QA1rFQcyBZKaOOdUrDeL1G9Er.jpg,/qskMJe62v9kPj4tD9UawIGW0WxD.jpg,en,"[{""id"": 80, ""name"": ""Crime""}, {""id"": 28, ""name"": ""Action""}]",90,0,0,"",A man can be pushed too far.,Released,tt15811964,[],[],"[{""name"": ""English"", ""iso_639_1"": ""en"", ""english_name"": ""English""}]",2025-11-23 04:33:05.022549
1241982,Moana 2,"After receiving an unexpected call from her wayfinding ancestors, Moana journeys alongside Maui and a new crew to the far seas of Oceania and into dangerous, long-lost waters for an adventure unlike anything she's ever faced.",2024-11-21,28.4165,2793,7.023,/aLVkiINlIeCkcZIzb7XHzPYgO6L.jpg,/zo8CIjJ2nfNOevqNajwMRO6Hwka.jpg,en,"[{""id"": 10751, ""name"": ""Family""}, {""id"": 35, ""name"": ""Comedy""}, {""id"": 12, ""name"": ""Adventure""}, {""id"": 16, ""name"": ""Animation""}, {""id"": 14, ""name"": ""Fantasy""}]",100,150000000,1059242164,https://movies.disney.com/moana-2,The ocean is calling them back.,Released,tt13622970,"[{""id"": 6125, ""name"": ""Walt Disney Animation Studios"", ""logo_path"": ""/tzsMJBJZINu7GHzrpYzpReWhh66.png"", ""origin_country"": ""US""}, {""id"": 158526, ""name"": ""Walt Disney Animation Studios"", ""logo_path"": ""/tzsMJBJZINu7GHzrpYzpReWhh66.png"", ""origin_country"": ""CA""}]","[{""name"": ""Canada"", ""iso_3166_1"": ""CA""}, {""name"": ""United States of America"", ""iso_3166_1"": ""US""}]","[{""name"": ""English"", ""iso_639_1"": ""en"", ""english_name"": ""English""}]",2025-11-23 04:33:05.022549
1241983,Train Dreams,A logger leads a life of quiet grace as he experiences love and loss during an era of monumental change in early 20th-century America.,2025-11-05,67.5375,36,7.986,/l3zS4YnpOi4usyEXGJMtxSqDDyb.jpg,/u5NWHVhZ6HWc1fXnqn82cMar5St.jpg,en,"[{""id"": 18, ""name"": ""Drama""}]",102,10000000,0,https://www.netflix.com/title/82020378,"",Released,tt29768334,"[{""id"": 3540, ""name"": ""Kamala Films"", ""logo_path"": null, ""origin_country"": ""US""}, {""id"": 22146, ""name"": ""Black Bear Pictures"", ""logo_path"": ""/v37N1mFeXNQfvPankg3feBhVvM7.png"", ""origin_country"": ""US""}]","[{""name"": ""United States of America"", ""iso_3166_1"": ""US""}]","[{""name"": ""普通话"", ""iso_639_1"": ""zh"", ""english_name"": ""Mandarin""}, {""name"": ""English"", ""iso_639_1"": ""en"", ""english_name"": ""English""}]",2025-11-23 04:33:05.022549
1125257,Freakier Friday,"Years after Tess and Anna endured an identity crisis, Anna now has a daughter of her own and a soon-to-be stepdaughter. As they navigate the myriad challenges that come when two families merge, Tess and Anna discover lightning might indeed strike twice.",2025-08-06,25.9178,440,6.928,/9wV65OmsjLAqBfDnYTkMPutXH8j.jpg,/yQy9Y3p5INwkfTuHSnzYnz4MCV3.jpg,en,"[{""id"": 35, ""name"": ""Comedy""}, {""id"": 14, ""name"": ""Fantasy""}, {""id"": 10751, ""name"": ""Family""}]",110,42000000,152889065,https://movies.disney.com/freakier-friday,Here we go again.,Released,tt31956415,"[{""id"": 2, ""name"": ""Walt Disney Pictures"", ""logo_path"": ""/wdrCwmRnLFJhEoH8GSfymY85KHT.png"", ""origin_country"": ""US""}, {""id"": 128491, ""name"": ""Burr! Productions"", ""logo_path"": null, ""origin_country"": ""US""}, {""id"": 3538, ""name"": ""Gunn Films"", ""logo_path"": null, ""origin_country"": ""US""}]","[{""name"": ""United States of America"", ""iso_3166_1"": ""US""}]","[{""name"": ""English"", ""iso_639_1"": ""en"", ""english_name"": ""English""}]",2025-11-23 04:33:05.022549
693134,Dune: Part Two,"Follow the mythic journey of Paul Atreides as he unites with Chani and the Fremen while on a path of revenge against the conspirators who destroyed his family. Facing a choice between the love of his life and the fate of the known universe, Paul endeavors to prevent a terrible future only he can foresee.",2024-02-27,14.6252,7208,8.132,/1pdfLvkbY9ohJlCjQH2CZjjYVvJ.jpg,/xOMo8BRK7PfcJv9JCnx7s5hj0PX.jpg,en,"[{""id"": 878, ""name"": ""Science Fiction""}, {""id"": 12, ""name"": ""Adventure""}]",167,190000000,714844358,https://www.dunemovie.com,Long live the fighters.,Released,tt15239678,"[{""id"": 923, ""name"": ""Legendary Pictures"", ""logo_path"": ""/5UQsZrfbfG2dYJbx8DxfoTr2Bvu.png"", ""origin_country"": ""US""}]","[{""name"": ""United States of America"", ""iso_3166_1"": ""US""}]","[{""name"": ""English"", ""iso_639_1"": ""en"", ""english_name"": ""English""}]",2025-11-23 04:33:05.022549
914,The Great Dictator,Dictator Adenoid Hynkel tries to expand his empire while a poor Jewish barber tries to avoid persecution from Hynkel's regime.,1940-10-15,2.5519,3562,8.287,/nhMXB8GTdswYMCL9nepDZymJCOr.jpg,/c8Pi8F1FzpNebtgXcSjC9nWCdSW.jpg,en,"[{""id"": 35, ""name"": ""Comedy""}, {""id"": 10752, ""name"": ""War""}]",125,2000000,11000000,"",Once again - the whole world laughs!,Released,tt0032553,"[{""id"": 1315, ""name"": ""Charles Chaplin Productions"", ""logo_path"": null, ""origin_country"": ""US""}]","[{""name"": ""United States of America"", ""iso_3166_1"": ""US""}]","[{""name"": ""English"", ""iso_639_1"": ""en"", ""english_name"": ""English""}, {""name"": ""Esperanto"", ""iso_639_1"": ""eo"", ""english_name"": ""Esperanto""}]",2025-11-23 04:33:05.022549
1010581,My Fault,"Noah must leave her city, boyfriend, and friends to move into William Leister's mansion, the flashy and wealthy husband of her mother Rafaela. As a proud and independent 17 year old, Noah resists living in a mansion surrounded by luxury. However, it is there where she meets Nick, her new stepbrother, and the clash of their strong personalities becomes evident from the very beginning.",2023-06-08,44.4795,3922,7.764,/w46Vw536HwNnEzOa7J24YH9DPRS.jpg,/oz4U9eA6ilYf1tyiVuGmkftdLac.jpg,es,"[{""id"": 18, ""name"": ""Drama""}, {""id"": 10749, ""name"": ""Romance""}, {""id"": 53, ""name"": ""Thriller""}]",117,0,0,https://www.amazon.com/gp/video/detail/B0B683GY1G,Love can only survive in the shadow of secrets.,Released,tt21909764,"[{""id"": 32485, ""name"": ""Pokeepsie Films"", ""logo_path"": ""/fVXreZkiJTOq1cCi6htSQlPSy7R.png"", ""origin_country"": ""ES""}, {""id"": 208240, ""name"": ""Amazon Studios"", ""logo_path"": ""/hYREaYiVyoGVP26CbDpAWD3wDRD.png"", ""origin_country"": ""ES""}]","[{""name"": ""Spain"", ""iso_3166_1"": ""ES""}]","[{""name"": ""Español"", ""iso_639_1"": ""es"", ""english_name"": ""Spanish""}]",2025-11-23 04:33:05.022549
793511,Deadly Cuts,A black comedy set in a working-class Dublin hair salon where the stylists become accidental vigilantes and community heroes as they take on the gang members and gentrifiers threatening their community.,2021-10-08,16.9128,15,4.4,/8ywnFVEWYVcdwe7NaF6F4ZBCqCw.jpg,/xkWDtiWohSdgGjuLrI5duTQJMIj.jpg,en,"[{""id"": 35, ""name"": ""Comedy""}]",90,0,0,"",No Time To Dye. Combing Soon.,Released,tt11366736,"[{""id"": 1898, ""name"": ""Fís Éireann/Screen Ireland"", ""logo_path"": ""/8ix6SGlJiyuUDxLBtY8E0PY2G7w.png"", ""origin_country"": ""IE""}, {""id"": 738, ""name"": ""Myriad Pictures"", ""logo_path"": ""/bLBdowsgMoipjXLi9QpdcZOvPhG.png"", ""origin_country"": ""US""}, {""id"": 170732, ""name"": ""O'Sullivan Productions"", ""logo_path"": null, ""origin_country"": """"}, {""id"": 170733, ""name"": ""Virgin Media Television"", ""logo_path"": ""/iMPJYEYjZg1B2k2UAxtrgZibxWP.png"", ""origin_country"": ""IE""}]","[{""name"": ""Ireland"", ""iso_3166_1"": ""IE""}]","[{""name"": ""English"", ""iso_639_1"": ""en"", ""english_name"": ""English""}]",2025-11-23 04:33:05.022549
935,Dr. Strangelove or: How I Learned to Stop Worrying and Love the Bomb,"After the insane General Jack D. Ripper initiates a nuclear strike on the Soviet Union, a war room full of politicians, generals and a Russian diplomat all frantically try to stop it.",1964-01-29,3.7963,5939,8.1,/7SixLzxcqezkZEYU8pcHZgbkmjp.jpg,/sTp8K0SfcC2RQef1Tu160z3niHO.jpg,en,"[{""id"": 35, ""name"": ""Comedy""}, {""id"": 10752, ""name"": ""War""}]",95,1800000,9500000,"",The hot-line suspense comedy.,Released,tt0057012,"[{""id"": 88, ""name"": ""Hawk Films"", ""logo_path"": null, ""origin_country"": ""GB""}, {""id"": 5, ""name"": ""Columbia Pictures"", ""logo_path"": ""/71BqEFAF4V3qjjMPCpLuyJFB9A.png"", ""origin_country"": ""US""}]","[{""name"": ""United Kingdom"", ""iso_3166_1"": ""GB""}, {""name"": ""United States of America"", ""iso_3166_1"": ""US""}]","[{""name"": ""English"", ""iso_639_1"": ""en"", ""english_name"": ""English""}]",2025-11-23 04:33:05.022549
938,For a Few Dollars More,"Two bounty hunters both pursue the brutal and sadistic bandit, El Indio, who has a large bounty on his head.",1965-12-18,4.5577,4260,8.017,/ooqASvA7qxlTVKL3KwOzBwy57Dh.jpg,/x0bQvdpr88xVhMrVM93tEIKSM2q.jpg,it,"[{""id"": 37, ""name"": ""Western""}]",132,600000,15000000,"","The man with no name is back... the man in black is waiting... a walking arsenal - he uncoils, strikes and kills!",Released,tt0059578,"[{""id"": 7508, ""name"": ""PEA"", ""logo_path"": null, ""origin_country"": ""IT""}, {""id"": 47, ""name"": ""Constantin Film"", ""logo_path"": ""/i7Z9ot2o3N5Sa3HrF09kniFs2y8.png"", ""origin_country"": ""DE""}, {""id"": 42498, ""name"": ""Arturo González PC"", ""logo_path"": null, ""origin_country"": ""ES""}]","[{""name"": ""Germany"", ""iso_3166_1"": ""DE""}, {""name"": ""Italy"", ""iso_3166_1"": ""IT""}, {""name"": ""Spain"", ""iso_3166_1"": ""ES""}]","[{""name"": ""Italiano"", ""iso_639_1"": ""it"", ""english_name"": ""Italian""}]",2025-11-23 04:33:05.022549
43949,Flipped,"When Juli meets Bryce in the second grade, she knows it's true love. After spending six years trying to convince Bryce the same, she's ready to give up - until he starts to reconsider.",2010-08-06,4.6366,3214,8.008,/6zDYFigohwncqFL00MKbFV01dWb.jpg,/xBSwwkAYl9h8QVG2OxNpSaSgJwr.jpg,en,"[{""id"": 10749, ""name"": ""Romance""}, {""id"": 18, ""name"": ""Drama""}]",89,14000000,4324817,http://www.warnerbros.com/flipped,You never forget your first love.,Released,tt0817177,"[{""id"": 86256, ""name"": ""Reiner / Greisman Productions"", ""logo_path"": null, ""origin_country"": """"}, {""id"": 97, ""name"": ""Castle Rock Entertainment"", ""logo_path"": ""/qv3ih9pR9w2XNKZDsqDqAGuZjqc.png"", ""origin_country"": ""US""}]","[{""name"": ""United States of America"", ""iso_3166_1"": ""US""}]","[{""name"": ""English"", ""iso_639_1"": ""en"", ""english_name"": ""English""}]",2025-11-23 04:33:05.022549
283566,Evangelion: 3.0+1.0 Thrice Upon a Time,"In the aftermath of the Fourth Impact, stranded without their Evangelions, Shinji, Asuka and Rei find refuge in one of the rare pockets of humanity that still exist on the ruined planet Earth. There, each lives a life far different from their days as an Evangelion pilot. However, the danger to the world is far from over. A new impact is looming on the horizon—one that will prove to be the true end of Evangelion.",2021-03-08,5.7437,888,8.203,/md5wZRRj8biHrGtyitgBZo7674t.jpg,/1EAxNqdkVnp48a7NUuNBHGflowM.jpg,ja,"[{""id"": 16, ""name"": ""Animation""}, {""id"": 28, ""name"": ""Action""}, {""id"": 878, ""name"": ""Science Fiction""}, {""id"": 18, ""name"": ""Drama""}]",155,29700000,93882453,https://www.amazon.com/dp/B098WNZSQ3,"Bye-bye, all of EVANGELION.",Released,tt2458948,"[{""id"": 4145, ""name"": ""khara"", ""logo_path"": ""/aEiJyMKr2CxrAJiIdtN70wXqn.png"", ""origin_country"": ""JP""}]","[{""name"": ""Japan"", ""iso_3166_1"": ""JP""}]","[{""name"": ""日本語"", ""iso_639_1"": ""ja"", ""english_name"": ""Japanese""}]",2025-11-23 04:33:05.022549
1223601,Sisu: Road to Revenge,"Returning to the house where his family was brutally murdered during the war, 'the man who refuses to die' dismantles it, loads it on a truck, and is determined to rebuild it somewhere safe in their honor. When the Red Army commander who killed his family comes back hellbent on finishing the job, a relentless, eye-popping cross-country chase ensues — a fight to the death.",2025-10-21,47.3891,11,7.909,/vUiAm0jbrPgbUDCOhRKsvdT0u5h.jpg,/7SgljBnhPPoHxKoQL5ooIhrEgAS.jpg,fi,"[{""id"": 28, ""name"": ""Action""}, {""id"": 10752, ""name"": ""War""}]",89,12200000,2550849,https://sisuroadtorevenge.movie,"When they took his family, he took revenge.",Released,tt31844586,"[{""id"": 177094, ""name"": ""Cosmic Snowball"", ""logo_path"": null, ""origin_country"": ""FI""}, {""id"": 182028, ""name"": ""Good Chaos"", ""logo_path"": ""/mTsDayzbpU8eXyO99NfBOXP6C2U.png"", ""origin_country"": ""GB""}, {""id"": 62408, ""name"": ""Subzero Film Entertainment"", ""logo_path"": null, ""origin_country"": ""FI""}]","[{""name"": ""Finland"", ""iso_3166_1"": ""FI""}, {""name"": ""United Kingdom"", ""iso_3166_1"": ""GB""}]","[{""name"": ""English"", ""iso_639_1"": ""en"", ""english_name"": ""English""}, {""name"": ""suomi"", ""iso_639_1"": ""fi"", ""english_name"": ""Finnish""}, {""name"": ""Pусский"", ""iso_639_1"": ""ru"", ""english_name"": ""Russian""}]",2025-11-23 04:33:05.022549
947,Lawrence of Arabia,"During World War I, English officer Thomas Edward 'T.E.' Lawrence sets out to unite and lead the diverse, often warring, Arab tribes to fight the Turks.",1962-12-11,6.8496,3259,7.997,/AiAm0EtDvyGqNpVoieRw4u65vD1.jpg,/z30x999Uku15xcFbe5s3hLvQPDl.jpg,en,"[{""id"": 12, ""name"": ""Adventure""}, {""id"": 36, ""name"": ""History""}, {""id"": 10752, ""name"": ""War""}]",228,15000000,70000000,"",Nothing is written.,Released,tt0056172,"[{""id"": 11356, ""name"": ""Horizon Pictures"", ""logo_path"": null, ""origin_country"": ""GB""}]","[{""name"": ""United Kingdom"", ""iso_3166_1"": ""GB""}]","[{""name"": ""العربية"", ""iso_639_1"": ""ar"", ""english_name"": ""Arabic""}, {""name"": ""English"", ""iso_639_1"": ""en"", ""english_name"": ""English""}, {""name"": ""Português"", ""iso_639_1"": ""pt"", ""english_name"": ""Portuguese""}, {""name"": ""Türkçe"", ""iso_639_1"": ""tr"", ""english_name"": ""Turkish""}]",2025-11-23 04:33:05.022549
