id,title,overview,release_date,popularity,vote_count,vote_average,poster_path,backdrop_path,original_language,genres,runtime,budget,revenue,homepage,tagline,status,imdb_id,production_companies,production_countries,spoken_languages,last_updated
724089,Gabriel's Inferno: Part II,"Professor Gabriel Emerson finally learns the truth about Julia Mitchell's identity, but his realization comes a moment too late. Julia is done waiting for the well-respected Dante specialist to remember her and wants nothing more to do with him. Can Gabriel win back her heart before she finds love in another's arms?",2020-07-31,0.7807,1534,8.369,/x5o8cLZfEXMoZczTYWLrUo1P7UJ.jpg,/jtAI6OJIWLWiRItNSZoWjrsUtmi.jpg,en,"[{""id"": 10749, ""name"": ""Romance""}, {""id"": 18, ""name"": ""Drama""}]",106,0,0,https://watch.passionflix.com/watch/f299fa17-5a2b-4fee-b53a-a4651747431b,"",Released,tt13535454,"[{""id"": 92153, ""name"": ""PassionFlix"", ""logo_path"": ""/psjvYkjjgAPtS8utnFYDM8t8yi7.png"", ""origin_country"": ""US""}]",[],"[{""name"": ""English"", ""iso_639_1"": ""en"", ""english_name"": ""English""}]",2025-11-28 04:21:21.690942
10376,The Legend of 1900,"The story of a virtuoso piano player who lives his entire life aboard an ocean liner. Born and raised on the ship, 1900 learned about the outside world through interactions with passengers, never setting foot on land, even for the love of his life. Years later, the ship may be destroyed, and a former band member fears that 1900 may still be aboard, willing to go down with the ship.",1998-10-28,8.0161,2364,8.246,/iOcbJ5pxokOPDRgieVDbsFMrCc6.jpg,/muSeX7fnNw0pv4zHK7RSwZln6Hk.jpg,it,"[{""id"": 18, ""name"": ""Drama""}, {""id"": 10402, ""name"": ""Music""}]",170,9000000,21057208,"",An epic story of a man who could do anything... except be ordinary,Released,tt0120731,"[{""id"": 6246, ""name"": ""Medusa Film"", ""logo_path"": ""/7X6pfxldTiOD7MLo2EQqUQlmOUw.png"", ""origin_country"": ""IT""}, {""id"": 27597, ""name"": ""Sciarlò"", ""logo_path"": null, ""origin_country"": ""IT""}]","[{""name"": ""Italy"", ""iso_3166_1"": ""IT""}]","[{""name"": ""Italiano"", ""iso_639_1"": ""it"", ""english_name"": ""Italian""}, {""name"": ""Français"", ""iso_639_1"": ""fr"", ""english_name"": ""French""}, {""name"": ""English"", ""iso_639_1"": ""en"", ""english_name"": ""English""}]",2025-11-28 04:21:21.690942
129,Spirited Away,"A young girl, Chihiro, becomes trapped in a strange new world of spirits. When her parents undergo a mysterious transformation, she must call upon the courage she never knew she had to free her family.",2001-07-20,15.6853,17659,8.535,/39wmItIWsg5sZMyRUHLkWBcuVCM.jpg,/ukfI9QkU1aIhOhKXYWE9n3z1mFR.jpg,ja,"[{""id"": 16, ""name"": ""Animation""}, {""id"": 10751, ""name"": ""Family""}, {""id"": 14, ""name"": ""Fantasy""}]",125,19000000,274925095,https://gkids.com/films/spirited-away,On the other side of the tunnel was a mysterious town.,Released,tt0245429,"[{""id"": 10342, ""name"": ""Studio Ghibli"", ""logo_path"": ""/uFuxPEZRUcBTEiYIxjHJq62Vr77.png"", ""origin_country"": ""JP""}, {""id"": 1779, ""name"": ""Tokuma Shoten"", ""logo_path"": ""/41nGzTdCnORYZIZzaGZtfsBwQCl.png"", ""origin_country"": ""JP""}, {""id"": 6755, ""name"": ""Nippon Television Network Corporation"", ""logo_path"": ""/bWiM2iY82B32NGmPCOFatgfekIR.png"", ""origin_country"": ""JP""}, {""id"": 11847, ""name"": ""Mitsubishi"", ""logo_path"": ""/rZP0I1p3hZNUMNFPHUSal6rWThQ.png"", ""origin_country"": ""JP""}, {""id"": 1778, ""name"": ""dentsu"", ""logo_path"": ""/b5rT6VbYza3LyfltCmz1OcqzWJM.png"", ""origin_country"": ""JP""}, {""id"": 1780, ""name"": ""TFC"", ""logo_path"": ""/jdnvUiU7I3Uf2ig0VZNNjf0ORRL.png"", ""origin_country"": ""JP""}]","[{""name"": ""Japan"", ""iso_3166_1"": ""JP""}]","[{""name"": ""日本語"", ""iso_639_1"": ""ja"", ""english_name"": ""Japanese""}]",2025-11-28 04:21:21.690942
1215106,Ko Ga Loak Village,"A wave of chilling serial murders emerges, marked by the gruesome decay of male victims' secret part. As the police investigate, they confront eerie local myths and dark secrets.",2025-11-06,40.8907,5,3.8,/jt31qZw5W1RFXfGyTJCpgjvq2h1.jpg,/4IB1h88hurwGtX9cdxXmgNImNtW.jpg,th,"[{""id"": 35, ""name"": ""Comedy""}, {""id"": 27, ""name"": ""Horror""}]",99,0,0,"",The legend awakens. terrifying. ridiculous. unstoppable.,Released,tt35020020,"[{""id"": 7924, ""name"": ""M Studio"", ""logo_path"": ""/1KG5lcXO8GZ2F6SshuMYw1Yf4vX.png"", ""origin_country"": ""TH""}, {""id"": 134975, ""name"": ""Film Guru"", ""logo_path"": null, ""origin_country"": ""TH""}, {""id"": 5562, ""name"": ""Mono Film"", ""logo_path"": null, ""origin_country"": ""TH""}]","[{""name"": ""Thailand"", ""iso_3166_1"": ""TH""}]","[{""name"": ""ภาษาไทย"", ""iso_639_1"": ""th"", ""english_name"": ""Thai""}]",2025-11-28 04:21:21.690942
128,Princess Mononoke,"Ashitaka, a prince of the disappearing Emishi people, is cursed by a demonized boar god and must journey to the west to find a cure. Along the way, he encounters San, a young human woman fighting to protect the forest, and Lady Eboshi, who is trying to destroy it. Ashitaka must find a way to bring balance to this conflict.",1997-07-12,10.2575,8615,8.326,/cMYCDADoLKLbB83g4WnJegaZimC.jpg,/gl0jzn4BupSbL2qMVeqrjKkF9Js.jpg,ja,"[{""id"": 12, ""name"": ""Adventure""}, {""id"": 14, ""name"": ""Fantasy""}, {""id"": 16, ""name"": ""Animation""}]",134,23500000,176506186,http://www.princess-mononoke.com/,The fate of the world rests on the courage of one warrior.,Released,tt0119698,"[{""id"": 10342, ""name"": ""Studio Ghibli"", ""logo_path"": ""/uFuxPEZRUcBTEiYIxjHJq62Vr77.png"", ""origin_country"": ""JP""}, {""id"": 1778, ""name"": ""dentsu"", ""logo_path"": ""/b5rT6VbYza3LyfltCmz1OcqzWJM.png"", ""origin_country"": ""JP""}, {""id"": 1779, ""name"": ""Tokuma Shoten"", ""logo_path"": ""/41nGzTdCnORYZIZzaGZtfsBwQCl.png"", ""origin_country"": ""JP""}, {""id"": 6755, ""name"": ""Nippon Television Network Corporation"", ""logo_path"": ""/bWiM2iY82B32NGmPCOFatgfekIR.png"", ""origin_country"": ""JP""}, {""id"": 12516, ""name"": ""Nibariki"", ""logo_path"": null, ""origin_country"": ""JP""}, {""id"": 67681, ""name"": ""TNDG"", ""logo_path"": null, ""origin_country"": """"}]","[{""name"": ""Japan"", ""iso_3166_1"": ""JP""}]","[{""name"": ""日本語"", ""iso_639_1"": ""ja"", ""english_name"": ""Japanese""}]",2025-11-28 04:21:21.690942
24188,Il Sorpasso,"Roberto, a shy law student in Rome, meets Bruno, a forty-year-old exuberant, capricious man, who takes him for a drive through the Roman and Tuscany countries in the summer. When their journey starts to blend into their daily lives though, the pair’s newfound friendship is tested.",1962-12-05,4.9518,812,8.2,/4h1ckrJQVcQYjeOkqS8i9BqZ9MI.jpg,/uUrV5KSjnZx47Dq7e6STr73iN4N.jpg,it,"[{""id"": 18, ""name"": ""Drama""}, {""id"": 35, ""name"": ""Comedy""}, {""id"": 12, ""name"": ""Adventure""}]",105,0,0,"","",Released,tt0056512,"[{""id"": 1399, ""name"": ""Fair Film"", ""logo_path"": null, ""origin_country"": ""IT""}, {""id"": 12473, ""name"": ""Incei Film"", ""logo_path"": null, ""origin_country"": ""IT""}, {""id"": 12989, ""name"": ""Sancro Film"", ""logo_path"": null, ""origin_country"": ""IT""}]","[{""name"": ""Italy"", ""iso_3166_1"": ""IT""}]","[{""name"": ""Deutsch"", ""iso_639_1"": ""de"", ""english_name"": ""German""}, {""name"": ""Italiano"", ""iso_639_1"": ""it"", ""english_name"": ""Italian""}, {""name"": ""Latin"", ""iso_639_1"": ""la"", ""english_name"": ""Latin""}]",2025-11-28 04:21:21.690942
476292,Maquia: When the Promised Flower Blooms,"Maquia is a member of a special race called the Iorph who can live for hundreds of years. However, Maquia has always felt lonely despite being surrounded by her people, as she was orphaned from a young age. She daydreams about the outside world, but dares not travel from her home due to the warnings of the clan's chief.  One day the kingdom of Mezarte invades her homeland. They already have what is left of the giant dragons, the Renato, under their control, and now their king wishes to add the immortality to his bloodline.  They ravage the Iorph homeland and kill most of its inhabitants. Caught in the midst of the attack, Maquia is carried off by one of the Renato. It soon dies, and she is left deserted in a forest, now truly alone save for the cries of a single baby off in the distance. Maquia finds the baby in a destroyed village and decides to raise him as her own, naming him Ariel. Although she knows nothing of the human world, how to raise a child that ages much faster than her.",2018-02-24,2.0484,679,8.2,/hL3NqRE2ccR4Y2sYSJTrmalRjrz.jpg,/5nkKy7eEDsXqsxFLJy3GxZhE90J.jpg,ja,"[{""id"": 16, ""name"": ""Animation""}, {""id"": 14, ""name"": ""Fantasy""}, {""id"": 18, ""name"": ""Drama""}, {""id"": 12, ""name"": ""Adventure""}]",115,0,4345395,http://sayoasa.jp,"",Released,tt7339826,"[{""id"": 20867, ""name"": ""P.A.WORKS"", ""logo_path"": ""/8xKcaZSIRdsR616LQ7nMptjkUvg.png"", ""origin_country"": ""JP""}, {""id"": 528, ""name"": ""Bandai Visual"", ""logo_path"": ""/fO3Aof3lXQclYpBByYC8aneTXwA.png"", ""origin_country"": ""JP""}, {""id"": 142186, ""name"": ""Hakuhodo DY Music & Pictures"", ""logo_path"": ""/bdXTOuU7PdsDtQngyM7vb47zePs.png"", ""origin_country"": ""JP""}, {""id"": 6683, ""name"": ""Lantis"", ""logo_path"": ""/reCkuk3GEomdx5gQpsm15Zl1sgX.png"", ""origin_country"": ""JP""}, {""id"": 181190, ""name"": ""Cygames"", ""logo_path"": ""/6O8z7druYj7fXanaIE2f2OVRI9E.png"", ""origin_country"": ""JP""}, {""id"": 244119, ""name"": ""Rakuonsha"", ""logo_path"": null, ""origin_country"": ""JP""}]","[{""name"": ""Japan"", ""iso_3166_1"": ""JP""}]","[{""name"": ""日本語"", ""iso_639_1"": ""ja"", ""english_name"": ""Japanese""}]",2025-11-28 04:21:21.690942
620683,My Mom Is a Character 3,Dona Hermínia will have to rediscover and reinvent herself because her children are forming new families. This supermom will have to deal with a new life scenario: Marcelina is pregnant and Juliano is getting married.,2019-12-26,0.9022,487,8.2,/zw77BFPGJ73Lig8GwRzYj1XHq53.jpg,/19vTfircuojU00I6xtRdy3DrF1e.jpg,pt,"[{""id"": 35, ""name"": ""Comedy""}]",111,2000000,39273021,"","",Released,tt10611372,"[{""id"": 54386, ""name"": ""Migdal Filmes"", ""logo_path"": ""/pqbhVbxp2qLqILbJf1XMxt6Cmq9.png"", ""origin_country"": ""BR""}, {""id"": 13969, ""name"": ""Globo Filmes"", ""logo_path"": ""/bEpiJ2zXGIH70JT16asjWNFtOEv.png"", ""origin_country"": ""BR""}, {""id"": 5726, ""name"": ""Universal Pictures International"", ""logo_path"": ""/7AYU97zQGg3aV3sTiSV0NihOgXG.png"", ""origin_country"": ""GB""}, {""id"": 107355, ""name"": ""Paramount Pictures Brasil"", ""logo_path"": ""/jAafT99rkahlBglJLeWtzyQjcRb.png"", ""origin_country"": ""BR""}, {""id"": 5591, ""name"": ""Downtown Filmes"", ""logo_path"": ""/27dkBmalsJMmz8VPeukvoOFuYCF.png"", ""origin_country"": ""BR""}, {""id"": 53105, ""name"": ""Paris Filmes"", ""logo_path"": ""/rn9sEaA8cXurMyd8HnWkhv8KLqi.png"", ""origin_country"": ""BR""}, {""id"": 7764, ""name"": ""Telecine"", ""logo_path"": ""/6YQPMXHq7juxomK9Sy3zBqbalsD.png"", ""origin_country"": ""BR""}]","[{""name"": ""Brazil"", ""iso_3166_1"": ""BR""}]","[{""name"": ""Português"", ""iso_639_1"": ""pt"", ""english_name"": ""Portuguese""}]",2025-11-28 04:21:21.690942
1419406,The Shadow's Edge,Macau Police brings the tracking expert police officer out of retirement to help catch a dangerous group of professional thieves.,2025-08-16,431.4694,116,6.349,/e0RU6KpdnrqFxDKlI3NOqN8nHL6.jpg,/4BtL2vvEufDXDP4u6xQjjQ1Y2aT.jpg,zh,"[{""id"": 28, ""name"": ""Action""}, {""id"": 80, ""name"": ""Crime""}, {""id"": 53, ""name"": ""Thriller""}]",142,0,702538,"","",Released,tt34610311,"[{""id"": 122699, ""name"": ""iQIYI Pictures"", ""logo_path"": null, ""origin_country"": ""CN""}, {""id"": 197030, ""name"": ""Tao Piao Piao"", ""logo_path"": ""/z9xtT1e3HunOnZUm3uGYb59eL7v.png"", ""origin_country"": ""CN""}, {""id"": 25657, ""name"": ""Hairun Pictures Company"", ""logo_path"": ""/nR1OM1kwQ1ZrtbUb6sSfV0Ldynk.png"", ""origin_country"": ""CN""}, {""id"": 250765, ""name"": ""Dong Fang Chen Xiang"", ""logo_path"": ""/pl14N2WxiYBDNUrPaFBhzyKoO8Z.png"", ""origin_country"": ""CN""}]","[{""name"": ""China"", ""iso_3166_1"": ""CN""}]","[{""name"": ""普通话"", ""iso_639_1"": ""zh"", ""english_name"": ""Mandarin""}]",2025-11-28 04:21:21.690942
1054867,One Battle After Another,"Washed-up revolutionary Bob exists in a state of stoned paranoia, surviving off-grid with his spirited, self-reliant daughter, Willa. When his evil nemesis resurfaces after 16 years and she goes missing, the former radical scrambles to find her, father and daughter both battling the consequences of his past.",2025-09-23,180.143,1664,7.498,/m1jFoahEbeQXtx4zArT2FKdbNIj.jpg,/zpEWFNqoN8Qg1SzMMHmaGyOBTdW.jpg,en,"[{""id"": 28, ""name"": ""Action""}, {""id"": 53, ""name"": ""Thriller""}, {""id"": 80, ""name"": ""Crime""}]",162,130000000,201175005,https://www.onebattleafteranothermovie.com,"Some search for battle, others are born into it...",Released,tt30144839,"[{""id"": 174, ""name"": ""Warner Bros. Pictures"", ""logo_path"": ""/ingPVoHnINIrFR7WHmYux1f5pES.png"", ""origin_country"": ""US""}, {""id"": 178, ""name"": ""Ghoulardi Film Company"", ""logo_path"": null, ""origin_country"": ""US""}, {""id"": 216687, ""name"": ""Domain Entertainment"", ""logo_path"": ""/kKVYqekveOvLK1IgqdJojLjQvtu.png"", ""origin_country"": ""US""}]","[{""name"": ""United States of America"", ""iso_3166_1"": ""US""}]","[{""name"": ""Español"", ""iso_639_1"": ""es"", ""english_name"": ""Spanish""}, {""name"": ""English"", ""iso_639_1"": ""en"", ""english_name"": ""English""}, {""name"": ""తెలుగు"", ""iso_639_1"": ""te"", ""english_name"": ""Telugu""}]",2025-11-28 04:21:21.690942
1396371,Les irresponsables,"Núria, Lila and Andrea are preparing to spend a weekend together, out of town, in a smart, luxurious house full of works of art that a friend of Núria's has left her. Their WhatsApp group is ablaze with good intentions, but the reality is that the three of them are too lazy...Everything changes when an innocent question pushes them to break free and let their impulses take over.",2025-07-24,27.2452,3,5,/kq48E5i40mGlIZU2pc5Q4E9jEAs.jpg,/d8rFsRuL5uDmlPg9gTBpe2pwCyw.jpg,ca,"[{""id"": 35, ""name"": ""Comedy""}, {""id"": 18, ""name"": ""Drama""}]",93,0,0,"",How far would you go to help a friend?,Released,tt34865331,"[{""id"": 7543, ""name"": ""Arcadia Motion Pictures"", ""logo_path"": ""/sPBVpVQf44rVP65TVTFgsn9ZVwE.png"", ""origin_country"": ""ES""}, {""id"": 10069, ""name"": ""Afrodita Audiovisual, A.I.E."", ""logo_path"": null, ""origin_country"": """"}, {""id"": 211922, ""name"": ""3Cat"", ""logo_path"": ""/jXI0xZEJabWaYtfqWxXyKuJJxzX.png"", ""origin_country"": ""ES""}]","[{""name"": ""Spain"", ""iso_3166_1"": ""ES""}]","[{""name"": ""Català"", ""iso_639_1"": ""ca"", ""english_name"": ""Catalan""}]",2025-11-28 04:21:21.690942
490132,Green Book,"Tony Lip, a bouncer in 1962, is hired to drive pianist Don Shirley on a tour through the Deep South in the days when African Americans, forced to find alternate accommodations and services due to segregation laws below the Mason-Dixon Line, relied on a guide called The Negro Motorist Green Book.",2018-11-16,8.3407,12388,8.225,/7BsvSuDQuoqhWmU2fL7W2GOcZHU.jpg,/2Xe9lISpwXKhvKiHttbFfVRERQX.jpg,en,"[{""id"": 18, ""name"": ""Drama""}, {""id"": 35, ""name"": ""Comedy""}, {""id"": 36, ""name"": ""History""}]",130,23000000,321752656,http://GreenBookFilm.com,Inspired by a True Friendship.,Released,tt6966692,"[{""id"": 6735, ""name"": ""Participant"", ""logo_path"": ""/pAQW38WU8ychBvYU2aGPTEbynEN.png"", ""origin_country"": ""US""}, {""id"": 7, ""name"": ""DreamWorks Pictures"", ""logo_path"": ""/vru2SssLX3FPhnKZGtYw00pVIS9.png"", ""origin_country"": ""US""}, {""id"": 88582, ""name"": ""Cinetic Media"", ""logo_path"": ""/zf2Akd6JvRZlnd1OacHYaN5dj0k.png"", ""origin_country"": ""US""}, {""id"": 181849, ""name"": ""Innisfree Pictures"", ""logo_path"": null, ""origin_country"": ""US""}]","[{""name"": ""United States of America"", ""iso_3166_1"": ""US""}]","[{""name"": ""English"", ""iso_639_1"": ""en"", ""english_name"": ""English""}, {""name"": ""Italiano"", ""iso_639_1"": ""it"", ""english_name"": ""Italian""}, {""name"": ""Pусский"", ""iso_639_1"": ""ru"", ""english_name"": ""Russian""}]",2025-11-28 04:21:21.690942
1184918,The Wild Robot,"After a shipwreck, an intelligent robot called Roz is stranded on an uninhabited island. To survive the harsh environment, Roz bonds with the island's animals and cares for an orphaned baby goose.",2024-09-12,18.2236,5516,8.3,/wTnV3PCVW5O92JMrFvvrRcV39RU.jpg,/1pmXyN3sKeYoUhu5VBZiDU4BX21.jpg,en,"[{""id"": 16, ""name"": ""Animation""}, {""id"": 878, ""name"": ""Science Fiction""}, {""id"": 10751, ""name"": ""Family""}, {""id"": 12, ""name"": ""Adventure""}, {""id"": 18, ""name"": ""Drama""}]",102,78000000,331982078,https://www.thewildrobotmovie.com,Discover your true nature.,Released,tt29623480,"[{""id"": 521, ""name"": ""DreamWorks Animation"", ""logo_path"": ""/3BPX5VGBov8SDqTV7wC1L1xShAS.png"", ""origin_country"": ""US""}]","[{""name"": ""United States of America"", ""iso_3166_1"": ""US""}]","[{""name"": ""English"", ""iso_639_1"": ""en"", ""english_name"": ""English""}]",2025-11-28 04:21:21.690942
25237,Come and See,"The invasion of a village in Belarus by German forces sends young Florya into the forest to join the weary Resistance fighters, against his family's wishes. There he meets a girl, Glasha, who accompanies him back to his village. On returning home, Florya finds his family and fellow peasants massacred. His continued survival amidst the brutal debris of war becomes increasingly nightmarish, a battle between despair and hope.",1985-10-17,5.175,1700,8.2,/qNbMsKVzigERgJUbwf8pKyZogpb.jpg,/oIQMt3Q6Qa37YD0JOdYkrIAPYDk.jpg,ru,"[{""id"": 18, ""name"": ""Drama""}, {""id"": 10752, ""name"": ""War""}]",142,0,20929648,"",The cruelest side of war.,Released,tt0091251,"[{""id"": 12617, ""name"": ""Belarusfilm"", ""logo_path"": ""/9Wf5DFTvzxo0pSqDp8MQWW3d01.png"", ""origin_country"": ""SU""}, {""id"": 344, ""name"": ""Mosfilm"", ""logo_path"": ""/xenuUvcunUNpbaDOYGhWZERaym7.png"", ""origin_country"": ""SU""}]","[{""name"": ""Soviet Union"", ""iso_3166_1"": ""SU""}]","[{""name"": ""беларуская мова"", ""iso_639_1"": ""be"", ""english_name"": ""Belarusian""}, {""name"": ""Deutsch"", ""iso_639_1"": ""de"", ""english_name"": ""German""}, {""name"": ""Pусский"", ""iso_639_1"": ""ru"", ""english_name"": ""Russian""}]",2025-11-28 04:21:21.690942
157336,Interstellar,The adventures of a group of explorers who make use of a newly discovered wormhole to surpass the limitations on human space travel and conquer the vast distances involved in an interstellar voyage.,2014-11-05,36.048,38293,8.463,/gEU2QniE6E77NI6lCU6MxlNBvIx.jpg,/5XNQBqnBwPA9yT0jZ0p3s8bbLh0.jpg,en,"[{""id"": 12, ""name"": ""Adventure""}, {""id"": 18, ""name"": ""Drama""}, {""id"": 878, ""name"": ""Science Fiction""}]",169,165000000,746606706,http://www.interstellarmovie.net/,Mankind was born on Earth. It was never meant to die here.,Released,tt0816692,"[{""id"": 923, ""name"": ""Legendary Pictures"", ""logo_path"": ""/5UQsZrfbfG2dYJbx8DxfoTr2Bvu.png"", ""origin_country"": ""US""}, {""id"": 9996, ""name"": ""Syncopy"", ""logo_path"": ""/3tvBqYsBhxWeHlu62SIJ1el93O7.png"", ""origin_country"": ""GB""}, {""id"": 13769, ""name"": ""Lynda Obst Productions"", ""logo_path"": null, ""origin_country"": ""US""}]","[{""name"": ""United Kingdom"", ""iso_3166_1"": ""GB""}, {""name"": ""United States of America"", ""iso_3166_1"": ""US""}]","[{""name"": ""English"", ""iso_639_1"": ""en"", ""english_name"": ""English""}]",2025-11-28 04:21:21.690942
106646,The Wolf of Wall Street,"A New York stockbroker refuses to cooperate in a large securities fraud case involving corruption on Wall Street, corporate banking world and mob infiltration. Based on Jordan Belfort's autobiography.",2013-12-25,19.4784,25199,8.027,/kW9LmvYHAaS9iA0tHmZVq8hQYoq.jpg,/7Nwnmyzrtd0FkcRyPqmdzTPppQa.jpg,en,"[{""id"": 80, ""name"": ""Crime""}, {""id"": 18, ""name"": ""Drama""}, {""id"": 35, ""name"": ""Comedy""}]",180,100000000,407038432,http://www.thewolfofwallstreet.com/,Earn. Spend. Party.,Released,tt0993846,"[{""id"": 19177, ""name"": ""Red Granite Pictures"", ""logo_path"": null, ""origin_country"": ""US""}, {""id"": 562, ""name"": ""Appian Way"", ""logo_path"": ""/azANEzu3H3Kztzt63sdjvlzxhuB.png"", ""origin_country"": ""US""}, {""id"": 23243, ""name"": ""Sikelia Productions"", ""logo_path"": ""/cBPyrhXhGKzxUdL4Fkg801HZ4W.png"", ""origin_country"": ""US""}, {""id"": 14654, ""name"": ""EMJAG Productions"", ""logo_path"": null, ""origin_country"": ""US""}]","[{""name"": ""United States of America"", ""iso_3166_1"": ""US""}]","[{""name"": ""English"", ""iso_639_1"": ""en"", ""english_name"": ""English""}, {""name"": ""Français"", ""iso_639_1"": ""fr"", ""english_name"": ""French""}]",2025-11-28 04:21:21.690942
155,The Dark Knight,"Batman raises the stakes in his war on crime. With the help of Lt. Jim Gordon and District Attorney Harvey Dent, Batman sets out to dismantle the remaining criminal organizations that plague the streets. The partnership proves to be effective, but they soon find themselves prey to a reign of chaos unleashed by a rising criminal mastermind known to the terrified citizens of Gotham as the Joker.",2008-07-16,23.9,34746,8.525,/qJ2tW6WMUDux911r6m7haRef0WH.jpg,/dqK9Hag1054tghRQSqLSfrkvQnA.jpg,en,"[{""id"": 18, ""name"": ""Drama""}, {""id"": 28, ""name"": ""Action""}, {""id"": 80, ""name"": ""Crime""}, {""id"": 53, ""name"": ""Thriller""}]",152,185000000,1004558444,https://www.warnerbros.com/movies/dark-knight/,Welcome to a world without rules.,Released,tt0468569,"[{""id"": 174, ""name"": ""Warner Bros. Pictures"", ""logo_path"": ""/ingPVoHnINIrFR7WHmYux1f5pES.png"", ""origin_country"": ""US""}, {""id"": 923, ""name"": ""Legendary Pictures"", ""logo_path"": ""/5UQsZrfbfG2dYJbx8DxfoTr2Bvu.png"", ""origin_country"": ""US""}, {""id"": 9996, ""name"": ""Syncopy"", ""logo_path"": ""/3tvBqYsBhxWeHlu62SIJ1el93O7.png"", ""origin_country"": ""GB""}, {""id"": 429, ""name"": ""DC"", ""logo_path"": ""/4Y00XuSMuP1gimd0jP6JT57QbCI.png"", ""origin_country"": ""US""}]","[{""name"": ""United Kingdom"", ""iso_3166_1"": ""GB""}, {""name"": ""United States of America"", ""iso_3166_1"": ""US""}]","[{""name"": ""English"", ""iso_639_1"": ""en"", ""english_name"": ""English""}, {""name"": ""普通话"", ""iso_639_1"": ""zh"", ""english_name"": ""Mandarin""}]",2025-11-28 04:21:21.690942
670,Oldboy,"With no clue how he came to be imprisoned, drugged and tortured for 15 years, a desperate man seeks revenge on his captors.",2003-11-21,10.9101,9369,8.246,/pWDtjs568ZfOTMbURQBYuT4Qxka.jpg,/sdwjQEM869JFwMytTmvr6ggvaUl.jpg,ko,"[{""id"": 18, ""name"": ""Drama""}, {""id"": 53, ""name"": ""Thriller""}, {""id"": 9648, ""name"": ""Mystery""}, {""id"": 28, ""name"": ""Action""}]",120,3000000,17500000,"","15 years of imprisonment, five days of vengeance.",Released,tt0364569,"[{""id"": 399, ""name"": ""Show East"", ""logo_path"": null, ""origin_country"": ""KR""}, {""id"": 118802, ""name"": ""Egg Film"", ""logo_path"": null, ""origin_country"": ""KR""}, {""id"": 685, ""name"": ""Cineclick Asia"", ""logo_path"": null, ""origin_country"": ""KR""}]","[{""name"": ""South Korea"", ""iso_3166_1"": ""KR""}]","[{""name"": ""한국어/조선말"", ""iso_639_1"": ""ko"", ""english_name"": ""Korean""}]",2025-11-28 04:21:21.690942
671,Harry Potter and the Philosopher's Stone,"Harry Potter has lived under the stairs at his aunt and uncle's house his whole life. But on his 11th birthday, he learns he's a powerful wizard—with a place waiting for him at the Hogwarts School of Witchcraft and Wizardry. As he learns to harness his newfound powers with the help of the school's kindly headmaster, Harry uncovers the truth about his parents' deaths—and about the villain who's to blame.",2001-11-16,27.0243,28839,7.899,/wuMc08IPKEatf9rnMNXvIDxqP4W.jpg,/bfh9Z3Ghz4FOJAfLOAhmc3ccnHU.jpg,en,"[{""id"": 12, ""name"": ""Adventure""}, {""id"": 14, ""name"": ""Fantasy""}]",152,125000000,976475550,https://www.warnerbros.com/movies/harry-potter-and-sorcerers-stone,Let the magic begin.,Released,tt0241527,"[{""id"": 174, ""name"": ""Warner Bros. Pictures"", ""logo_path"": ""/ingPVoHnINIrFR7WHmYux1f5pES.png"", ""origin_country"": ""US""}, {""id"": 437, ""name"": ""Heyday Films"", ""logo_path"": ""/nu20mtwbEIhUNnQ5NXVhHsNknZj.png"", ""origin_country"": ""GB""}, {""id"": 436, ""name"": ""1492 Pictures"", ""logo_path"": ""/A7WCkG3F0NFvjGCwUnclpGdIu9E.png"", ""origin_country"": ""US""}]","[{""name"": ""United Kingdom"", ""iso_3166_1"": ""GB""}, {""name"": ""United States of America"", ""iso_3166_1"": ""US""}]","[{""name"": ""English"", ""iso_639_1"": ""en"", ""english_name"": ""English""}]",2025-11-28 04:21:21.690942
